### ISSUE TITLE
Weave can negotiate MTU sizes that are too small for Linux

### ISSUE THREAD

**Issue by bboreham** [weaveworks/weave#1107]
Evidence:

````
weave 2015/07/09 08:07:02.804486 EMSGSIZE on send, expecting PMTU update (IP packet was 60064 bytes, payload was 60056 bytes)
weave 2015/07/09 08:07:02.804552 ->[80.152.241.31:25623|da:08:ed:d4:49:31(boot2docker)]: Effective PMTU set to 1438
weave 2015/07/09 08:07:02.814692 EMSGSIZE on send, expecting PMTU update (IP packet was 1480 bytes, payload was 1472 bytes)
weave 2015/07/09 08:07:02.814715 ->[80.152.241.31:25623|da:08:ed:d4:49:31(boot2docker)]: Effective PMTU set to 1426
weave 2015/07/09 08:07:02.885650 EMSGSIZE on send, expecting PMTU update (IP packet was 1468 bytes, payload was 1460 bytes)
weave 2015/07/09 08:07:02.885688 ->[80.152.241.31:25623|da:08:ed:d4:49:31(boot2docker)]: Effective PMTU set to 1422
weave 2015/07/09 08:07:12.812633 Peer da:08:ed:d4:49:31(boot2docker) moved from true to 80.152.241.31:23844
weave 2015/07/09 08:07:22.804784 Peer da:08:ed:d4:49:31(boot2docker) moved from true to 80.152.241.31:58782
weave 2015/07/09 08:07:24.064417 ->[80.152.241.31:25623|da:08:ed:d4:49:31(boot2docker)]: Effective PMTU set to 183
weave 2015/07/09 08:07:24.064443 ->[80.152.241.31:25623|da:08:ed:d4:49:31(boot2docker)]: Effective PMTU verified at 183
weave 2015/07/09 08:16:49.405847 Discovered remote MAC 8e:26:b1:f7:96:88 at da:08:ed:d4:49:31(boot2docker)
weave 2015/07/09 08:16:49.544373 Sending ICMP 3,4 (10.64.0.3 -> 10.64.0.2): PMTU= 183
weave 2015/07/09 08:16:49.544460 Sending ICMP 3,4 (10.64.0.3 -> 10.64.0.2): PMTU= 183
weave 2015/07/09 08:16:49.544491 Sending ICMP 3,4 (10.64.0.3 -> 10.64.0.2): PMTU= 183
weave 2015/07/09 08:16:49.544520 Sending ICMP 3,4 (10.64.0.3 -> 10.64.0.2): PMTU= 183
weave 2015/07/09 08:16:49.544559 Sending ICMP 3,4 (10.64.0.3 -> 10.64.0.2): PMTU= 183
weave 2015/07/09 08:16:49.544592 Sending ICMP 3,4 (10.64.0.3 -> 10.64.0.2): PMTU= 183
````

Looking at packets using `tcpdump`, we see Linux is ignoring our 183-byte limit and sending packets of 552 bytes, which is 512 plus the 40-byte TCP header:

````
    pandora.weave.local.9042 > cli-test.weave.local.34517: Flags [.], cksum 0x1204 (correct), seq 196:696, ack 327, win 342, options [nop,nop,TS val 863080443 ecr 3493719], length 500
10:03:04.561944 IP (tos 0x0, ttl 64, id 59620, offset 0, flags [DF], proto TCP (6), length 552)
    pandora.weave.local.9042 > cli-test.weave.local.34517: Flags [.], cksum 0x4540 (correct), seq 696:1196, ack 327, win 342, options [nop,nop,TS val 863080443 ecr 3493719], length 500
10:03:04.561967 IP (tos 0x0, ttl 64, id 59621, offset 0, flags [DF], proto TCP (6), length 552)
    pandora.weave.local.9042 > cli-test.weave.local.34517: Flags [.], cksum 0x3a07 (correct), seq 1196:1696, ack 327, win 342, options [nop,nop,TS val 863080443 ecr 3493719], length 500
10:03:04.561972 IP (tos 0x0, ttl 64, id 59622, offset 0, flags [DF], proto TCP (6), length 552)
    pandora.weave.local.9042 > cli-test.weave.local.34517: Flags [.], cksum 0x11f5 (correct), seq 1696:2196, ack 327, win 342, options [nop,nop,TS val 863080443 ecr 3493719], length 500
````

Background reading: http://cschramm.blogspot.co.uk/2012/12/why-does-linux-enforce-minimum-mtu-of.html

I suggest that, if weave finds itself with an MTU lower than 552, it should drop the connection.

**Comment by rade** [comment]
We've seen MTU negotiation weirdness before, in #469.

**Comment by dpw** [comment]
> I suggest that, if weave finds itself with an MTU lower than 552, it should drop the connection.

Maybe I'm misunderstanding your suggestion, but won't this just lead to a reconnection cycle?

**Comment by bboreham** [comment]
If the cause of the low MTU is transient, then disconnecting and reconnecting will fix the problem.  If the cause is persistent, then the cycle of connects and disconnects may draw attention to the problem.  Weave behaves similarly if peers have a very different clock time, or a different --ipalloc-range setting, and in a host of other cases.

**Comment by dpw** [comment]
I assumed that those reconnection behaviours were due to oversight rather than deliberately poor handling of error conditions.

We can handle transient low MTUs by restarting PMTU discovery after a while.  We don't need to tear down the connection to do that.

**Comment by bboreham** [comment]
But the connection is practically useless for as long as its MTU remains below 552.  If we don't break the connection then we need (a) logic to avoid transmitting packets over a useless connection and (b) a new way to surface such conditions to the user.

**Comment by dpw** [comment]
The connection is practically useless in any case, no?  When the kernel drops the MTU on the underlying network to 552, weave will come up with an effective MTU for the overlay network of less than 552, and report this back to the kernel via frag-needed responses, but they get ignored because they are less than 552.  What can we do except wait for the MTU issue to resolve itself?

(I am going on my memories of #469 here.  I haven't looked at your user's situation carefully enough to be confident it corresponds. I'm not sure where 183 comes from.)

How to surface such conditions to the user? Log them! Avoiding all the noise about reconnections will make it easier to notice the log entries which say what is actually going on.

It would also be nice to show more connection state info in `weave status` and other UIs, but that's a separate issue.

**Comment by bboreham** [comment]
I don't know where 183 came from either, but it was the number that weave arrived at for this particular installation on this particular day.  Shutting down everything and restarting apparently cleared the issue.

**Comment by i-am-the-slime** [comment]
Yes it did.

**Comment by rade** [comment]
As of #1926 we are no longer negotiating too small MTUs. I have raised #1981 for generally improving diagnostics/reporting of data plane connectivity issues.
