### ISSUE TITLE
Modifying weave pod template results in brief networking connectivity issues for pods on the same node as the weave daemonset being restarted

### ISSUE THREAD

**Issue by bjhaid** [weaveworks/weave#3073]
## What you expected to happen?
Modifying weave daemonset podtemplate should not result in traffic loss for pods on the host Nodes.

## What happened?
Any change to the weave pod template that causes weave to download the docker image results in the network connectivity problems for all the pods running on the host node.

We observed the below iptables rules were being deleted:
```
-A WEAVE-IPSEC-IN -s 10.4.208.30/32 -d 10.4.208.39/32 -p udp -m udp --dport 6784 -m mark ! --mark 0x20000/0x20000 -j DROP
-A WEAVE-IPSEC-IN -s 10.4.208.31/32 -d 10.4.208.39/32 -p esp -m esp --espspi 1154092925 -j WEAVE-IPSEC-IN-MARK           
-A WEAVE-IPSEC-OUT -s 10.4.208.39/32 -d 10.4.208.30/32 -p udp -m udp --dport 6784 -j WEAVE-IPSEC-OUT-MARK 
```

## How to reproduce it?
Delete weave docker image on a k8s node, update the pod template section of a weave yaml and kubectl apply the file

## Anything else we need to know?
Running Kubernetes

## Versions:
```
$ weave version
1.9.4 (tried 1.9.5 and 1.9.6)
$ docker version
Client:
 Version:      1.13.0
 API version:  1.25
 Go version:   go1.7.3
 Git commit:   49bf474
 Built:        Tue Jan 17 09:44:08 2017
 OS/Arch:      linux/amd64

Server:
 Version:      1.13.0
 API version:  1.25 (minimum version 1.12)
 Go version:   go1.7.3
 Git commit:   49bf474
 Built:        Tue Jan 17 09:44:08 2017
 OS/Arch:      linux/amd64
 Experimental: false
$ uname -a 
Linux kube-worker04.qa.braintreepayments.com 4.4.0-1-amd64 #1 SMP Debian 4.4.43-1 (2017-01-30) x86_64 GNU/Linux
$ kubectl version
Client Version: version.Info{Major:"1", Minor:"7", GitVersion:"v1.7.0", GitCommit:"d3ada0119e776222f11ec7945e6d860061339aad", GitTreeState:"clean", BuildDate:"2017-06-29T23:15:59Z", GoVersion:"go1.8.3", Compiler:"gc", Platform:"linux/amd64"}
Server Version: version.Info{Major:"1", Minor:"7", GitVersion:"v1.7.0", GitCommit:"d3ada0119e776222f11ec7945e6d860061339aad", GitTreeState:"clean", BuildDate:"2017-06-29T22:55:19Z", GoVersion:"go1.8.3", Compiler:"gc", Platform:"linux/amd64"}
```

**Comment by bjhaid** [comment]
I spoke to @bboreham on k8s #sig-network slack and he asked me to open this issue

**Comment by bjhaid** [comment]
I also forgot to mention we have `WEAVE_PASSWORD` and `IP_ALLOC` set, but I assume both of those should be obvious from the iptables rules

**Comment by brb** [comment]
Did the connectivity disruption happen between the pods running on the same host, or running on different hosts?

If the latter case, then it can happen due to the following:

1. https://github.com/weaveworks/weave/blob/v2.0.1/net/ipsec/ipsec.go#L252 (with `destroy=true`) gets called when the `weaver` process terminates which is due to the upgrade. The `Flush` method removes XFRM policies and states first, and then the related iptables rules and chains. So, in-between the XFRM and iptables removals no traffic is allowed between the hosts. (I'm starting to think maybe we should call `Flush` only upon `weave reset`, however it does not help in the k8s case.)
2. fastdp flows are removed when either host detects that the other host went down.

**Comment by bjhaid** [comment]
> Did the connectivity disruption happen between the pods running on the same host, or running on different hosts?

I can try investigating and report back, I do think it's different hosts but I'll verify.

If it's the latter case what do you advice we do in this regards?

We are considering running as a systemd daemon on every of our worker nodes instead of being a daemonset in k8s, that way we can cordon off the worker before conducting an upgrade of weave

**Comment by bjhaid** [comment]
@brb I am yet to investigate, but I think this:

https://twitter.com/mikemetral/status/889551203977187328

especially this:

> -New DS strategy: start new instance before Pod termination

should help with this problem, can you think of possible problems that can be introduced with running multiple instances of weave on the same host

**Comment by bboreham** [comment]
@bjhaid Weave Net is not engineered to run multiple instances on one host; there can be only one.

However I am interested to drill further into the disruption you reported - we expect traffic to stop for a few seconds and then resume, but I think on Slack you were saying you got more noticeable failures.

**Comment by bjhaid** [comment]
@bboreham the failures where mostly due to dns lookups failing and the containers rely heavily on DNS resolution, hence the significant disruption whenever we need to pull the image

**Comment by bboreham** [comment]
Do you know how long the gap is in traffic, and how the DNS clients retry?

**Comment by bjhaid** [comment]
> Do you know how long the gap is in traffic

No exactly but things go back to normal once weave is completely rolled out.

> how the DNS clients retry?

I really don't know but I can dig around, this is all probably wrapped in some library that times out on calls to glibc's `getaddrinfo` but can also vary from the language/stack to stack

**Comment by bboreham** [comment]
glibc default is to retry twice with 5-second gaps, so total 15 seconds.  If the time Weave Net is down is more than a fraction of that then I'd say find out why.

**Comment by bboreham** [comment]
>  things go back to normal once weave is completely rolled out.

wait, you are saying the disruption lasts until it finishes across the whole cluster, not just one host at a time?

**Comment by bjhaid** [comment]
> wait, you are saying the disruption lasts until it finishes across the whole cluster, not just one host at a time?

Roughly yes, things crashing on different hosts for network reasons

**Comment by bboreham** [comment]
OK, we need to drill into "for network reasons".  I expect some packet loss, maybe for 1-2 seconds, on one node at a time as it restarts, with all of that being hidden by retries at a higher level.

Can you give any detail on the timing - start of update on cluster, start of update on one node, end of update on that node, and how that relates to errors raised on that node or other nodes, and what exactly those errors are?

**Comment by bjhaid** [comment]
@bboreham I'll ensure gathering all of these data is prioritize and get back to you asap. thanks for helping look

**Comment by bjhaid** [comment]
I have some data points for you,

Failures from tcpdump, note `192.168.255.10` is the service ip for kube-dns

```
21:55:24.518135 IP 192.168.255.10 > 192.168.62.1: ICMP host 192.168.255.10 unreachable, length 92
21:55:24.518142 IP 192.168.255.10 > 192.168.62.1: ICMP host 192.168.255.10 unreachable, length 92
21:55:24.538127 IP 192.168.255.10 > 192.168.62.1: ICMP host 192.168.255.10 unreachable, length 92
21:55:24.538134 IP 192.168.255.10 > 192.168.62.1: ICMP host 192.168.255.10 unreachable, length 92
21:55:24.538148 IP 192.168.255.10 > 192.168.62.1: ICMP host 192.168.255.10 unreachable, length 92
21:55:24.538152 IP 192.168.255.10 > 192.168.62.1: ICMP host 192.168.255.10 unreachable, length 92
21:55:24.538158 IP 192.168.255.10 > 192.168.62.1: ICMP host 192.168.255.10 unreachable, length 92
```

```
21:55:28.630247 IP 192.168.255.10 > 192.168.62.1: ICMP host 192.168.255.10 unreachable, length 92
21:55:28.630251 IP 192.168.255.10 > 192.168.62.1: ICMP host 192.168.255.10 unreachable, length 92
21:55:29.467461 ARP, Request who-has 192.168.32.2 tell 192.168.38.1, length 28
21:55:29.542136 IP 192.168.255.10 > 192.168.62.1: ICMP host 192.168.255.10 unreachable, length 92
21:55:29.542143 IP 192.168.255.10 > 192.168.62.1: ICMP host 192.168.255.10 unreachable, length 92
21:55:29.542149 IP 192.168.255.10 > 192.168.62.1: ICMP host 192.168.255.10 unreachable, length 92
21:55:29.542153 IP 192.168.255.10 > 192.168.62.1: ICMP host 192.168.255.10 unreachable, length 92
21:55:29.542158 IP 192.168.255.10 > 192.168.62.1: ICMP host 192.168.255.10 unreachable, length 92
```

```
21:55:32.466173 IP 192.168.255.10 > 192.168.62.1: ICMP host 192.168.255.10 unreachable, length 68
```

```
21:55:34.526160 IP 192.168.255.10 > 192.168.62.1: ICMP host 192.168.255.10 unreachable, length 68
21:55:34.526168 IP 192.168.255.10 > 192.168.62.1: ICMP host 192.168.255.10 unreachable, length 68
21:55:34.526174 IP 192.168.255.10 > 192.168.62.1: ICMP host 192.168.255.10 unreachable, length 68
21:55:34.526178 IP 192.168.255.10 > 192.168.62.1: ICMP host 192.168.255.10 unreachable, length 68
21:55:34.526184 IP 192.168.255.10 > 192.168.62.1: ICMP host 192.168.255.10 unreachable, length 68
21:55:34.526188 IP 192.168.255.10 > 192.168.62.1: ICMP host 192.168.255.10 unreachable, length 68
```

```
21:55:37.626163 IP 192.168.255.10 > 192.168.62.1: ICMP host 192.168.255.10 unreachable, length 86
21:55:37.626168 IP 192.168.255.10 > 192.168.62.1: ICMP host 192.168.255.10 unreachable, length 86
21:55:37.917620 ARP, Request who-has 192.168.32.2 tell 192.168.38.1, length 28
21:55:38.586150 IP 192.168.255.10 > 192.168.62.1: ICMP host 192.168.255.10 unreachable, length 86
21:55:38.586156 IP 192.168.255.10 > 192.168.62.1: ICMP host 192.168.255.10 unreachable, length 86
21:55:38.586162 IP 192.168.255.10 > 192.168.62.1: ICMP host 192.168.255.10 unreachable, length 86
21:55:38.586166 IP 192.168.255.10 > 192.168.62.1: ICMP host 192.168.255.10 unreachable, length 86
21:55:38.586170 IP 192.168.255.10 > 192.168.62.1: ICMP host 192.168.255.10 unreachable, length 86
21:55:38.586174 IP 192.168.255.10 > 192.168.62.1: ICMP host 192.168.255.10 unreachable, length 86
```

```
21:55:40.914160 IP 192.168.255.10 > 192.168.62.1: ICMP host 192.168.255.10 unreachable, length 86
21:55:40.914164 IP 192.168.255.10 > 192.168.62.1: ICMP host 192.168.255.10 unreachable, length 86
21:55:40.914169 IP 192.168.255.10 > 192.168.62.1: ICMP host 192.168.255.10 unreachable, length 112
21:55:40.914173 IP 192.168.255.10 > 192.168.62.1: ICMP host 192.168.255.10 unreachable, length 112
21:55:40.914179 IP 192.168.255.10 > 192.168.62.1: ICMP host 192.168.255.10 unreachable, length 102
21:55:40.914182 IP 192.168.255.10 > 192.168.62.1: ICMP host 192.168.255.10 unreachable, length 102
```

From start to end of downloading the image took at best 35 seconds, I have other iterations, we might be able to improve this on our end by pre-fetching the images with `docker pull`

```
Thu Jul 27 21:55:02 UTC 2017
Thu Jul 27 21:55:37 UTC 2017
```

Let me know if you find this useful? Thanks!

**Comment by bjhaid** [comment]
My testing technique is to run apache bench against of one our services (to generate enough traffic to detect errors) then kick off a weave upgrade. On the host where the service pod is running I run:

`watch -g 'docker ps --format "table {{.Image}}" | grep weave-' && echo $(date) >> foo1.txt`

once that exits(means the weave container just got stopped on that host) I start a tcpdump in the container running the service and also rerun the command, when it exits again means the container has been started. So that gives me approximate start and stop time of the weave containers.

From the tcpdump it seems ICMP host unreach (which maps to errno `EHOSTUNREACH`) was returned about 3 seconds even after the container was started, is this expected?

**Comment by bjhaid** [comment]
I want to also point out that in between the `EHOSTUNREACH` there were successful request to external service IPs, so I think it's only pods running on a different host that connectivity failed to

**Comment by bjhaid** [comment]
I also just verified that requests to pod on the same host goes fine in this period

**Comment by bjhaid** [comment]
@bboreham ping

**Comment by brb** [comment]
> From the tcpdump it seems ICMP host unreach (which maps to errno EHOSTUNREACH) was returned about 3 seconds even after the container was started, is this expected?

I'd say this is expected, as It takes some time for weave to start and to connect to remote peers. Do you have docker logs of the latest weave-net container?

Also, would you mind pre-fetching the weave image before running the upgrade on each host and re-running your tests? Thanks.

**Comment by bjhaid** [comment]
> Do you have docker logs of the latest weave-net container?

I can try to get the logs for the containers that were created during the experiments, do you have anything specific you want me to look for in the logs?

> Also, would you mind pre-fetching the weave image before running the upgrade on each host and re-running your tests? 

This is an additional operational overhead but it's a worthy compromise.

Thanks!

**Comment by brb** [comment]
> I can try to get the logs for the containers that were created during the experiments, do you have anything specific you want me to look for in the logs?

I just want to see timings of weave bootstrapping steps. So, providing the whole log would be the best.

**Comment by rade** [comment]
We seem to have reached a dead end in the investigation here. -> closing
