### ISSUE TITLE
TCP/UDP failing when using plugin with WEAVE_NO_FASTDP

### ISSUE THREAD

**Issue by deitch** [weaveworks/weave#2354]
2 hosts source1@10.99.101.129 and target1@10.99.101.131 running on CentOS 7, latest version of weave on both hosts:

````
[root@target1 ~]# weave version
weave script 1.5.2
weave router 1.5.2
weave proxy  1.5.2
weave plugin 1.5.2
````

* weave with fastdp: WORKS 
* weave with sleeve mode: 
  * containers on the same host: WORKS
  * containers on different hosts: FAILS. icmp ping is fine, but tcp and udp packets do not respond.

It is not firewalld:

1. I added 192.168.0.0/16 that weave is using to trusted zones
2. I ran `watch -n 2 -d iptables -nvL FORWARD` and `watch -n 2 -d iptables -nvL INPUT` and see the packets accepted (whereas they were rejected before I added 192.168.0.0/16 to the trusted zone)

I have netserver running on port 7002 in container address 192.168.0.1 on target1, and am trying to reach it from container address 192.168.128.0 on source1. Oddly, here is what I see what I run tcpdump on either container while doing the simple `telnet 192.168.0.1 7002`:

````
16:21:48.499767 IP 192.168.128.0.36558 > 192.168.0.1.7002: Flags [S], seq 2020838195, win 27400, options [mss 1370,sackOK,TS val 1552792 ecr 0,nop,wscale 8], length 0
16:21:48.501464 IP 192.168.0.1.7002 > 192.168.128.0.36558: Flags [S.], seq 1921444052, ack 2020838196, win 43690, options [mss 65495,sackOK,TS val 1476106 ecr 1549786,nop,wscale 8]
````

`SYN` -> `SYN-ACK` -> (nothing)

If I strace the net server process, I see it waiting on the file description. It never responds, which means that the kernel never establishes the TCP connection to hand back to it.

Even if I stop firewalld entirely, I still have the same issue.

What basic thing am I missing here? Why is it not sending the final `ACK`? And even tcpdump on source1 is seeing the `SYN-ACK`, but not responding? Shouldn't the kernel be doing this?

**Comment by bboreham** [comment]
OK, so I think you said 10.99.101.x are your host addresses and 192.168.0.0/16 are your container addresses.

Any firewall rules should apply to the host addresses; Weave encapsulates the containers' packets so the firewall will see them as from and to host addresses.

Weave uses ports 6783 TCP / 6784 UDP for fastdp and 6783 TCP / 6783 UDP for sleeve.  Since you have one and not the other I would double-check 6783 UDP  first.

Failing that, please could we see the logs from `docker logs weave` on both hosts.  If they're very long, just the first hundred lines or so.

**Comment by rade** [comment]
`weave status connections` would be useful too. See https://www.weave.works/docs/net/latest/troubleshooting/#weave-status-connections for an explanation of the output.

**Comment by deitch** [comment]
Hi @bboreham and @rade and thanks for stepping in. 

Correct, 10.99.101.128/5 is the private IP range for the two hosts, and I allocated 192.168.0.0/16 for the container IPs.

I see the SYN packets (and usually the SYN-ACK as well) going between without a problem, and no firewall DROP/REJECT rules triggered, primarily because *both* 10.0.0.0/8 *and* 192.168.0.0/16 are in the `trusted` zone. But even if I disable the firewall completely, I still have the same problem.

The host pair is doing other stuff at the moment; I will reconnect and rerun `weave status connections` and `docker logs weave` soon.

I am so confused. Isn't this basic Unix stuff? I should be able to get it.

Unfortunately, Linux kernel tracing like `function` and `ftrace` do not work inside containers, and `dtrace` is not available...

**Comment by bboreham** [comment]
Tracing functions generally work from the outside; containers are just processes.

E.g. I just tried:

    sudo strace -p $(docker inspect -f {{.State.Pid}} weave)

**Comment by deitch** [comment]
Yeah, I did exactly that, which is how I knew that the kernel never handed the connection off to the `telnet` process. I meant some of the ftrace and other abilities to trace the packet through the kernel itself. strace only lists syscalls by the user-space process.

**Comment by deitch** [comment]
Is there a weave launch option that tells it to be more verbose for the logs?

**Comment by bboreham** [comment]
`--log-level=debug`; see https://www.weave.works/docs/net/latest/troubleshooting/

**Comment by deitch** [comment]
Thx

**Comment by bboreham** [comment]
I should perhaps note that in "sleeve" mode you will typically get some log for every packet, notwithstanding what it says about `--pktdebug` in the docs.

**Comment by deitch** [comment]
OK, finished up the other work.

I am rerunning now in fast-datapath mode, just to have a correct baseline. Then will run with sleeve and debug.

**Comment by deitch** [comment]
Sorry, this is going to be a bit. Docker misbehaves if it is set to support clusters, and etcd behind it is behaving badly. I know I don't need it for weave, but if it messes up docker daemon...

**Comment by deitch** [comment]
OK, I have fast-datapath confirmed as working. Now going to run sleeve with debugging as you suggested.

**Comment by deitch** [comment]
Nothing in the logs when I make a tcp connection or ping:

````
DEBU: 2016/06/10 11:00:27.764850 sleeve ->[10.99.101.129:6783|96:09:be:8a:53:0f(source1)]: handleHeartbeat
DEBU: 2016/06/10 11:00:27.765431 sleeve ->[10.99.101.129:6783|96:09:be:8a:53:0f(source1)]: sendHeartbeat
DEBU: 2016/06/10 11:00:37.240486 [allocator 6a:2d:57:e1:77:e2]: Allocator.OnGossip: 648 bytes
DEBU: 2016/06/10 11:00:37.765006 sleeve ->[10.99.101.129:6783|96:09:be:8a:53:0f(source1)]: handleHeartbeat
DEBU: 2016/06/10 11:00:37.765668 sleeve ->[10.99.101.129:6783|96:09:be:8a:53:0f(source1)]: sendHeartbeat
````

tcpdump inside the receiver container shows only SYN packets:

````
11:01:11.570695 IP 192.168.128.0.35575 > e8f1080eaef4.7002: Flags [S], seq 419293438, win 43690, options [mss 65495,sackOK,TS val 22024468 ecr 0,nop,wscale 8], length 0
11:01:12.572394 IP 192.168.128.0.35575 > e8f1080eaef4.7002: Flags [S], seq 419293438, win 43690, options [mss 65495,sackOK,TS val 22025470 ecr 0,nop,wscale 8], length 0
````

And connections and peers:

````
[root@target1 weave-sleeve]# weave status peers
6a:2d:57:e1:77:e2(target1)
   <- 10.99.101.129:45024   96:09:be:8a:53:0f(source1)            established
96:09:be:8a:53:0f(source1)
   -> 10.99.101.131:6783    6a:2d:57:e1:77:e2(target1)            established
[root@target1 weave-sleeve]# weave status connections
<- 10.99.101.129:45024   established sleeve 96:09:be:8a:53:0f(source1)
````

Firewall config:

````
[root@target1 weave-sleeve]# firewall-cmd --list-all-zones
block
  interfaces:
  sources:
  services:
  ports:
  masquerade: no
  forward-ports:
  icmp-blocks:
  rich rules:

dmz
  interfaces:
  sources:
  services: ssh
  ports:
  masquerade: no
  forward-ports:
  icmp-blocks:
  rich rules:

drop
  interfaces:
  sources:
  services:
  ports:
  masquerade: no
  forward-ports:
  icmp-blocks:
  rich rules:

external
  interfaces:
  sources:
  services: ssh
  ports:
  masquerade: yes
  forward-ports:
  icmp-blocks:
  rich rules:

home
  interfaces:
  sources:
  services: dhcpv6-client ipp-client mdns samba-client ssh
  ports:
  masquerade: no
  forward-ports:
  icmp-blocks:
  rich rules:

internal
  interfaces:
  sources:
  services: dhcpv6-client ipp-client mdns samba-client ssh
  ports:
  masquerade: no
  forward-ports:
  icmp-blocks:
  rich rules:

public (default, active)
  interfaces: enp1s0f0 enp1s0f1 team0
  sources:
  services: dhcpv6-client ssh
  ports:
  masquerade: no
  forward-ports:
  icmp-blocks:
  rich rules:

trusted
  interfaces:
  sources: 192.168.0.0/16 10.0.0.0/8
  services:
  ports:
  masquerade: no
  forward-ports:
  icmp-blocks:
  rich rules:

work
  interfaces:
  sources:
  services: dhcpv6-client ipp-client ssh
  ports:
  masquerade: no
  forward-ports:
  icmp-blocks:
  rich rules:
````

What am I missing? Does it matter that there is no layer 2 connection between the hosts? They all sit on an SDN, so the local address is 10.99.101.129/31 with default route 10.99.101.128/31, and 10.99.101.131/32 with default route 10.99.101.130/31.

**Comment by bboreham** [comment]
OK, this:

    [root@target1 weave-sleeve]# weave status connections
     <- 10.99.101.129:45024   established sleeve 96:09:be:8a:53:0f(source1)

ought to mean we saw packets going in both directions.

It's a bit difficult to see what you are doing from the short snippets; could you show the whole transcript from `weave launch` to `ping`, and also throw in an `ip addr show` inside the two containers?

How are you changing from fastdp to sleeve?  I'd advise throwing in a `weave reset` on both ends before starting the test, just in case something is getting left over.

Also it's usually more interesting to see the Weave logs from the top.  Anything that goes wrong in setting up the overlay will go wrong earlier than when you actually send the `ping`.

BTW,

> etcd behind it is behaving badly. I know I don't need it for weave

No, not for Weave Net or Weave Scope.

**Comment by deitch** [comment]
I'm away from the laptop, but I will get the entire setup and transaction put in a gist soon.

I do a full weave reset before each run. 

I don't change from fastdp to sleeve. I stop the containers, weave stop, weave reset, then weave launch with the env var WEAVE_NO_FASTDP

**Comment by deitch** [comment]
Here is a gist with everything, from status before to status after to log output. I did it without `--log-level=debug`. If we need more, I will add it.

https://gist.github.com/deitch/b64da85ab1d700dabc0a662b72da154f

**Comment by deitch** [comment]
EDIT: I updated the gist to show logs for the test both with `--log-level=debug` and without

**Comment by bboreham** [comment]
Thanks for the logs.  For some reason I had not picked up that you said `ping` worked inside the containers.  Also the `weave` logs show everything working fine.  Anyway, the connections and the Weave UDP port must be fine for `ping` to work.

I see you have `netperf` not working.  Could you test something in between that and `ping`, like `nc`?

Also, could you run `tcpdump -n -i weave -c 10` on the sending host, just before you start the sending `netperf` (or `nc`) container?

I tried a publicly available `netperf` image on my set-up:

````
host2:~$ weave reset
host2:~$ WEAVE_NO_FASTDP=true weave launch --ipalloc-range 192.169.0.0/16 192.168.48.11
host2:~$ docker run --name=nn -dt --net=weave paultiplady/netperf netserver -D
c3c1ced66e94e921804a63cf9cb7066d3981b7723ab0a273b3e6f797448e4151
host2:~$ weave ps nn
nn 72:ac:1f:50:7c:0d 192.169.128.0/16
host2:~$ docker logs nn
Starting netserver with host 'IN(6)ADDR_ANY' port '12865' and family AF_UNSPEC
````

````
host1:~$ weave reset
host1:~$ WEAVE_NO_FASTDP=true weave launch --ipalloc-range 192.169.0.0/16 192.168.48.12
host1:~$ docker run -ti --net=weave paultiplady/netperf netperf -H 192.169.128.0
MIGRATED TCP STREAM TEST from 0.0.0.0 (0.0.0.0) port 0 AF_INET to 192.169.128.0 () port 0 AF_INET
Recv   Send    Send                          
Socket Socket  Message  Elapsed              
Size   Size    Size     Time     Throughput  
bytes  bytes   bytes    secs.    10^6bits/sec  

 87380  16384  16384    10.13     171.25  
````

````
host1:~$ sudo tcpdump -n -i weave -c 10
tcpdump: verbose output suppressed, use -v or -vv for full protocol decode
listening on weave, link-type EN10MB (Ethernet), capture size 262144 bytes
15:13:33.044751 IP6 :: > ff02::16: HBH ICMP6, multicast listener report v2, 1 group record(s), length 28
15:13:33.077436 ARP, Request who-has 192.169.128.0 tell 192.169.0.1, length 28
15:13:33.078975 ARP, Reply 192.169.128.0 is-at 72:ac:1f:50:7c:0d, length 28
15:13:33.078984 IP 192.169.0.1.51349 > 192.169.128.0.12865: Flags [S], seq 76088398, win 43690, options [mss 65495,sackOK,TS val 1483434 ecr 0,nop,wscale 6], length 0
15:13:33.080555 IP 192.169.128.0.12865 > 192.169.0.1.51349: Flags [S.], seq 1112743585, ack 76088399, win 43690, options [mss 65495,sackOK,TS val 1478201 ecr 1483434,nop,wscale 6], length 0
15:13:33.080575 IP 192.169.0.1.51349 > 192.169.128.0.12865: Flags [.], ack 1, win 683, options [nop,nop,TS val 1483434 ecr 1478201], length 0
15:13:33.081023 IP 192.169.0.1.51349 > 192.169.128.0.12865: Flags [P.], seq 1:657, ack 1, win 683, options [nop,nop,TS val 1483434 ecr 1478201], length 656
15:13:33.083884 IP 192.169.128.0.12865 > 192.169.0.1.51349: Flags [.], ack 657, win 704, options [nop,nop,TS val 1478201 ecr 1483434], length 0
15:13:33.084025 IP 192.169.128.0.12865 > 192.169.0.1.51349: Flags [P.], seq 1:657, ack 657, win 704, options [nop,nop,TS val 1478202 ecr 1483434], length 656
15:13:33.084063 IP 192.169.0.1.51349 > 192.169.128.0.12865: Flags [.], ack 657, win 704, options [nop,nop,TS val 1483435 ecr 1478202], length 0
10 packets captured
10 packets received by filter
0 packets dropped by kernel
````

**Comment by deitch** [comment]
Sure, I will run netcat (which my laptop keeps auto-correcting to "nectar"...) and tcpdump.

I figure *something* in the environment is off, but I want to know.

I need to go offline for the weekend in ~45 mins, so I will get it done before.

**Comment by deitch** [comment]
Oh, I also tried with just `telnet 192.168.0.1 7002` with the same effect.

I assume it has to have something to do with the underlying host or network fabric setup, but what? Does it care that they are on 2 different L3 domains? They are both in /31 domains, which means 2 addresses.

**Comment by bboreham** [comment]
Weave Net implements a single L2 network, so it doesn't care about IP addresses or anything else above that.  The /31 addresses are at the host level, and we see that all working fine - `ping` is working and no errors in the logs, so any other packets ought to be delivered just as well.

It is possible that something in the host IP stack is blocking your TCP packets. I'd like to see the `tcpdump -i weave` to see what Weave ought to be capturing.

**Comment by deitch** [comment]
gist has been updated. Short form is the SYN goes across, no SYN-ACK. Looks the same on both source and host:

````
[root@target1 ~]# tcpdump -nn -i weave -c 10
tcpdump: WARNING: weave: no IPv4 address assigned
tcpdump: verbose output suppressed, use -v or -vv for full protocol decode
listening on weave, link-type EN10MB (Ethernet), capture size 65535 bytes
12:00:40.751388 IP 192.168.128.0.50404 > 192.168.0.1.4444: Flags [S], seq 2435720889, win 43690, options [mss 65495,sackOK,TS val 39993860 ecr 0,nop,wscale 8], length 0
12:00:41.752899 IP 192.168.128.0.50404 > 192.168.0.1.4444: Flags [S], seq 2435720889, win 43690, options [mss 65495,sackOK,TS val 39994862 ecr 0,nop,wscale 8], length 0
12:00:43.755173 IP 192.168.128.0.50404 > 192.168.0.1.4444: Flags [S], seq 2435720889, win 43690, options [mss 65495,sackOK,TS val 39996864 ecr 0,nop,wscale 8], length 0
````

How strange. What could possible be doing that?

Same response with iptables completely off:

````
[root@source1 ~]# iptables -L
Chain INPUT (policy ACCEPT)
target     prot opt source               destination

Chain FORWARD (policy ACCEPT)
target     prot opt source               destination

Chain OUTPUT (policy ACCEPT)
target     prot opt source               destination
````

````
[root@target1 ~]# iptables -L
Chain INPUT (policy ACCEPT)
target     prot opt source               destination

Chain FORWARD (policy ACCEPT)
target     prot opt source               destination

Chain OUTPUT (policy ACCEPT)
target     prot opt source               destination
````

**Comment by bboreham** [comment]
Can I just check you've not fallen foul of the `nc` parameter tarpit:

    nc -l 4444

works on Ubuntu but doesn't work on Alpine

    nc -l -p 4444

works on both.

**Comment by deitch** [comment]
Really sorry, I had to run, not near my laptop now until Sunday. I will try it. But either way, the lack of any response to the SYN is strange. If nothing is listening on the port, the kernel should send a RST packet, not nothing.

**Comment by deitch** [comment]
Definitely not the `-p` problem. 

1. I retried with `-p` and same result
2. If I start the server container with portmapping (since weave seems to put it on both the docker bridge and the weave bridge), then I can get to it via the host IP no problem.
3. All SYN packets get no response. I can try to connect to any random port, and all I get is SYN, no RST or SYN-ACK or anything. That is the strangest of all.

Summarizing:

1. Firewall makes no difference - disabled, rules, no rules, doesn't matter
2. Everything works with ping
3. Everything works with fastdp
4. TCP and UDP fail
5. There is **no** response to a TCP SYN packet. Not a RST, not a SYN-ACK, nothing

I am stumped. Help?

**Comment by bboreham** [comment]
> Help?

I would love to!  Currently I too am stumped.

What's the likelihood if I set up two Centos 7 hosts on AWS I would get the same environment as you? (i.e., how much do you configure the vanilla install?  can you give me the steps to set up an environment that fails in the same way as yours?)

**Comment by deitch** [comment]
> I would love to! Currently I too am stumped.

I know it. I appreciate the help you have given to date.

> What's the likelihood if I set up two Centos 7 hosts on AWS I would get the same environment as you? 

Not sure. I would need to play with the VPC subnets to get it right. I will try it and if I can replicate there, I will post it here.

How is it remotely possible that it is not responding without SYN-ACK or RST or *something*?

**Comment by deitch** [comment]
Is it possible the kernel somehow does not believe that it actually is hosting that address?

**Comment by bboreham** [comment]
Do you see an arp exchange for the address?  In my transcript that's the first thing that happens.

**Comment by deitch** [comment]
At what level? I had thought in sleeve that all of that was encapsulated in L3 packets?

**Comment by bboreham** [comment]
After the packets are de-encapsulated and injected into the local network stack, so on the `weave` bridge and on the veth for the target container.  

If you do exactly what I did at https://github.com/weaveworks/weave/issues/2354#issuecomment-225215776 then you should see roughly the same `tcpdump` output.  Any differences are of interest.

**Comment by deitch** [comment]
Will redo in a little bit.

**Comment by awh** [comment]
It might be instructive to run your tcpdumps with `-i any` in future to ensure the packets aren't being routed out of an unexpected interface.

**Comment by deitch** [comment]
Redid it exactly as you have it (well, almost; in my case it reversed and put the listener on `.0.1` and the sender on `.128.0` but same idea.

````
[root@source1 ~]# tcpdump -nn -i weave
tcpdump: WARNING: weave: no IPv4 address assigned
tcpdump: verbose output suppressed, use -v or -vv for full protocol decode
listening on weave, link-type EN10MB (Ethernet), capture size 65535 bytes
10:19:27.541105 IP6 :: > ff02::16: HBH ICMP6, multicast listener report v2, 1 group record(s), length 28
10:19:27.578579 ARP, Request who-has 192.169.0.1 tell 192.169.128.0, length 28
10:19:27.579575 ARP, Reply 192.169.0.1 is-at 6a:ef:f9:91:3b:a0, length 28
10:19:27.579582 IP 192.169.128.0.41633 > 192.169.0.1.12865: Flags [S], seq 4019427352, win 43690, options [mss 65495,sackOK,TS val 4254793 ecr 0,nop,wscale 8], length 0
10:19:27.730380 IP6 :: > ff02::1:ff82:f804: ICMP6, neighbor solicitation, who has fe80::7c08:b2ff:fe82:f804, length 24
10:19:28.303351 IP6 :: > ff02::16: HBH ICMP6, multicast listener report v2, 1 group record(s), length 28
10:19:28.581354 IP 192.169.128.0.41633 > 192.169.0.1.12865: Flags [S], seq 4019427352, win 43690, options [mss 65495,sackOK,TS val 4255796 ecr 0,nop,wscale 8], length 0
10:19:28.733382 IP6 fe80::7c08:b2ff:fe82:f804 > ff02::16: HBH ICMP6, multicast listener report v2, 1 group record(s), length 28
10:19:28.733445 IP6 fe80::7c08:b2ff:fe82:f804 > ff02::2: ICMP6, router solicitation, length 16
10:19:29.433305 IP6 fe80::7c08:b2ff:fe82:f804 > ff02::16: HBH ICMP6, multicast listener report v2, 1 group record(s), length 28
10:19:30.585355 IP 192.169.128.0.41633 > 192.169.0.1.12865: Flags [S], seq 4019427352, win 43690, options [mss 65495,sackOK,TS val 4257800 ecr 0,nop,wscale 8], length 0
10:19:32.737136 IP6 fe80::7c08:b2ff:fe82:f804 > ff02::2: ICMP6, router solicitation, length 16
10:19:34.593356 IP 192.169.128.0.41633 > 192.169.0.1.12865: Flags [S], seq 4019427352, win 43690, options [mss 65495,sackOK,TS val 4261808 ecr 0,nop,wscale 8], length 0
10:19:36.745351 IP6 fe80::7c08:b2ff:fe82:f804 > ff02::2: ICMP6, router solicitation, length 16
````

Does the same arp, gets a response, then sends the `SYN` and gets... nothing.

Strange the response below:

````
10:19:27.578579 ARP, Request who-has 192.169.0.1 tell 192.169.128.0, length 28
10:19:27.579575 ARP, Reply 192.169.0.1 is-at 6a:ef:f9:91:3b:a0, length 28
````

I do not know where `6a:ef:f8:91:3b:a0` is. It is not on any of the interfaces on either host, and doesn't show up in the arp tables either (gateways are all `f4:b5:...`)

**Comment by deitch** [comment]
@awh (how'd you get such a short handle?):

Yeah, good idea. Mass of traffic though, so need to filter somehow sanely.

**Comment by deitch** [comment]
@awh I ran it with `-i any` on both source1 and target1, limited to port 12865 (the default netperf port). I see the `SYN` on both sides, no `SYN-ACK` whatsoever.

**Comment by awh** [comment]
> (how'd you get such a short handle?)

Bribery :)

>  I ran it with -i any ... I see the SYN on both sides, no SYN-ACK whatsoever.

We appear to have regressed somewhat - the original report mentions seing `SYN` -> `SYN-ACK` -> (nothing), whereas now we're seeing `SYN` -> (nothing) - is that right? Some more questions:

* When you say 'ran ... on both source1 and target' - I assume you mean inside the respective container netns' - how are you doing that? `docker exec`? `nsenter`?
* How are you launching your containers? `weave run`? `docker run` via the weave proxy? `docker run --net weave`?

**Comment by awh** [comment]
Actually I think I can see from the transcript just above that you're running tcpdump in the container with `docker exec` or `docker run`

**Comment by deitch** [comment]
It gets more interesting:

1. I am seeing more SYN packets on source1's weave network than on target1's weave network. 
2. I am seeing more SYN packets on target1's weave network than in the container.
3. The unknown `6a:ef:...` mac address is just the ethwe0 inside the target container. So at least that is solved.

The above could just be tcpdump weirdness, but:

source1 weave:

````
10:35:14.473528 IP 192.169.128.0.50447 > 192.169.0.1.12865: Flags [S], seq 2371413048, win 43690, options [mss 65495,sackOK,TS val 5201688 ecr 0,nop,wscale 8], length 0
10:35:14.473569 IP 192.169.128.0.50447 > 192.169.0.1.12865: Flags [S], seq 2371413048, win 43690, options [mss 65495,sackOK,TS val 5201688 ecr 0,nop,wscale 8], length 0
10:35:14.473571 IP 192.169.128.0.50447 > 192.169.0.1.12865: Flags [S], seq 2371413048, win 43690, options [mss 65495,sackOK,TS val 5201688 ecr 0,nop,wscale 8], length 0
10:35:15.475214 IP 192.169.128.0.50447 > 192.169.0.1.12865: Flags [S], seq 2371413048, win 43690, options [mss 65495,sackOK,TS val 5202690 ecr 0,nop,wscale 8], length 0
10:35:15.475256 IP 192.169.128.0.50447 > 192.169.0.1.12865: Flags [S], seq 2371413048, win 43690, options [mss 65495,sackOK,TS val 5202690 ecr 0,nop,wscale 8], length 0
10:35:15.475258 IP 192.169.128.0.50447 > 192.169.0.1.12865: Flags [S], seq 2371413048, win 43690, options [mss 65495,sackOK,TS val 5202690 ecr 0,nop,wscale 8], length 0
10:35:17.481145 IP 192.169.128.0.50447 > 192.169.0.1.12865: Flags [S], seq 2371413048, win 43690, options [mss 65495,sackOK,TS val 5204696 ecr 0,nop,wscale 8], length 0
10:35:17.481182 IP 192.169.128.0.50447 > 192.169.0.1.12865: Flags [S], seq 2371413048, win 43690, options [mss 65495,sackOK,TS val 5204696 ecr 0,nop,wscale 8], length 0
10:35:17.481184 IP 192.169.128.0.50447 > 192.169.0.1.12865: Flags [S], seq 2371413048, win 43690, options [mss 65495,sackOK,TS val 5204696 ecr 0,nop,wscale 8], length 0
````

target1 weave:

````
10:35:14.521516 IP 192.169.128.0.50447 > 192.169.0.1.12865: Flags [S], seq 2371413048, win 43690, options [mss 65495,sackOK,TS val 5201688 ecr 0,nop,wscale 8], length 0
10:35:14.521540 IP 192.169.128.0.50447 > 192.169.0.1.12865: Flags [S], seq 2371413048, win 43690, options [mss 65495,sackOK,TS val 5201688 ecr 0,nop,wscale 8], length 0
10:35:15.523070 IP 192.169.128.0.50447 > 192.169.0.1.12865: Flags [S], seq 2371413048, win 43690, options [mss 65495,sackOK,TS val 5202690 ecr 0,nop,wscale 8], length 0
10:35:15.523094 IP 192.169.128.0.50447 > 192.169.0.1.12865: Flags [S], seq 2371413048, win 43690, options [mss 65495,sackOK,TS val 5202690 ecr 0,nop,wscale 8], length 0
10:35:17.529143 IP 192.169.128.0.50447 > 192.169.0.1.12865: Flags [S], seq 2371413048, win 43690, options [mss 65495,sackOK,TS val 5204696 ecr 0,nop,wscale 8], length 0
10:35:17.529169 IP 192.169.128.0.50447 > 192.169.0.1.12865: Flags [S], seq 2371413048, win 43690, options [mss 65495,sackOK,TS val 5204696 ecr 0,nop,wscale 8], length 0
````

inside target1's container:

````
listening on any, link-type LINUX_SLL (Linux cooked), capture size 65535 bytes
14:35:14.521542 IP 192.169.128.0.50447 > 192.169.0.1.12865: Flags [S], seq 2371413048, win 43690, options [mss 65495,sackOK,TS val 5201688 ecr 0,nop,wscale 8], length 0
14:35:15.523096 IP 192.169.128.0.50447 > 192.169.0.1.12865: Flags [S], seq 2371413048, win 43690, options [mss 65495,sackOK,TS val 5202690 ecr 0,nop,wscale 8], length 0
14:35:17.529171 IP 192.169.128.0.50447 > 192.169.0.1.12865: Flags [S], seq 2371413048, win 43690, options [mss 65495,sackOK,TS val 5204696 ecr 0,nop,wscale 8], length 0
14:35:19.536896 ARP, Request who-has 192.169.0.1 tell 192.169.128.0, length 28
14:35:19.536908 ARP, Reply 192.169.0.1 is-at 6a:ef:f9:91:3b:a0, length 28
````

**Comment by awh** [comment]
> I am seeing more SYN packets

Did you take these traces with `-i any`? You will see the same packet reported multiple times as it traverses various interfaces and bridge devices on the host.

**Comment by deitch** [comment]
@awh:

> Bribery :)

Whatever works! :-)

> We appear to have regressed somewhat - the original report mentions seing SYN -> SYN-ACK -> (nothing), whereas now we're seeing SYN -> (nothing) - is that right? 

yes. I do not know how to recreate the SYN->SYN-ACK->(nothing) any more. Right now, all I can get is SYN->(nothing)

> I assume you mean inside the respective container netns'

Yes, mostly `docker exec`. I can easily do `ip netns exec` if you feel it will help in any way.

> How are you launching your containers?

All with `--net=weave` using the CNM plugin.

**Comment by deitch** [comment]
> Did you take these traces with -i any? You will see the same packet reported multiple times as it traverses various interfaces and bridge devices on the host.

Oh, nice! I didn't think of that. Unfortunately, tcpdump doesn't have an option to prepend the name of the interface....

**Comment by deitch** [comment]
You see why I am so frustrated? This *has* to be solvable!

**Comment by awh** [comment]
> yes. I do not know how to recreate the SYN->SYN-ACK->(nothing) any more. Right now, all I can get is SYN->(nothing)

Does ping still work?

> Unfortunately, tcpdump doesn't have an option to prepend the name of the interface....

Yes, that is an annoying deficiency.

> All with --net=weave using the CNM plugin.

Can I see `ip addr show` and `ip route show` inside the two containers?

**Comment by deitch** [comment]
@awh you are right. I ran it with a script to prepend and it shows the various interfaces.

**Comment by deitch** [comment]
For better tcpdump output: http://serverfault.com/questions/224698/how-to-display-interface-in-tcpdump-output-flow (I like that)

**Comment by deitch** [comment]
In the target:

````
[root@target1 ~]# docker exec -it nn sh
# ip a
1: lo: <LOOPBACK,UP,LOWER_UP> mtu 65536 qdisc noqueue state UNKNOWN group default
    link/loopback 00:00:00:00:00:00 brd 00:00:00:00:00:00
    inet 127.0.0.1/8 scope host lo
       valid_lft forever preferred_lft forever
    inet6 ::1/128 scope host
       valid_lft forever preferred_lft forever
14: ethwe0@if15: <BROADCAST,MULTICAST,UP,LOWER_UP> mtu 65535 qdisc noqueue state UP group default
    link/ether 6a:ef:f9:91:3b:a0 brd ff:ff:ff:ff:ff:ff
    inet 192.169.0.1/16 scope global ethwe0
       valid_lft forever preferred_lft forever
    inet6 fe80::68ef:f9ff:fe91:3ba0/64 scope link
       valid_lft forever preferred_lft forever
16: eth1@if17: <BROADCAST,MULTICAST,UP,LOWER_UP> mtu 1500 qdisc noqueue state UP group default
    link/ether 02:42:ac:12:00:02 brd ff:ff:ff:ff:ff:ff
    inet 172.18.0.2/16 scope global eth1
       valid_lft forever preferred_lft forever
    inet6 fe80::42:acff:fe12:2/64 scope link
       valid_lft forever preferred_lft forever
# ip ro
default via 172.18.0.1 dev eth1
172.18.0.0/16 dev eth1  proto kernel  scope link  src 172.18.0.2
192.169.0.0/16 dev ethwe0  proto kernel  scope link  src 192.169.0.1
224.0.0.0/4 dev ethwe0  scope link
````

In the source
````
# ip a
1: lo: <LOOPBACK,UP,LOWER_UP> mtu 65536 qdisc noqueue state UNKNOWN group default
    link/loopback 00:00:00:00:00:00 brd 00:00:00:00:00:00
    inet 127.0.0.1/8 scope host lo
       valid_lft forever preferred_lft forever
    inet6 ::1/128 scope host
       valid_lft forever preferred_lft forever
44: ethwe0@if45: <BROADCAST,MULTICAST,UP,LOWER_UP> mtu 65535 qdisc noqueue state UP group default
    link/ether fe:64:b7:37:02:78 brd ff:ff:ff:ff:ff:ff
    inet 192.169.128.0/16 scope global ethwe0
       valid_lft forever preferred_lft forever
    inet6 fe80::fc64:b7ff:fe37:278/64 scope link
       valid_lft forever preferred_lft forever
46: eth1@if47: <BROADCAST,MULTICAST,UP,LOWER_UP> mtu 1500 qdisc noqueue state UP group default
    link/ether 02:42:ac:12:00:02 brd ff:ff:ff:ff:ff:ff
    inet 172.18.0.2/16 scope global eth1
       valid_lft forever preferred_lft forever
    inet6 fe80::42:acff:fe12:2/64 scope link
       valid_lft forever preferred_lft forever
# ip ro
default via 172.18.0.1 dev eth1
172.18.0.0/16 dev eth1  proto kernel  scope link  src 172.18.0.2
192.169.0.0/16 dev ethwe0  proto kernel  scope link  src 192.169.128.0
224.0.0.0/4 dev ethwe0  scope link
````

**Comment by awh** [comment]
Thanks. I just noticed your address range has changed from 192.168.0.0/16 in your initial example to 192.169.0.0/16 now - is that intentional?

**Comment by deitch** [comment]
To clarify things a bit, I ran tcpdump inside each container while running netperf (using the sample container you suggested above). I see the *exact* same packets. Here is an example:

````
root@8e28050d4752:/# tcpdump -i any -nn
tcpdump: verbose output suppressed, use -v or -vv for full protocol decode
listening on any, link-type LINUX_SLL (Linux cooked), capture size 65535 bytes
14:51:20.072077 IP 192.169.128.0.34447 > 192.169.0.1.12865: Flags [S], seq 1921399636, win 43690, options [mss 65495,sackOK,TS val 6167286 ecr 0,nop,wscale 8], length 0
14:51:21.073294 IP 192.169.128.0.34447 > 192.169.0.1.12865: Flags [S], seq 1921399636, win 43690, options [mss 65495,sackOK,TS val 6168288 ecr 0,nop,wscale 8], length 0
14:51:23.077275 IP 192.169.128.0.34447 > 192.169.0.1.12865: Flags [S], seq 1921399636, win 43690, options [mss 65495,sackOK,TS val 6170292 ecr 0,nop,wscale 8], length 0
14:51:25.073278 ARP, Request who-has 192.169.0.1 tell 192.169.128.0, length 28
14:51:25.074854 ARP, Reply 192.169.0.1 is-at 6a:ef:f9:91:3b:a0, length 28
14:51:27.089358 IP 192.169.128.0.34447 > 192.169.0.1.12865: Flags [S], seq 1921399636, win 43690, options [mss 65495,sackOK,TS val 6174304 ecr 0,nop,wscale 8], length 0
````

@awh: change in IP: nope. I wanted to copy @bboreham 's example (above) verbatim, and so I did, literally copy and paste.

**Comment by bboreham** [comment]
I had to change the address because my test VMs were on 192.168.48.0/24.

**Comment by deitch** [comment]
Yes, ping still works. Never had an issue with it.

This may be a dumb question, but should these both be on the same L2 overlay network? My mind is a bit fried, but I cannot recall if the overlay should be the same L2. Based on the routing table, wouldn't it lose the packets, because, oh, never mind. If the icmp packets are getting through, and the SYN packets are getting through, then that clearly is not the issue.

**Comment by deitch** [comment]
@bboreham I figured. I will switch it back later, but I wanted to literally copy-paste so no chance of dumb mistake on my part.

**Comment by awh** [comment]
Very odd indeed. May I see `iptables -vnL` and `iptables -tnat -vnL` inside the containers?

**Comment by deitch** [comment]
I assume I need to run iptables from the host as `ip netns exec `?

**Comment by awh** [comment]
Either that, or just run it inside the container if it's installed there.

**Comment by deitch** [comment]
Nah, it doesn't let in the container:

`````
[root@source1 ~]# docker exec -it nn2 bash
root@8e28050d4752:/# iptables -vnL
iptables v1.4.21: can't initialize iptables table `filter': Permission denied (you must be root)
Perhaps iptables or your kernel needs to be upgraded.
````

Here is better. Source1:
````
[root@source1 ~]# ip netns exec 8189 iptables -L
Chain INPUT (policy ACCEPT)
target     prot opt source               destination

Chain FORWARD (policy ACCEPT)
target     prot opt source               destination

Chain OUTPUT (policy ACCEPT)
target     prot opt source               destination
[root@source1 ~]# ip netns exec 8189 iptables -vnL
Chain INPUT (policy ACCEPT 1487 packets, 23M bytes)
 pkts bytes target     prot opt in     out     source               destination

Chain FORWARD (policy ACCEPT 0 packets, 0 bytes)
 pkts bytes target     prot opt in     out     source               destination

Chain OUTPUT (policy ACCEPT 964 packets, 62686 bytes)
 pkts bytes target     prot opt in     out     source               destination

[root@source1 ~]# ip netns exec 8189 iptables -tnat -vnL
Chain PREROUTING (policy ACCEPT 1 packets, 84 bytes)
 pkts bytes target     prot opt in     out     source               destination

Chain INPUT (policy ACCEPT 1 packets, 84 bytes)
 pkts bytes target     prot opt in     out     source               destination

Chain OUTPUT (policy ACCEPT 19 packets, 1182 bytes)
 pkts bytes target     prot opt in     out     source               destination
   12   824 DNAT       udp  --  *      *       0.0.0.0/0            127.0.0.11           udp dpt:53 to:127.0.0.11:59208
    0     0 DNAT       tcp  --  *      *       0.0.0.0/0            127.0.0.11           tcp dpt:53 to:127.0.0.11:56682

Chain POSTROUTING (policy ACCEPT 31 packets, 2006 bytes)
 pkts bytes target     prot opt in     out     source               destination
    0     0 SNAT       udp  --  *      *       127.0.0.11           0.0.0.0/0            udp spt:59208 to::53
    0     0 SNAT       tcp  --  *      *       127.0.0.11           0.0.0.0/0            tcp spt:56682 to::53
````

target1:
````
[root@target1 ~]# ip netns exec 6882 iptables -vnL
Chain INPUT (policy ACCEPT 1550 packets, 23M bytes)
 pkts bytes target     prot opt in     out     source               destination

Chain FORWARD (policy ACCEPT 0 packets, 0 bytes)
 pkts bytes target     prot opt in     out     source               destination

Chain OUTPUT (policy ACCEPT 914 packets, 63773 bytes)
 pkts bytes target     prot opt in     out     source               destination

[root@target1 ~]# ip netns exec 6882 iptables -tnat -vnL
Chain PREROUTING (policy ACCEPT 1 packets, 84 bytes)
 pkts bytes target     prot opt in     out     source               destination

Chain INPUT (policy ACCEPT 1 packets, 84 bytes)
 pkts bytes target     prot opt in     out     source               destination

Chain OUTPUT (policy ACCEPT 8 packets, 524 bytes)
 pkts bytes target     prot opt in     out     source               destination
   10   680 DNAT       udp  --  *      *       0.0.0.0/0            127.0.0.11           udp dpt:53 to:127.0.0.11:42842
    0     0 DNAT       tcp  --  *      *       0.0.0.0/0            127.0.0.11           tcp dpt:53 to:127.0.0.11:56326

Chain POSTROUTING (policy ACCEPT 18 packets, 1204 bytes)
 pkts bytes target     prot opt in     out     source               destination
    0     0 SNAT       udp  --  *      *       127.0.0.11           0.0.0.0/0            udp spt:42842 to::53
    0     0 SNAT       tcp  --  *      *       127.0.0.11           0.0.0.0/0            tcp spt:56326 to::53
````

**Comment by awh** [comment]
Thanks - that all looks as expected (the NAT rules are installed by Docker to redirect DNS to their own resolver).

When you do this

> Even if I stop firewalld entirely

Does it remove all the iptables rules and set all polices to ACCEPT?

**Comment by deitch** [comment]
Hmm, I will check in a moment (finishing a contract for a client).

You guys really get paid to do this? I am in the wrong business....

**Comment by deitch** [comment]
Yep:

````
[root@source1 ~]# iptables -vnL
Chain INPUT (policy ACCEPT 914 packets, 71666 bytes)
 pkts bytes target     prot opt in     out     source               destination

Chain FORWARD (policy ACCEPT 0 packets, 0 bytes)
 pkts bytes target     prot opt in     out     source               destination

Chain OUTPUT (policy ACCEPT 898 packets, 74466 bytes)
 pkts bytes target     prot opt in     out     source               destination

[root@target1 ~]# systemctl stop firewalld
[root@target1 ~]# iptables -vnL
Chain INPUT (policy ACCEPT 0 packets, 0 bytes)
 pkts bytes target     prot opt in     out     source               destination

Chain FORWARD (policy ACCEPT 0 packets, 0 bytes)
 pkts bytes target     prot opt in     out     source               destination

Chain OUTPUT (policy ACCEPT 0 packets, 0 bytes)
 pkts bytes target     prot opt in     out     source               destination
````

**Comment by deitch** [comment]
I am most stumped by the complete lack of response, no SYN-ACK, no RST, no nothing. What could possibly do that?

**Comment by awh** [comment]
The iptables output after `systemctl stop firewalld` is interesting, because all of the rules for traversing the docker and weave bridges (installed by the docker daemon and `weave launch`) have been removed. It's unlikely that any container networking is going to work in this case - I would try something like

* weave reset
* systemctl stop docker
* systemctl stop firewalld
* systemctl start docker
* weave launch

Have a look at `iptables -vnL` at this point - you sill see rules installed for forwarding across `docker0` and `weave` bridges. Do this on both hosts, then repeat your test.

> I am most stumped by the complete lack of response, no SYN-ACK, no RST, no nothing. What could possibly do that?

Things that immediately come to mind are

* lack of a route inside the container netns by which to return traffic
* iptables rules inside the container netns that block the traffic
* MTU issues

> And is there any way to ask the kernel to trace it?

You could do so with ftrace, but then you have another problem: https://wiki.linuxfoundation.org/images/1/1c/Network_data_flow_through_kernel.png

Consequently I would consider that a last resort!

**Comment by bboreham** [comment]
If the problem is caused by an iptables rule, running `iptables -vnL` before and after the test and observing which counts go up can tell you which rule(s) are firing.  You might need to do this for every table (filter, nat, security, mangle, raw).

**Comment by deitch** [comment]
> You could do so with ftrace, but then you have another problem: https://wiki.linuxfoundation.org/images/1/1c/Network_data_flow_through_kernel.png
> Consequently I would consider that a last resort!

Oh my! Yes, indeed, last resort.

> lack of a route inside the container netns by which to return traffic

I would expect that also to affect icmp

> iptables rules inside the container netns that block the traffic

which we checked, but will check again

> MTU issues

didn't think of that.

>  I would try something like

I am going to try it now. I reset my entire hosts from scratch, get a clean build.

> If the problem is caused by an iptables rule, running iptables -vnL before and after the test and observing which counts go up can tell you which rule(s) are firing. You might need to do this for every table (filter, nat, security, mangle, raw)

Good point. I am hitting reset on the servers, and then will try all of the above.

**Comment by deitch** [comment]
Servers reset, but now docker seems to want to use `192.168.x.x` for its `docker0` addresses, even though `--bip` is not set anywhere. Sigh.

**Comment by deitch** [comment]
Updated. But there are so many other packets flying around, how do we even know which one is being affected?

**Comment by deitch** [comment]
I am also running `iptables -vnL` inside the container....

**Comment by deitch** [comment]
Yeah, lots of ACCEPT, lots on INPUT, almost nothing on OUTPUT. Run a ping, and it goes to OUTPUT

1. filter before ping:

````
[root@target1 ~]# ip netns exec 25694 iptables -vnL -tfilter
Chain INPUT (policy ACCEPT 1489 packets, 23M bytes)
 pkts bytes target     prot opt in     out     source               destination

Chain FORWARD (policy ACCEPT 0 packets, 0 bytes)
 pkts bytes target     prot opt in     out     source               destination

Chain OUTPUT (policy ACCEPT 905 packets, 56862 bytes)
 pkts bytes target     prot opt in     out     source               destination
````

filter after ping:

````
[root@target1 ~]# ip netns exec 25694 iptables -vnL -tfilter
Chain INPUT (policy ACCEPT 1490 packets, 23M bytes)
 pkts bytes target     prot opt in     out     source               destination

Chain FORWARD (policy ACCEPT 0 packets, 0 bytes)
 pkts bytes target     prot opt in     out     source               destination

Chain OUTPUT (policy ACCEPT 906 packets, 56946 bytes)
 pkts bytes target     prot opt in     out     source               destination
````

One extra INPUT packet, one extra OUTPUT packet, no FORWARD packets.

**Comment by deitch** [comment]
And in case it helps, the other direction is the exact same thing, `SYN` packets, icmp, nothing else.

**Comment by deitch** [comment]
Something to do with how the kernel attaches the network interface? If it is not sending a `SYN-ACK` or `RST`, and no firewall rules are being triggered, then maybe that?

**Comment by awh** [comment]
@deitch Thanks for the updated gist - digesting!

**Comment by awh** [comment]
@deitch 

Still non the wiser I'm afraid :) But I have thought of some more things to try that will help us work out how far the kernel is progressing in terms of processing the incoming `SYN` packet.

1. In the target container netns, prior to initiating the test from source, do `conntrack -F` to flush the connection tracking table; then leave a `conntrack -E` running
* Initiate the TCP test from source
* In the target container again, do `ss -at` and `ip -s neigh show`

If I artificially block the SYN-ACK from the target by inserting a DROP into the output chain, I get this kind of output (I'm using netcat on port 4000 in my target container):

```
# nsenter --target 3808 --net conntrack -E
    [NEW] tcp      6 120 SYN_SENT src=10.32.0.1 dst=10.40.0.0 sport=52691 dport=4000 [UNREPLIED] src=10.40.0.0 dst=10.32.0.1 sport=4000 dport=52691
 [UPDATE] tcp      6 58 SYN_RECV src=10.32.0.1 dst=10.40.0.0 sport=52691 dport=4000 src=10.40.0.0 dst=10.32.0.1 sport=4000 dport=52691
 [UPDATE] tcp      6 57 SYN_RECV src=10.32.0.1 dst=10.40.0.0 sport=52691 dport=4000 src=10.40.0.0 dst=10.32.0.1 sport=4000 dport=52691
 [UPDATE] tcp      6 55 SYN_RECV src=10.32.0.1 dst=10.40.0.0 sport=52691 dport=4000 src=10.40.0.0 dst=10.32.0.1 sport=4000 dport=52691
```

But I do not see anything in `SYN_RECV` in the output of `ss` - the inability to output the `SYN-ACK` successfully (due to the DROP rule) apparently prevents the creation of the socket.

> Anyone here going to be at LinuxCon Tokyo next month?

No-one from Weaveworks, no.

**Comment by awh** [comment]
An aside - this is easily one of the most unfathomable issues I've encountered. As you might expect, a simple test here with CentOS 7 and WEAVE_NO_FASTDP works perfectly - the only unusual thing about your setup (from my perspective) is the underlay network between your hosts. Are those `team0` devices instances of https://access.redhat.com/documentation/en-US/Red_Hat_Enterprise_Linux/7/html/Networking_Guide/ch-Configure_Network_Teaming.html ? It would be good to get some specifics on your hosts (e.g. exact kernel version) as well as more detail about the SDN you mentioned.

> Does it matter that there is no layer 2 connection between the hosts?

Sorry, I missed this question earlier. No, it doesn't matter - we operate on top of L3 and will happily go through NAT devices.

**Comment by deitch** [comment]
> this is easily one of the most unfathomable issues I've encountered

I am (mostly) sorry. Only mostly, because I know the sheer joy of actually figuring it out in the end. :-)

SDN: I am running it on Packet.net's servers. They do no L2 fabric, all L3, hence the /31 addresses. They also cost a not insignificant amount - well, only $0.40 / hour / host, but it does add up - so I shut them down and set up new ones each day. That has the side benefit of getting a clean install every day.

If you post your ssh public key, I will add you to them. I can keep them running for another 3-4 hours, if you want. Just give me a mechanism to notify you before I tear them down.

Yeah, these are teamed underlying physical NICs. Packet provides it as a default to give 2GigE combined bandwidth, and failover down to 1GigE if a cable or port fails.. I cannot imagine why it would matter if it is a team, but as you said, this is rather vexing. 

````
[root@target1 ~]# uname -a
Linux target1 3.10.0-327.18.2.el7.x86_64 #1 SMP Thu May 12 11:03:55 UTC 2016 x86_64 x86_64 x86_64 GNU/Linux
````

What can I answer about their SDN? From the host's perspective, it is just connected directly to a router. My private host IP is `10.99.101.129/31`, my route is to `10.99.101.128`. Basically I can connect to myself via L2, but *everything* else is L3. So `10.99.101.129` to `10.99.101.131` has to cross a router.

I will try the tests you suggested above shortly.

> No one in Tokyo

Oh well. I am presenting on the first day on networking containers in ultra-low-latency environment. This whole thing grew out of work I did containerizing a fintech firm last year.

**Comment by deitch** [comment]
Oh yeah, and the `team0` IP has a private address `10.99.101.129/31` with route to `10.0.0.0/8` via `10.99.101.128` and a public address `147.74.193.177/31` with a route to `default` via `147.75.193.176`.

**Comment by deitch** [comment]
`conntrack` only shows a connection for icmp, not for tcp:

````
[root@target1 ~]# nsenter --target 13566 --net conntrack -E

    [NEW] icmp     1 30 src=192.168.128.0 dst=192.168.0.1 type=8 code=0 id=455 [UNREPLIED] src=192.168.0.1 dst=192.168.128.0 type=0 code=0 id=455
 [UPDATE] icmp     1 30 src=192.168.128.0 dst=192.168.0.1 type=8 code=0 id=455 src=192.168.0.1 dst=192.168.128.0 type=0 code=0 id=455
````

That is it; no tcp.

`ss -at` shows it listening, the source is shown as a neighbour, and the SYN packets show up:

````
[root@container] nc -l -p 4444

[root@target1 ~]# nsenter --target 13566 --net ss -atn
State      Recv-Q Send-Q                                             Local Address:Port                                                            Peer Address:Port
LISTEN     0      128                                                   127.0.0.11:54482                                                                      *:*
LISTEN     0      1                                                              *:4444                                                                       *:*

[root@target1 ~]# nsenter --target 13566 --net ip -s neigh show
192.168.128.0 dev ethwe0 lladdr ea:df:af:29:84:1a used 246/242/16 probes 1 STALE
172.18.0.1 dev eth1 lladdr 02:42:76:35:a3:2f used 266/266/246 probes 4 STALE

[root@target1 ~]# nsenter --target 13566 --net tcpdump -nn -i ethwe0
tcpdump: verbose output suppressed, use -v or -vv for full protocol decode
listening on ethwe0, link-type EN10MB (Ethernet), capture size 65535 bytes
08:19:13.094748 IP 192.168.128.0.51431 > 192.168.0.1.4444: Flags [S], seq 4018583124, win 43690, options [mss 65495,sackOK,TS val 17223988 ecr 0,nop,wscale 8], length 0
08:19:14.096624 IP 192.168.128.0.51431 > 192.168.0.1.4444: Flags [S], seq 4018583124, win 43690, options [mss 65495,sackOK,TS val 17224990 ecr 0,nop,wscale 8], length 0
08:19:16.099090 IP 192.168.128.0.51431 > 192.168.0.1.4444: Flags [S], seq 4018583124, win 43690, options [mss 65495,sackOK,TS val 17226992 ecr 0,nop,wscale 8], length 0
````

**Comment by awh** [comment]
@deitch interesting. It looks like the kernel isn't processing the incoming SYN at all - could it be a checksum issue? Could you show us the output of `cat /proc/net/dev` inside the target container?

**Comment by deitch** [comment]
Sure. Momentarily...

**Comment by deitch** [comment]
Before any tests:

````
[root@target1 ~]# nsenter --target 13566 --net cat /proc/net/dev
Inter-|   Receive                                                |  Transmit
 face |bytes    packets errs drop fifo frame compressed multicast|bytes    packets errs drop fifo colls carrier compressed
  eth1: 27192120    1846    0    0    0     0          0         0   133878    1677    0    0    0     0       0          0
ethwe0:    4566      61    0    0    0     0          0         0     3300      46    0    0    0     0       0          0
    lo:    2573      26    0    0    0     0          0         0     2573      26    0    0    0     0       0          0
 tunl0:       0       0    0    0    0     0          0         0        0       0    0    0    0     0       0          0
````

After ping

````
[root@target1 ~]# nsenter --target 13566 --net cat /proc/net/dev
Inter-|   Receive                                                |  Transmit
 face |bytes    packets errs drop fifo frame compressed multicast|bytes    packets errs drop fifo colls carrier compressed
  eth1: 27192120    1846    0    0    0     0          0         0   133878    1677    0    0    0     0       0          0
ethwe0:    4706      63    0    0    0     0          0         0     3440      48    0    0    0     0       0          0
    lo:    2573      26    0    0    0     0          0         0     2573      26    0    0    0     0       0          0
 tunl0:       0       0    0    0    0     0          0         0        0       0    0    0    0     0       0          0
````

After socket test (used nc):

````
[root@target1 ~]# nsenter --target 13566 --net cat /proc/net/dev
Inter-|   Receive                                                |  Transmit
 face |bytes    packets errs drop fifo frame compressed multicast|bytes    packets errs drop fifo colls carrier compressed
  eth1: 27192120    1846    0    0    0     0          0         0   133878    1677    0    0    0     0       0          0
ethwe0:    5002      67    0    0    0     0          0         0     3440      48    0    0    0     0       0          0
    lo:    2573      26    0    0    0     0          0         0     2573      26    0    0    0     0       0          0
 tunl0:       0       0    0    0    0     0          0         0        0       0    0    0    0     0       0          0
````

Strange, eh?

**Comment by deitch** [comment]
At the risk of being ignorant, would we not see errors if there was a checksum issue?

**Comment by deitch** [comment]
**HOLD ON!**

I decided to try your theory, @awh, and did the following:

````
root@1028f1b228c1:~# tcpdump -i ethwe0 -nn -vvv -e
tcpdump: listening on ethwe0, link-type EN10MB (Ethernet), capture size 262144 bytes
12:44:22.490819 ea:df:af:29:84:1a > ea:81:32:75:a2:ea, ethertype IPv4 (0x0800), length 74: (tos 0x10, ttl 64, id 52915, offset 0, flags [DF], proto TCP (6), length 60)
    192.168.128.0.51872 > 192.168.0.1.4444: Flags [S], cksum 0x0181 (incorrect -> 0xd732), seq 4240775100, win 43690, options [mss 65495,sackOK,TS val 18733327 ecr 0,nop,wscale 8], length 0
12:44:23.492023 ea:df:af:29:84:1a > ea:81:32:75:a2:ea, ethertype IPv4 (0x0800), length 74: (tos 0x10, ttl 64, id 52916, offset 0, flags [DF], proto TCP (6), length 60)
    192.168.128.0.51872 > 192.168.0.1.4444: Flags [S], cksum 0x0181 (incorrect -> 0xd349), seq 4240775100, win 43690, options [mss 65495,sackOK,TS val 18734328 ecr 0,nop,wscale 8], length 0
````

It says `cksum 0x0181 (incorrect -> 0xd732)` 

Is that a pointer? Or a red herring? Not sure how I would validate that. I guess I can tcpdump to a pcap file on both sides and save it?

**Comment by deitch** [comment]
I am getting incorrect cksum on the send side as well:

````
[root@source1 ~]# nsenter --target 7627 --net tcpdump -i ethwe0 -nn -vvv -e
tcpdump: listening on ethwe0, link-type EN10MB (Ethernet), capture size 65535 bytes
08:48:13.345818 ea:df:af:29:84:1a > ea:81:32:75:a2:ea, ethertype IPv4 (0x0800), length 74: (tos 0x10, ttl 64, id 21568, offset 0, flags [DF], proto TCP (6), length 60)
    192.168.128.0.51940 > 192.168.0.1.4444: Flags [S], cksum 0x0181 (incorrect -> 0x856a), seq 2810656229, win 43690, options [mss 65495,sackOK,TS val 18964901 ecr 0,nop,wscale 8], length 0
08:48:14.348733 ea:df:af:29:84:1a > ea:81:32:75:a2:ea, ethertype IPv4 (0x0800), length 74: (tos 0x10, ttl 64, id 21569, offset 0, flags [DF], proto TCP (6), length 60)
    192.168.128.0.51940 > 192.168.0.1.4444: Flags [S], cksum 0x0181 (incorrect -> 0x817f), seq 2810656229, win 43690, options [mss 65495,sackOK,TS val 18965904 ecr 0,nop,wscale 8], length 0
08:48:16.352733 ea:df:af:29:84:1a > ea:81:32:75:a2:ea, ethertype IPv4 (0x0800), length 74: (tos 0x10, ttl 64, id 21570, offset 0, flags [DF], proto TCP (6), length 60)
    192.168.128.0.51940 > 192.168.0.1.4444: Flags [S], cksum 0x0181 (incorrect -> 0x79ab), seq 2810656229, win 43690, options [mss 65495,sackOK,TS val 18967908 ecr 0,nop,wscale 8], length 0
````

And the same packets on the receive side:

````
[root@target1 log]# nsenter --target 13566 --net tcpdump -i ethwe0 -nn -vvv -e
tcpdump: listening on ethwe0, link-type EN10MB (Ethernet), capture size 65535 bytes
08:48:14.073486 ea:df:af:29:84:1a > ea:81:32:75:a2:ea, ethertype IPv4 (0x0800), length 74: (tos 0x10, ttl 64, id 21568, offset 0, flags [DF], proto TCP (6), length 60)
    192.168.128.0.51940 > 192.168.0.1.4444: Flags [S], cksum 0x0181 (incorrect -> 0x856a), seq 2810656229, win 43690, options [mss 65495,sackOK,TS val 18964901 ecr 0,nop,wscale 8], length 0
08:48:15.076512 ea:df:af:29:84:1a > ea:81:32:75:a2:ea, ethertype IPv4 (0x0800), length 74: (tos 0x10, ttl 64, id 21569, offset 0, flags [DF], proto TCP (6), length 60)
    192.168.128.0.51940 > 192.168.0.1.4444: Flags [S], cksum 0x0181 (incorrect -> 0x817f), seq 2810656229, win 43690, options [mss 65495,sackOK,TS val 18965904 ecr 0,nop,wscale 8], length 0
08:48:17.080633 ea:df:af:29:84:1a > ea:81:32:75:a2:ea, ethertype IPv4 (0x0800), length 74: (tos 0x10, ttl 64, id 21570, offset 0, flags [DF], proto TCP (6), length 60)
    192.168.128.0.51940 > 192.168.0.1.4444: Flags [S], cksum 0x0181 (incorrect -> 0x79ab), seq 2810656229, win 43690, options [mss 65495,sackOK,TS val 18967908 ecr 0,nop,wscale 8], length 0
````

I don't even know if that is a real issue, or if the checksum errors are correct.

**Comment by deitch** [comment]
Feh, I think it was a red herring. I tried to telnet from host target1 to a container port with nothing running on it, while tcpdump inside the container:

Host:

````
[root@target1 log]# telnet 172.18.0.2 22
Trying 172.18.0.2...
telnet: connect to address 172.18.0.2: Connection refused
````

Container:

````
root@1028f1b228c1:~# tcpdump -i any -nn -vvv -e
tcpdump: listening on any, link-type LINUX_SLL (Linux cooked), capture size 262144 bytes
12:51:28.276519  In 02:42:76:35:a3:2f ethertype IPv4 (0x0800), length 76: (tos 0x10, ttl 64, id 54171, offset 0, flags [DF], proto TCP (6), length 60)
    172.18.0.1.42919 > 172.18.0.2.22: Flags [S], cksum 0x5856 (incorrect -> 0xf15d), seq 4159360795, win 29200, options [mss 1460,sackOK,TS val 19209344 ecr 0,nop,wscale 8], length 0
12:51:28.276562 Out 02:42:ac:12:00:02 ethertype IPv4 (0x0800), length 56: (tos 0x10, ttl 64, id 54348, offset 0, flags [DF], proto TCP (6), length 40)
    172.18.0.2.22 > 172.18.0.1.42919: Flags [R.], cksum 0xe8e3 (correct), seq 0, ack 4159360796, win 0, length 0
````

Is there something else in the packet that makes it ignored?

**Comment by deitch** [comment]
No, it isn't a red herring. I used ethtool (auto-correct says that should be "ethanol" :-) ) to disable a lot of the checksumming and offloading and it works! 

Now I need to walk through them one by one to figure out which one... and then we can try to understand why.

**Comment by bboreham** [comment]
Oh.  I fixed this on master a couple of weeks ago - https://github.com/weaveworks/weave/pull/2307/commits/ac14b19db871fd3fea86d2075c354267f67c5169#diff-d3bb2bb0647695e42c3d37d0f4c48fcaR129

(previously we did `ethtool tx off` if you used our Docker API proxy or `weave run`, but not our Docker Network plugin)

Sorry this didn't come to mind.

We never did know exactly the conditions when Linux will start hating the checksums, but clearly your test system has those conditions and ours don't.

**Comment by deitch** [comment]
Update:

On *both* sides, I need to do `ethtool -K ethwe0 rx off tx off` for the connection to be set up and transmission to work.

I think we all deserve ale/beers and an award for this!

**Comment by deitch** [comment]
> Oh. I fixed this on master a couple of weeks ago - ac14b19#diff-d3bb2bb0647695e42c3d37d0f4c48fcaR129

No! Oh no! I installed from `curl -L git.io/weave -o /usr/local/bin/weave` 

Oh, the long hours of effort figuring it out. 😥

If you turn off the offloading, doesn't performance suffer? Or not, since it is a virtual NIC anyways and it is only the encapsulated packets on the network that can use the offloading?

How do I use the latest from master?

**Comment by awh** [comment]
> How do I use the latest from master?
https://www.weave.works/docs/net/latest/troubleshooting/#snapshots

**Comment by bboreham** [comment]
> If you turn off the offloading, doesn't performance suffer? Or not, since it is a virtual NIC anyways and it is only the encapsulated packets on the network that can use the offloading?

Note that you're only in this code path because you specified `WEAVE_NO_FASTDP` - the fast datapath will take advantage of hardware assist if available (i.e. hardware VXLAN encapsulation, which is rare).  The non-fast datapath is slow because it goes through userspace, and the time to do a checksum calculation is tiny compared to that overhead.

But yes, it would be highly improbable that we could take advantage of tx offload and also bring the container's packets back into userspace.

The encapsulated packets are just regular packets from the host i/f and will use whatever exists to make them go faster.

**Comment by deitch** [comment]
Quite the journey. You guys really do this for a living, and go on journeys like this every day? Reminds me a bit of my Morgan Stanley days in the 90s.

Well, I think we can close this one out. I just confirmed that the latest snapshot works like a charm.

When do the commits referenced above become part of the official release?

**Comment by bboreham** [comment]
That PR is on the 1.6.0 [milestone](https://github.com/weaveworks/weave/milestones) which has a due date of June 20th.

We do reserve the right to change those dates :smiley:

**Comment by deitch** [comment]
> We do reserve the right to change those dates 😃

Absolutely! 

Just checked out your "team" page. Good people, and Adrian is your advisor. Love it.

**Comment by deitch** [comment]
@bboreham, did `weave reset` change in the latest build? I used to do `weave stop` and then `weave reset` to clear it all out, but now I get an error message?

**Comment by bboreham** [comment]
Yes, that was in #2332.  `weave reset` always subsumed `weave stop`, and if you do it your way on just part of your network then you leak addresses.

**Comment by deitch** [comment]
So, what is the correct thing to do then when I want to clear out a bunch of hosts? Just `weave reset` without `weave stop`?

**Comment by bboreham** [comment]
Yes.

**Comment by deitch** [comment]
Works for me. Thanks @bboreham and if you guys make it to LinuxCon, look me up.

**Comment by deitch** [comment]
Hi gents,

Quickly revisiting this. Is this fixed if I use the latest (1.6.2)?

Separately, any of you going to be in LinuxCon Berlin next week?

**Comment by bboreham** [comment]
Yes, the change to do `tx off` from the plugin is in 1.6.2.

**Comment by deitch** [comment]
Thanks Bryan. Berlin?

**Comment by bboreham** [comment]
We have a team in Berlin so probably can arrange to meet up. Nothing specific at the moment.

**Comment by deitch** [comment]
Is cool. I was hoping you would be at linuxcon/containercon next week in Berlin. :-)

**Comment by bboreham** [comment]
@deitch Ilya and Luke will be there next week. Please email if you want to arrange a meet.

**Comment by deitch** [comment]
Be very happy to meet. I will be there Wed/Thu only, speaking Wed afternoon on networking containers in ultra-low-latency environments. Be more than happy to meet them.

I don't have your email. I am at avi [at] atomicinc [dot] com.
