### ISSUE TITLE
weave-kube doesn't work as a static pod

### ISSUE THREAD

**Issue by awh** [weaveworks/weave#2615]
_From @pondohva on October 20, 2016 16:26_

Hello. I've migrated from weave-kube as a standalone docker containers (not daemonset) to weave-kube as a static pod and doesn't have access to the internet and pods on another nods.

weave-kube.yml:

```
apiVersion: v1
kind: Pod
metadata:
  name: weave
  namespace: kube-system
spec:
  hostNetwork: true
  hostPID: true
  containers:
    - name: weave
      image: pondohva/weave-kube:latest
      command:
        - /home/weave/launch.sh
      env:
        - name: KUBE_PEERS
          value: "10.128.13.22 10.128.13.194 10.128.13.198"
      livenessProbe:
        initialDelaySeconds: 30
        httpGet:
          host: 127.0.0.1
          path: /status
          port: 6784
      securityContext:
        privileged: true
      volumeMounts:
        - name: weavedb
          mountPath: /weavedb
        - name: cni-bin
          mountPath: /opt
        - name: cni-bin2
          mountPath: /host_home
        - name: cni-conf
          mountPath: /etc
        - name: docker-sock
          mountPath: /var/run/docker.sock
      resources:
        requests:
          cpu: 10m
  restartPolicy: Always
  volumes:
    - name: docker-sock
      hostPath:
        path: /var/run/docker.sock
    - name: weavedb
      hostPath:
        path: /var/lib/weave-kube
    - name: cni-bin
      hostPath:
        path: /opt
    - name: cni-bin2
      hostPath:
        path: /home
    - name: cni-conf
      hostPath:
        path: /etc
```

log from the first node (second and third are same)

```
INFO: 2016/10/20 16:06:38.250170 Command line options: map[docker-api: datapath:datapath ipalloc-init:consensus=3 name:ae:0f:36:eb:4a:58 nickname:by1-depl-k8s-1.corp.mycompany.local http-addr:127.0.0.1:6784 ipalloc-range:10.32.0.0/12 no-dns:true port:6783]
INFO: 2016/10/20 16:06:38.259263 Communication between peers is unencrypted.
INFO: 2016/10/20 16:06:38.262350 Our name is ae:0f:36:eb:4a:58(by1-depl-k8s-1.corp.mycompany.local)
INFO: 2016/10/20 16:06:38.262402 Launch detected - using supplied peer list: [10.128.13.22 10.128.13.194 10.128.13.198]
INFO: 2016/10/20 16:06:38.278685 [allocator ae:0f:36:eb:4a:58] Initialising with persisted data
INFO: 2016/10/20 16:06:38.280510 Sniffing traffic on datapath (via ODP)
INFO: 2016/10/20 16:06:38.353026 ->[10.128.13.198:6783] attempting connection
INFO: 2016/10/20 16:06:38.353281 ->[10.128.13.22:6783] attempting connection
INFO: 2016/10/20 16:06:38.353525 ->[10.128.13.194:6783] attempting connection
INFO: 2016/10/20 16:06:38.355051 Listening for HTTP control messages on 127.0.0.1:6784
INFO: 2016/10/20 16:06:38.366004 ->[10.128.13.194:6783] error during connection attempt: dial tcp4 :0->10.128.13.194:6783: getsockopt: connection refused
INFO: 2016/10/20 16:06:38.378191 ->[10.128.13.22:52928] connection accepted
INFO: 2016/10/20 16:06:38.390747 ->[10.128.13.198:6783|96:5b:2e:66:f4:b7(by1-depl-k8s-3.corp.mycompany.local)]: connection ready; using protocol version 2
INFO: 2016/10/20 16:06:38.424727 overlay_switch ->[96:5b:2e:66:f4:b7(by1-depl-k8s-3.corp.mycompany.local)] using fastdp
INFO: 2016/10/20 16:06:38.424848 ->[10.128.13.198:6783|96:5b:2e:66:f4:b7(by1-depl-k8s-3.corp.mycompany.local)]: connection added (new peer)
INFO: 2016/10/20 16:06:38.425075 ->[10.128.13.22:52928|ae:0f:36:eb:4a:58(by1-depl-k8s-1.corp.mycompany.local)]: connection shutting down due to error: cannot connect to ourself
INFO: 2016/10/20 16:06:38.425544 ->[10.128.13.22:6783|ae:0f:36:eb:4a:58(by1-depl-k8s-1.corp.mycompany.local)]: connection shutting down due to error: cannot connect to ourself
INFO: 2016/10/20 16:06:38.428382 ->[10.128.13.198:6783|96:5b:2e:66:f4:b7(by1-depl-k8s-3.corp.mycompany.local)]: connection fully established
INFO: 2016/10/20 16:06:38.436627 EMSGSIZE on send, expecting PMTU update (IP packet was 60028 bytes, payload was 60020 bytes)
INFO: 2016/10/20 16:06:38.438092 sleeve ->[10.128.13.198:6783|96:5b:2e:66:f4:b7(by1-depl-k8s-3.corp.mycompany.local)]: Effective MTU verified at 1438
INFO: 2016/10/20 16:06:38.506386 Discovered remote MAC 96:5b:2e:66:f4:b7 at 96:5b:2e:66:f4:b7(by1-depl-k8s-3.corp.mycompany.local)
INFO: 2016/10/20 16:06:38.833514 Discovered local MAC ae:0f:36:eb:4a:58
10.40.0.0
INFO: 2016/10/20 16:06:39.608972 Discovered remote MAC 1a:d1:cd:bd:f6:35 at 96:5b:2e:66:f4:b7(by1-depl-k8s-3.corp.mycompany.local)
INFO: 2016/10/20 16:06:39.612938 Discovered remote MAC 86:be:1b:d8:1f:4e at 96:5b:2e:66:f4:b7(by1-depl-k8s-3.corp.mycompany.local)
INFO: 2016/10/20 16:06:39.765982 ->[10.128.13.194:6783] attempting connection
INFO: 2016/10/20 16:06:39.766933 ->[10.128.13.194:6783] error during connection attempt: dial tcp4 :0->10.128.13.194:6783: getsockopt: connection refused
INFO: 2016/10/20 16:06:41.484759 Discovered local MAC 4a:8b:d5:c6:f8:ca
INFO: 2016/10/20 16:06:43.552849 ->[10.128.13.194:54756] connection accepted
INFO: 2016/10/20 16:06:43.657646 ->[10.128.13.194:54756|46:ee:b5:e5:b7:86(by1-depl-k8s-2.corp.mycompany.local)]: connection ready; using protocol version 2
INFO: 2016/10/20 16:06:43.657751 overlay_switch ->[46:ee:b5:e5:b7:86(by1-depl-k8s-2.corp.mycompany.local)] using fastdp
INFO: 2016/10/20 16:06:43.657789 ->[10.128.13.194:54756|46:ee:b5:e5:b7:86(by1-depl-k8s-2.corp.mycompany.local)]: connection added (new peer)
INFO: 2016/10/20 16:06:44.001378 ->[10.128.13.194:54756|46:ee:b5:e5:b7:86(by1-depl-k8s-2.corp.mycompany.local)]: connection fully established
INFO: 2016/10/20 16:06:44.004395 EMSGSIZE on send, expecting PMTU update (IP packet was 60028 bytes, payload was 60020 bytes)
INFO: 2016/10/20 16:06:44.008095 sleeve ->[10.128.13.194:6783|46:ee:b5:e5:b7:86(by1-depl-k8s-2.corp.mycompany.local)]: Effective MTU verified at 1438
INFO: 2016/10/20 16:06:44.161443 Discovered remote MAC d6:58:71:73:e1:7f at 46:ee:b5:e5:b7:86(by1-depl-k8s-2.corp.mycompany.local)
INFO: 2016/10/20 16:06:44.532966 Discovered remote MAC c6:20:a8:a8:2e:a1 at 46:ee:b5:e5:b7:86(by1-depl-k8s-2.corp.mycompany.local)
```

but I can't send ping to pods from one node to another: Destination host unreachable.

What can I do to debug this problem? I've run weave reset (weave-kube was deployed as a standalone containers with weave setup and weave launch before static pods) and rm /var/lib/weave-kube/weavedata.db before running weave-kube as a static pod.

_Copied from original issue: weaveworks/weave-kube#40_

**Comment by awh** [comment]
_From @pondohva on October 20, 2016 16:39_

tcpdump for weave interface while I sent ping from pod on by1-depl-k8s-1 to pod on by1-depl-k8s-2
```
[root@by1-depl-k8s-1 ~]# tcpdump -i weave -vv
tcpdump: listening on weave, link-type EN10MB (Ethernet), capture size 65535 bytes
16:33:26.392986 IP (tos 0x0, ttl 64, id 19801, offset 0, flags [DF], proto ICMP (1), length 84)
    10.40.0.1 > 10.38.0.2: ICMP echo request, id 128, seq 10, length 64
16:33:27.393131 IP (tos 0x0, ttl 64, id 19802, offset 0, flags [DF], proto ICMP (1), length 84)
    10.40.0.1 > 10.38.0.2: ICMP echo request, id 128, seq 11, length 64
16:33:28.394271 IP (tos 0x0, ttl 64, id 19803, offset 0, flags [DF], proto ICMP (1), length 84)
    10.40.0.1 > 10.38.0.2: ICMP echo request, id 128, seq 12, length 64
16:33:29.395943 IP (tos 0x0, ttl 64, id 19804, offset 0, flags [DF], proto ICMP (1), length 84)
    10.40.0.1 > 10.38.0.2: ICMP echo request, id 128, seq 13, length 64
16:33:30.397111 IP (tos 0x0, ttl 64, id 19805, offset 0, flags [DF], proto ICMP (1), length 84)
    10.40.0.1 > 10.38.0.2: ICMP echo request, id 128, seq 14, length 64
16:33:31.398296 IP (tos 0x0, ttl 64, id 19806, offset 0, flags [DF], proto ICMP (1), length 84)
    10.40.0.1 > 10.38.0.2: ICMP echo request, id 128, seq 15, length 64
16:33:32.399456 IP (tos 0x0, ttl 64, id 19807, offset 0, flags [DF], proto ICMP (1), length 84)
    10.40.0.1 > 10.38.0.2: ICMP echo request, id 128, seq 16, length 64
16:33:33.400686 IP (tos 0x0, ttl 64, id 19808, offset 0, flags [DF], proto ICMP (1), length 84)
    10.40.0.1 > 10.38.0.2: ICMP echo request, id 128, seq 17, length 64
16:33:34.401900 IP (tos 0x0, ttl 64, id 19809, offset 0, flags [DF], proto ICMP (1), length 84)
    10.40.0.1 > 10.38.0.2: ICMP echo request, id 128, seq 18, length 64
16:33:35.402989 IP (tos 0x0, ttl 64, id 19810, offset 0, flags [DF], proto ICMP (1), length 84)
    10.40.0.1 > 10.38.0.2: ICMP echo request, id 128, seq 19, length 64
16:33:36.404142 IP (tos 0x0, ttl 64, id 19811, offset 0, flags [DF], proto ICMP (1), length 84)
    10.40.0.1 > 10.38.0.2: ICMP echo request, id 128, seq 20, length 64
16:33:36.875153 ARP, Ethernet (len 6), IPv4 (len 4), Request who-has 10.32.0.4 tell 10.38.0.0, length 28
16:33:37.405278 IP (tos 0x0, ttl 64, id 19812, offset 0, flags [DF], proto ICMP (1), length 84)
    10.40.0.1 > 10.38.0.2: ICMP echo request, id 128, seq 21, length 64
16:33:37.877117 ARP, Ethernet (len 6), IPv4 (len 4), Request who-has 10.32.0.4 tell 10.38.0.0, length 28
16:33:38.406908 IP (tos 0x0, ttl 64, id 19813, offset 0, flags [DF], proto ICMP (1), length 84)
    10.40.0.1 > 10.38.0.2: ICMP echo request, id 128, seq 22, length 64
16:33:38.879174 ARP, Ethernet (len 6), IPv4 (len 4), Request who-has 10.32.0.4 tell 10.38.0.0, length 28
16:33:39.408907 IP (tos 0x0, ttl 64, id 19814, offset 0, flags [DF], proto ICMP (1), length 84)
    10.40.0.1 > 10.38.0.2: ICMP echo request, id 128, seq 23, length 64
16:33:40.410056 IP (tos 0x0, ttl 64, id 19815, offset 0, flags [DF], proto ICMP (1), length 84)
    10.40.0.1 > 10.38.0.2: ICMP echo request, id 128, seq 24, length 64
16:33:41.411199 IP (tos 0x0, ttl 64, id 19816, offset 0, flags [DF], proto ICMP (1), length 84)
    10.40.0.1 > 10.38.0.2: ICMP echo request, id 128, seq 25, length 64
16:33:42.412345 IP (tos 0x0, ttl 64, id 19817, offset 0, flags [DF], proto ICMP (1), length 84)
    10.40.0.1 > 10.38.0.2: ICMP echo request, id 128, seq 26, length 64
16:33:43.413493 IP (tos 0x0, ttl 64, id 19818, offset 0, flags [DF], proto ICMP (1), length 84)
    10.40.0.1 > 10.38.0.2: ICMP echo request, id 128, seq 27, length 64
16:33:44.414697 IP (tos 0x0, ttl 64, id 19819, offset 0, flags [DF], proto ICMP (1), length 84)
    10.40.0.1 > 10.38.0.2: ICMP echo request, id 128, seq 28, length 64
16:33:45.415855 IP (tos 0x0, ttl 64, id 19820, offset 0, flags [DF], proto ICMP (1), length 84)
    10.40.0.1 > 10.38.0.2: ICMP echo request, id 128, seq 29, length 64
16:33:46.416989 IP (tos 0x0, ttl 64, id 19821, offset 0, flags [DF], proto ICMP (1), length 84)
    10.40.0.1 > 10.38.0.2: ICMP echo request, id 128, seq 30, length 64
16:33:47.418127 IP (tos 0x0, ttl 64, id 19822, offset 0, flags [DF], proto ICMP (1), length 84)
    10.40.0.1 > 10.38.0.2: ICMP echo request, id 128, seq 31, length 64
16:33:48.419282 IP (tos 0x0, ttl 64, id 19823, offset 0, flags [DF], proto ICMP (1), length 84)
    10.40.0.1 > 10.38.0.2: ICMP echo request, id 128, seq 32, length 64
16:33:49.420427 IP (tos 0x0, ttl 64, id 19824, offset 0, flags [DF], proto ICMP (1), length 84)
    10.40.0.1 > 10.38.0.2: ICMP echo request, id 128, seq 33, length 64
16:33:50.421605 IP (tos 0x0, ttl 64, id 19825, offset 0, flags [DF], proto ICMP (1), length 84)
    10.40.0.1 > 10.38.0.2: ICMP echo request, id 128, seq 34, length 64
16:33:51.422757 IP (tos 0x0, ttl 64, id 19826, offset 0, flags [DF], proto ICMP (1), length 84)
    10.40.0.1 > 10.38.0.2: ICMP echo request, id 128, seq 35, length 64
16:33:52.423902 IP (tos 0x0, ttl 64, id 19827, offset 0, flags [DF], proto ICMP (1), length 84)
    10.40.0.1 > 10.38.0.2: ICMP echo request, id 128, seq 36, length 64
16:33:53.425027 IP (tos 0x0, ttl 64, id 19828, offset 0, flags [DF], proto ICMP (1), length 84)
    10.40.0.1 > 10.38.0.2: ICMP echo request, id 128, seq 37, length 64
16:33:54.426244 IP (tos 0x0, ttl 64, id 19829, offset 0, flags [DF], proto ICMP (1), length 84)
    10.40.0.1 > 10.38.0.2: ICMP echo request, id 128, seq 38, length 64
16:33:55.426934 IP (tos 0x0, ttl 64, id 19830, offset 0, flags [DF], proto ICMP (1), length 84)
    10.40.0.1 > 10.38.0.2: ICMP echo request, id 128, seq 39, length 64
16:33:56.428061 IP (tos 0x0, ttl 64, id 19831, offset 0, flags [DF], proto ICMP (1), length 84)
    10.40.0.1 > 10.38.0.2: ICMP echo request, id 128, seq 40, length 64
16:33:57.429211 IP (tos 0x0, ttl 64, id 19832, offset 0, flags [DF], proto ICMP (1), length 84)
    10.40.0.1 > 10.38.0.2: ICMP echo request, id 128, seq 41, length 64
16:33:58.430344 IP (tos 0x0, ttl 64, id 19833, offset 0, flags [DF], proto ICMP (1), length 84)
    10.40.0.1 > 10.38.0.2: ICMP echo request, id 128, seq 42, length 64
16:33:59.431539 IP (tos 0x0, ttl 64, id 19834, offset 0, flags [DF], proto ICMP (1), length 84)
    10.40.0.1 > 10.38.0.2: ICMP echo request, id 128, seq 43, length 64
16:34:00.432693 IP (tos 0x0, ttl 64, id 19835, offset 0, flags [DF], proto ICMP (1), length 84)
    10.40.0.1 > 10.38.0.2: ICMP echo request, id 128, seq 44, length 64
16:34:01.433832 IP (tos 0x0, ttl 64, id 19836, offset 0, flags [DF], proto ICMP (1), length 84)
    10.40.0.1 > 10.38.0.2: ICMP echo request, id 128, seq 45, length 64
16:34:02.432852 ARP, Ethernet (len 6), IPv4 (len 4), Request who-has 10.38.0.2 tell 10.40.0.1, length 28
16:34:02.433776 ARP, Ethernet (len 6), IPv4 (len 4), Reply 10.38.0.2 is-at e6:8e:87:88:e8:53 (oui Unknown), length 28
```

tcpdump for weave interface while I do not ping anything

```
16:38:33.446788 ARP, Ethernet (len 6), IPv4 (len 4), Request who-has 10.32.0.4 tell 10.38.0.0, length 28
16:38:34.448805 ARP, Ethernet (len 6), IPv4 (len 4), Request who-has 10.32.0.4 tell 10.38.0.0, length 28
16:38:35.451501 ARP, Ethernet (len 6), IPv4 (len 4), Request who-has 10.32.0.4 tell 10.38.0.0, length 28
16:38:36.452845 ARP, Ethernet (len 6), IPv4 (len 4), Request who-has 10.32.0.4 tell 10.38.0.0, length 28
16:38:37.454726 ARP, Ethernet (len 6), IPv4 (len 4), Request who-has 10.32.0.4 tell 10.38.0.0, length 28
```

**Comment by awh** [comment]
@pondohva I guess you still have the `weave` script on those machines - does `weave status connections` look OK?

**Comment by awh** [comment]
_From @pondohva on October 20, 2016 17:49_

@awh yep, it's look ok (1 failed connection because I set equal KUBE_PEERS on all nodes)

```
[root@by1-depl-k8s-1 ~]# weave status connections
-> 10.128.13.198:6783    established fastdp 96:5b:2e:66:f4:b7(by1-depl-k8s-3.corp.mycompany.local)
<- 10.128.13.194:49767   established fastdp 46:ee:b5:e5:b7:86(by1-depl-k8s-2.corp.mycompany.local)
-> 10.128.13.22:6783     failed      cannot connect to ourself, retry: never
```

```
[root@by1-depl-k8s-2 ~]# weave status connections
-> 10.128.13.198:6783    established fastdp 96:5b:2e:66:f4:b7(by1-depl-k8s-3.corp.mycompany.local)
-> 10.128.13.22:6783     established fastdp ae:0f:36:eb:4a:58(by1-depl-k8s-1.corp.mycompany.local)
-> 10.128.13.194:6783    failed      cannot connect to ourself, retry: never
```

```
[root@by1-depl-k8s-3 ~]# weave status connections
<- 10.128.13.194:59491   established fastdp 46:ee:b5:e5:b7:86(by1-depl-k8s-2.corp.wargaming.local)
<- 10.128.13.22:43979    established fastdp ae:0f:36:eb:4a:58(by1-depl-k8s-1.corp.wargaming.local)
-> 10.128.13.198:6783    failed      cannot connect to ourself, retry: never
```

**Comment by awh** [comment]
_From @pondohva on October 20, 2016 21:40_

ok, I don't know the reason of my problem, but I've fixed the problem. What I've done on every node (I have a 3 controller setup):

1. service kubelet stop && kubectl delete po -n kube-system --all
1. rm -f /opt/cni/bin/weave-*
1. weave reset
1. rm -Rf /var/lib/weave-kube/weavedata.db
1. shutdown -r now

**Comment by awh** [comment]
@pondohva this list of actions was a once only fix, am I right? - you're not doing this every time you shut down a node are you?

**Comment by awh** [comment]
_From @pondohva on October 22, 2016 9:36_

@awh no, I don't. It is only once fix, you're right.

**Comment by awh** [comment]
_From @bboreham on November 1, 2016 17:11_

@pondohva was this related to https://github.com/weaveworks/weave/pull/2574 ?

**Comment by bboreham** [comment]
I think, in the absence of any more information about what was happening here, we should close the issue.
