### ISSUE TITLE
Connection refused on container restart

### ISSUE THREAD

**Issue by cwolfinger** [weaveworks/weave#2786]
Hello - I am seeing a strange issue with Weave.  

On one host, a container is running and it is unable to connect to a container on another host. It can ping the container but a tcp connections gets connection refused. If i stop the container (docker stop) and then issue a start (docker start) then container A can connect to container B.  

Weave version is 1.8

TCPDUMP

```
21:16:16.749360 IP 10.32.0.1.57798 > 10.42.0.6.8080: Flags [S], seq 3805969456, win 27400, options [mss 1370,sackOK,TS val 328098849 ecr 0,nop,wscale 9], length 0
21:16:16.749374 IP 10.32.0.1.57798 > 10.42.0.6.8080: Flags [S], seq 3805969456, win 27400, options [mss 1370,sackOK,TS val 328098849 ecr 0,nop,wscale 9], length 0
21:16:16.749375 IP 10.32.0.1.57798 > 10.42.0.6.8080: Flags [S], seq 3805969456, win 27400, options [mss 1370,sackOK,TS val 328098849 ecr 0,nop,wscale 9], length 0
21:16:16.749378 IP 10.32.0.1.57798 > 10.42.0.6.8080: Flags [S], seq 3805969456, win 27400, options [mss 1370,sackOK,TS val 328098849 ecr 0,nop,wscale 9], length 0
21:16:16.749731 IP 10.42.0.6.8080 > 10.32.0.1.57798: Flags [R.], seq 0, ack 3805969457, win 0, length 0
21:16:16.749735 IP 10.42.0.6.8080 > 10.32.0.1.57798: Flags [R.], seq 0, ack 1, win 0, length 0
21:16:16.749736 IP 10.42.0.6.8080 > 10.32.0.1.57798: Flags [R.], seq 0, ack 1, win 0, length 0
21:16:16.749742 IP 10.42.0.6.8080 > 10.32.0.1.57798: Flags [R.], seq 0, ack 1, win 0, length 0
21:16:17.751060 IP 10.32.0.1.58148 > 10.42.0.6.8080: Flags [S], seq 1217922077, win 27400, options [mss 1370,sackOK,TS val 328099099 ecr 0,nop,wscale 9], length 0
21:16:17.751075 IP 10.32.0.1.58148 > 10.42.0.6.8080: Flags [S], seq 1217922077, win 27400, options [mss 1370,sackOK,TS val 328099099 ecr 0,nop,wscale 9], length 0
21:16:17.751077 IP 10.32.0.1.58148 > 10.42.0.6.8080: Flags [S], seq 1217922077, win 27400, options [mss 1370,sackOK,TS val 328099099 ecr 0,nop,wscale 9], length 0
21:16:17.751083 IP 10.32.0.1.58148 > 10.42.0.6.8080: Flags [S], seq 1217922077, win 27400, options [mss 1370,sackOK,TS val 328099099 ecr 0,nop,wscale 9], length 0
21:16:17.751576 IP 10.42.0.6.8080 > 10.32.0.1.58148: Flags [R.], seq 0, ack 1217922078, win 0, length 0
21:16:17.751579 IP 10.42.0.6.8080 > 10.32.0.1.58148: Flags [R.], seq 0, ack 1, win 0, length 0
21:16:17.751580 IP 10.42.0.6.8080 > 10.32.0.1.58148: Flags [R.], seq 0, ack 1, win 0, length 0
21:16:17.751587 IP 10.42.0.6.8080 > 10.32.0.1.58148: Flags [R.], seq 0, ack 1, win 0, length 0
```

After a stop and start of the first container the connection is successful

```
21:16:16.749360 IP 10.32.0.1.57798 > 10.42.0.6.8080: Flags [S], seq 3805969456, win 27400, options [mss 1370,sackOK,TS val 328098849 ecr 0,nop,wscale 9], length 0
21:16:16.749374 IP 10.32.0.1.57798 > 10.42.0.6.8080: Flags [S], seq 3805969456, win 27400, options [mss 1370,sackOK,TS val 328098849 ecr 0,nop,wscale 9], length 0
21:16:16.749375 IP 10.32.0.1.57798 > 10.42.0.6.8080: Flags [S], seq 3805969456, win 27400, options [mss 1370,sackOK,TS val 328098849 ecr 0,nop,wscale 9], length 0
21:16:16.749378 IP 10.32.0.1.57798 > 10.42.0.6.8080: Flags [S], seq 3805969456, win 27400, options [mss 1370,sackOK,TS val 328098849 ecr 0,nop,wscale 9], length 0
21:16:16.749731 IP 10.42.0.6.8080 > 10.32.0.1.57798: Flags [R.], seq 0, ack 3805969457, win 0, length 0
21:16:16.749735 IP 10.42.0.6.8080 > 10.32.0.1.57798: Flags [R.], seq 0, ack 1, win 0, length 0
21:16:16.749736 IP 10.42.0.6.8080 > 10.32.0.1.57798: Flags [R.], seq 0, ack 1, win 0, length 0
21:16:16.749742 IP 10.42.0.6.8080 > 10.32.0.1.57798: Flags [R.], seq 0, ack 1, win 0, length 0
21:16:17.751060 IP 10.32.0.1.58148 > 10.42.0.6.8080: Flags [S], seq 1217922077, win 27400, options [mss 1370,sackOK,TS val 328099099 ecr 0,nop,wscale 9], length 0
21:16:17.751075 IP 10.32.0.1.58148 > 10.42.0.6.8080: Flags [S], seq 1217922077, win 27400, options [mss 1370,sackOK,TS val 328099099 ecr 0,nop,wscale 9], length 0
21:16:17.751077 IP 10.32.0.1.58148 > 10.42.0.6.8080: Flags [S], seq 1217922077, win 27400, options [mss 1370,sackOK,TS val 328099099 ecr 0,nop,wscale 9], length 0
21:16:17.751083 IP 10.32.0.1.58148 > 10.42.0.6.8080: Flags [S], seq 1217922077, win 27400, options [mss 1370,sackOK,TS val 328099099 ecr 0,nop,wscale 9], length 0
21:16:17.751576 IP 10.42.0.6.8080 > 10.32.0.1.58148: Flags [R.], seq 0, ack 1217922078, win 0, length 0
21:16:17.751579 IP 10.42.0.6.8080 > 10.32.0.1.58148: Flags [R.], seq 0, ack 1, win 0, length 0
21:16:17.751580 IP 10.42.0.6.8080 > 10.32.0.1.58148: Flags [R.], seq 0, ack 1, win 0, length 0
21:16:17.751587 IP 10.42.0.6.8080 > 10.32.0.1.58148: Flags [R.], seq 0, ack 1, win 0, length 0

```

**Comment by brb** [comment]
@cwolfinger Thanks for the report.

Could you provide the following:

* OS / distro / kernel version.
* Docker version.
* Weave logs from both hosts (`docker logs weave`).

By the way, the provided outputs of tcpdump are exactly the same.

**Comment by brb** [comment]
I'm closing this. If you experience the problem again, please re-open the issue.
