### ISSUE TITLE
No internet connection from any pod

### ISSUE THREAD

**Issue by dostoevskoy** [weaveworks/weave#3262]
Hello,

I'm using weave network for building my Kubernetes cluster. I've created 1 master 1 worker cluster and met an issue with connecting to any internet resource or any ip except the ip of host, when pod is running. pods communicate between each other well, but ican't reache any another ip (e.g external dns) 
Could you please assist with it?

## Versions:

```
$ weave version
weave script 2.2.0
weave 2.2.1

$ docker version
Client:
 Version:      17.09.1-ce
 API version:  1.32
 Go version:   go1.8.7
 Git commit:   f4ffd2511ce9
 Built:        Mon Mar  5 10:28:44 2018
 OS/Arch:      linux/amd64

Server:
 Version:      17.09.1-ce
 API version:  1.32 (minimum version 1.12)
 Go version:   go1.8.7
 Git commit:   f4ffd2511ce9
 Built:        Sat Oct 21 17:27:07 2017
 OS/Arch:      linux/amd64
 Experimental: false

$ uname -a
Linux mo-88201eb23 4.4.114-92.64-default #1 SMP Thu Feb 1 19:18:19 UTC 2018 (c6ce5db) x86_64 x86_64 x86_64 GNU/Linux
```

## Logs:
No any errors in weave log, only INFO messages

## Network:

```
$ ip route
on master:
default via 172.18.68.4 dev eth0  proto dhcp
10.32.0.0/12 dev weave  proto kernel  scope link  src 10.32.0.1
169.254.0.0/16 dev eth0  proto dhcp  scope link
169.254.169.254 dev eth0  scope link  metric 1
172.17.0.0/16 dev docker0  proto kernel  scope link  src 172.17.42.1 linkdown
172.18.68.0/22 dev eth0  proto kernel  scope link  src 172.18.69.12

on worker:
default via 172.18.68.4 dev eth0  proto dhcp
10.32.0.0/12 dev weave  proto kernel  scope link  src 10.46.0.0
169.254.169.254 dev eth0  scope link  metric 1
172.17.0.0/16 dev docker0  proto kernel  scope link  src 172.17.0.1 linkdown
172.18.68.0/22 dev eth0  proto kernel  scope link  src 172.18.70.94

$ ip -4 -o addr
master:
1: lo    inet 127.0.0.1/8 brd 127.255.255.255 scope host lo\       valid_lft forever preferred_lft forever
1: lo    inet 127.0.0.2/8 scope host secondary lo\       valid_lft forever preferred_lft forever
2: eth0    inet 172.18.69.12/22 brd 172.18.71.255 scope global eth0\       valid_lft forever preferred_lft forever
2: eth0    inet 172.18.69.128/22 scope global secondary eth0\       valid_lft forever preferred_lft forever
3: docker0    inet 172.17.42.1/16 scope global docker0\       valid_lft forever preferred_lft forever
10: weave    inet 10.32.0.1/12 brd 10.47.255.255 scope global weave\       valid_lft forever preferred_lft forever

worker:
1: lo    inet 127.0.0.1/8 brd 127.255.255.255 scope host lo\       valid_lft forever preferred_lft forever
1: lo    inet 127.0.0.2/8 scope host secondary lo\       valid_lft forever preferred_lft forever
2: eth0    inet 172.18.70.94/22 brd 172.18.71.255 scope global eth0\       valid_lft forever preferred_lft forever
3: docker0    inet 172.17.0.1/16 scope global docker0\       valid_lft forever preferred_lft forever
6: weave    inet 10.46.0.0/12 brd 10.47.255.255 scope global weave\       valid_lft forever preferred_lft forever


$ sudo iptables-save
master:
# Generated by iptables-save v1.4.21 on Tue Mar 20 15:55:12 2018
*nat
:PREROUTING ACCEPT [2:156]
:INPUT ACCEPT [2:156]
:OUTPUT ACCEPT [81:5252]
:POSTROUTING ACCEPT [83:5452]
:DOCKER - [0:0]
:KUBE-MARK-DROP - [0:0]
:KUBE-MARK-MASQ - [0:0]
:KUBE-NODEPORT-CONTAINER - [0:0]
:KUBE-NODEPORT-HOST - [0:0]
:KUBE-PORTALS-CONTAINER - [0:0]
:KUBE-PORTALS-HOST - [0:0]
:KUBE-POSTROUTING - [0:0]
:WEAVE - [0:0]
-A PREROUTING -m comment --comment "handle ClusterIPs; NOTE: this must be before the NodePort rules" -j KUBE-PORTALS-CONTAINER
-A PREROUTING -m addrtype --dst-type LOCAL -m comment --comment "handle service NodePorts; NOTE: this must be the last rule in the chain" -j KUBE-NODEPORT-CONTAINER
-A PREROUTING -m addrtype --dst-type LOCAL -j DOCKER
-A OUTPUT -m comment --comment "handle ClusterIPs; NOTE: this must be before the NodePort rules" -j KUBE-PORTALS-HOST
-A OUTPUT -m addrtype --dst-type LOCAL -m comment --comment "handle service NodePorts; NOTE: this must be the last rule in the chain" -j KUBE-NODEPORT-HOST
-A OUTPUT ! -d 127.0.0.0/8 -m addrtype --dst-type LOCAL -j DOCKER
-A POSTROUTING -m comment --comment "kubernetes postrouting rules" -j KUBE-POSTROUTING
-A POSTROUTING ! -s 10.244.0.0/16 -d 10.32.0.0/24 -j RETURN
-A POSTROUTING -s 10.244.0.0/16 -d 10.244.0.0/16 -j RETURN
-A POSTROUTING -s 10.244.0.0/16 ! -d 224.0.0.0/4 -j MASQUERADE
-A POSTROUTING ! -s 10.244.0.0/16 -d 10.244.0.0/24 -j RETURN
-A POSTROUTING ! -s 10.244.0.0/16 -d 10.244.0.0/16 -j MASQUERADE
-A POSTROUTING -j WEAVE
-A KUBE-MARK-DROP -j MARK --set-xmark 0x8000/0x8000
-A KUBE-MARK-MASQ -j MARK --set-xmark 0x4000/0x4000
-A KUBE-NODEPORT-CONTAINER -p tcp -m comment --comment "default/nginx:http" -m tcp --dport 30101 -j REDIRECT --to-ports 38424
-A KUBE-NODEPORT-CONTAINER -p tcp -m comment --comment "weave/weave-scope-app:app" -m tcp --dport 31686 -j REDIRECT --to-ports 43542
-A KUBE-NODEPORT-HOST -p tcp -m comment --comment "default/nginx:http" -m tcp --dport 30101 -j DNAT --to-destination 172.18.69.12:38424
-A KUBE-NODEPORT-HOST -p tcp -m comment --comment "weave/weave-scope-app:app" -m tcp --dport 31686 -j DNAT --to-destination 172.18.69.12:43542
-A KUBE-PORTALS-CONTAINER -d 10.96.0.1/32 -p tcp -m comment --comment "default/kubernetes:https" -m tcp --dport 443 -j REDIRECT --to-ports 35496
-A KUBE-PORTALS-CONTAINER -d 10.110.54.122/32 -p tcp -m comment --comment "default/nginx:http" -m tcp --dport 80 -j REDIRECT --to-ports 38424
-A KUBE-PORTALS-CONTAINER -d 10.96.0.10/32 -p udp -m comment --comment "kube-system/kube-dns:dns" -m udp --dport 53 -j REDIRECT --to-ports 48855
-A KUBE-PORTALS-CONTAINER -d 10.96.0.10/32 -p tcp -m comment --comment "kube-system/kube-dns:dns-tcp" -m tcp --dport 53 -j REDIRECT --to-ports 34208
-A KUBE-PORTALS-CONTAINER -d 10.97.102.205/32 -p tcp -m comment --comment "kube-system/kubernetes-dashboard:" -m tcp --dport 443 -j REDIRECT --to-ports 41478
-A KUBE-PORTALS-CONTAINER -d 10.98.235.44/32 -p tcp -m comment --comment "weave/weave-scope-app:app" -m tcp --dport 80 -j REDIRECT --to-ports 43542
-A KUBE-PORTALS-HOST -d 10.96.0.1/32 -p tcp -m comment --comment "default/kubernetes:https" -m tcp --dport 443 -j DNAT --to-destination 172.18.69.12:35496
-A KUBE-PORTALS-HOST -d 10.110.54.122/32 -p tcp -m comment --comment "default/nginx:http" -m tcp --dport 80 -j DNAT --to-destination 172.18.69.12:38424
-A KUBE-PORTALS-HOST -d 10.96.0.10/32 -p udp -m comment --comment "kube-system/kube-dns:dns" -m udp --dport 53 -j DNAT --to-destination 172.18.69.12:48855
-A KUBE-PORTALS-HOST -d 10.96.0.10/32 -p tcp -m comment --comment "kube-system/kube-dns:dns-tcp" -m tcp --dport 53 -j DNAT --to-destination 172.18.69.12:34208
-A KUBE-PORTALS-HOST -d 10.97.102.205/32 -p tcp -m comment --comment "kube-system/kubernetes-dashboard:" -m tcp --dport 443 -j DNAT --to-destination 172.18.69.12:41478
-A KUBE-PORTALS-HOST -d 10.98.235.44/32 -p tcp -m comment --comment "weave/weave-scope-app:app" -m tcp --dport 80 -j DNAT --to-destination 172.18.69.12:43542
-A KUBE-POSTROUTING -m comment --comment "kubernetes service traffic requiring SNAT" -m mark --mark 0x4000/0x4000 -j MASQUERADE
-A WEAVE -s 10.32.0.0/12 -d 224.0.0.0/4 -j RETURN
-A WEAVE ! -s 10.32.0.0/12 -d 10.32.0.0/12 -j MASQUERADE
-A WEAVE -s 10.32.0.0/12 ! -d 10.32.0.0/12 -j MASQUERADE
COMMIT
# Completed on Tue Mar 20 15:55:12 2018
# Generated by iptables-save v1.4.21 on Tue Mar 20 15:55:12 2018
*filter
:INPUT ACCEPT [0:0]
:FORWARD ACCEPT [0:0]
:OUTPUT ACCEPT [194854:90290365]
:DOCKER - [0:0]
:DOCKER-ISOLATION - [0:0]
:DOCKER-USER - [0:0]
:KUBE-FIREWALL - [0:0]
:KUBE-FORWARD - [0:0]
:KUBE-NODEPORT-NON-LOCAL - [0:0]
:KUBE-SERVICES - [0:0]
:MONSOON - [0:0]
:WEAVE-NPC - [0:0]
:WEAVE-NPC-DEFAULT - [0:0]
:WEAVE-NPC-INGRESS - [0:0]
-A INPUT -m comment --comment "Ensure that non-local NodePort traffic can flow" -j KUBE-NODEPORT-NON-LOCAL
-A INPUT -j KUBE-FIREWALL
-A INPUT -i lo -m comment --comment monsoon_base -j ACCEPT
-A INPUT -m comment --comment monsoon_base -j MONSOON
-A INPUT -p icmp -m icmp --icmp-type 8 -m comment --comment monsoon_base -j ACCEPT
-A INPUT -m state --state RELATED,ESTABLISHED -m comment --comment monsoon_base -j ACCEPT
-A INPUT -m comment --comment monsoon_base -j DROP
-A FORWARD -j DOCKER-USER
-A FORWARD -j DOCKER-ISOLATION
-A FORWARD -o docker0 -m conntrack --ctstate RELATED,ESTABLISHED -j ACCEPT
-A FORWARD -o docker0 -j DOCKER
-A FORWARD -i docker0 ! -o docker0 -j ACCEPT
-A FORWARD -i docker0 -o docker0 -j ACCEPT
-A FORWARD -o weave -m comment --comment "NOTE: this must go before \'-j KUBE-FORWARD\'" -j WEAVE-NPC
-A FORWARD -o weave -m state --state NEW -j NFLOG --nflog-group 86
-A FORWARD -o weave -j DROP
-A FORWARD -i weave ! -o weave -j ACCEPT
-A FORWARD -o weave -m conntrack --ctstate RELATED,ESTABLISHED -j ACCEPT
-A FORWARD -m comment --comment "kubernetes forward rules" -j KUBE-FORWARD
-A FORWARD -s 10.244.0.0/16 -j ACCEPT
-A FORWARD -d 10.244.0.0/16 -j ACCEPT
-A OUTPUT -j KUBE-FIREWALL
-A DOCKER-ISOLATION -j RETURN
-A DOCKER-USER -j RETURN
-A KUBE-FIREWALL -m comment --comment "kubernetes firewall for dropping marked packets" -m mark --mark 0x8000/0x8000 -j DROP
-A KUBE-FORWARD -m comment --comment "kubernetes forwarding rules" -m mark --mark 0x4000/0x4000 -j ACCEPT
-A KUBE-NODEPORT-NON-LOCAL -p tcp -m comment --comment "default/nginx:http" -m tcp --dport 38424 -m comment --comment "default/nginx:http" -m state --state NEW -j ACCEPT
-A KUBE-NODEPORT-NON-LOCAL -p tcp -m comment --comment "weave/weave-scope-app:app" -m tcp --dport 43542 -m comment --comment "weave/weave-scope-app:app" -m state --state NEW -j ACCEPT
-A KUBE-SERVICES -d 10.96.0.10/32 -p udp -m comment --comment "kube-system/kube-dns:dns has no endpoints" -m udp --dport 53 -j REJECT --reject-with icmp-port-unreachable
-A KUBE-SERVICES -d 10.96.0.10/32 -p tcp -m comment --comment "kube-system/kube-dns:dns-tcp has no endpoints" -m tcp --dport 53 -j REJECT --reject-with icmp-port-unreachable
-A WEAVE-NPC -m state --state RELATED,ESTABLISHED -j ACCEPT
-A WEAVE-NPC -d 224.0.0.0/4 -j ACCEPT
-A WEAVE-NPC -m state --state NEW -j WEAVE-NPC-DEFAULT
-A WEAVE-NPC -m state --state NEW -j WEAVE-NPC-INGRESS
-A WEAVE-NPC -m set ! --match-set weave-local-pods dst -j ACCEPT
-A WEAVE-NPC-DEFAULT -m set --match-set weave-E.1.0W^NGSp]0_t5WwH/]gX@L dst -m comment --comment "DefaultAllow isolation for namespace: default" -j ACCEPT
-A WEAVE-NPC-DEFAULT -m set --match-set weave-0EHD/vdN#O4]V?o4Tx7kS;APH dst -m comment --comment "DefaultAllow isolation for namespace: kube-public" -j ACCEPT
-A WEAVE-NPC-DEFAULT -m set --match-set weave-?b%zl9GIe0AET1(QI^7NWe*fO dst -m comment --comment "DefaultAllow isolation for namespace: kube-system" -j ACCEPT
-A WEAVE-NPC-DEFAULT -m set --match-set weave-olT1Y7{WGrtZ{bB/c;F^E%a?0 dst -m comment --comment "DefaultAllow isolation for namespace: weave" -j ACCEPT
COMMIT
# Completed on Tue Mar 20 15:55:12 2018

worker:
# Generated by iptables-save v1.4.21 on Tue Mar 20 15:56:08 2018
*nat
:PREROUTING ACCEPT [31:3514]
:INPUT ACCEPT [12:1662]
:OUTPUT ACCEPT [22:2871]
:POSTROUTING ACCEPT [35:4123]
:DOCKER - [0:0]
:KUBE-MARK-DROP - [0:0]
:KUBE-MARK-MASQ - [0:0]
:KUBE-NODEPORT-CONTAINER - [0:0]
:KUBE-NODEPORT-HOST - [0:0]
:KUBE-PORTALS-CONTAINER - [0:0]
:KUBE-PORTALS-HOST - [0:0]
:KUBE-POSTROUTING - [0:0]
:WEAVE - [0:0]
-A PREROUTING -m comment --comment "handle ClusterIPs; NOTE: this must be before the NodePort rules" -j KUBE-PORTALS-CONTAINER
-A PREROUTING -m addrtype --dst-type LOCAL -m comment --comment "handle service NodePorts; NOTE: this must be the last rule in the chain" -j KUBE-NODEPORT-CONTAINER
-A PREROUTING -m addrtype --dst-type LOCAL -j DOCKER
-A OUTPUT -m comment --comment "handle ClusterIPs; NOTE: this must be before the NodePort rules" -j KUBE-PORTALS-HOST
-A OUTPUT -m addrtype --dst-type LOCAL -m comment --comment "handle service NodePorts; NOTE: this must be the last rule in the chain" -j KUBE-NODEPORT-HOST
-A OUTPUT ! -d 127.0.0.0/8 -m addrtype --dst-type LOCAL -j DOCKER
-A POSTROUTING -m comment --comment "kubernetes postrouting rules" -j KUBE-POSTROUTING
-A POSTROUTING -j WEAVE
-A KUBE-MARK-DROP -j MARK --set-xmark 0x8000/0x8000
-A KUBE-MARK-MASQ -j MARK --set-xmark 0x4000/0x4000
-A KUBE-NODEPORT-CONTAINER -p tcp -m comment --comment "weave/weave-scope-app:app" -m tcp --dport 31686 -j REDIRECT --to-ports 43873
-A KUBE-NODEPORT-CONTAINER -p tcp -m comment --comment "default/nginx:http" -m tcp --dport 30101 -j REDIRECT --to-ports 43925
-A KUBE-NODEPORT-HOST -p tcp -m comment --comment "weave/weave-scope-app:app" -m tcp --dport 31686 -j DNAT --to-destination 172.18.70.94:43873
-A KUBE-NODEPORT-HOST -p tcp -m comment --comment "default/nginx:http" -m tcp --dport 30101 -j DNAT --to-destination 172.18.70.94:43925
-A KUBE-PORTALS-CONTAINER -d 10.98.235.44/32 -p tcp -m comment --comment "weave/weave-scope-app:app" -m tcp --dport 80 -j REDIRECT --to-ports 43873
-A KUBE-PORTALS-CONTAINER -d 10.96.0.1/32 -p tcp -m comment --comment "default/kubernetes:https" -m tcp --dport 443 -j REDIRECT --to-ports 44093
-A KUBE-PORTALS-CONTAINER -d 10.110.54.122/32 -p tcp -m comment --comment "default/nginx:http" -m tcp --dport 80 -j REDIRECT --to-ports 43925
-A KUBE-PORTALS-CONTAINER -d 10.96.0.10/32 -p udp -m comment --comment "kube-system/kube-dns:dns" -m udp --dport 53 -j REDIRECT --to-ports 50623
-A KUBE-PORTALS-CONTAINER -d 10.96.0.10/32 -p tcp -m comment --comment "kube-system/kube-dns:dns-tcp" -m tcp --dport 53 -j REDIRECT --to-ports 37197
-A KUBE-PORTALS-CONTAINER -d 10.97.102.205/32 -p tcp -m comment --comment "kube-system/kubernetes-dashboard:" -m tcp --dport 443 -j REDIRECT --to-ports 37806
-A KUBE-PORTALS-HOST -d 10.98.235.44/32 -p tcp -m comment --comment "weave/weave-scope-app:app" -m tcp --dport 80 -j DNAT --to-destination 172.18.70.94:43873
-A KUBE-PORTALS-HOST -d 10.96.0.1/32 -p tcp -m comment --comment "default/kubernetes:https" -m tcp --dport 443 -j DNAT --to-destination 172.18.70.94:44093
-A KUBE-PORTALS-HOST -d 10.110.54.122/32 -p tcp -m comment --comment "default/nginx:http" -m tcp --dport 80 -j DNAT --to-destination 172.18.70.94:43925
-A KUBE-PORTALS-HOST -d 10.96.0.10/32 -p udp -m comment --comment "kube-system/kube-dns:dns" -m udp --dport 53 -j DNAT --to-destination 172.18.70.94:50623
-A KUBE-PORTALS-HOST -d 10.96.0.10/32 -p tcp -m comment --comment "kube-system/kube-dns:dns-tcp" -m tcp --dport 53 -j DNAT --to-destination 172.18.70.94:37197
-A KUBE-PORTALS-HOST -d 10.97.102.205/32 -p tcp -m comment --comment "kube-system/kubernetes-dashboard:" -m tcp --dport 443 -j DNAT --to-destination 172.18.70.94:37806
-A KUBE-POSTROUTING -m comment --comment "kubernetes service traffic requiring SNAT" -m mark --mark 0x4000/0x4000 -j MASQUERADE
-A WEAVE -s 10.32.0.0/12 -d 224.0.0.0/4 -j RETURN
-A WEAVE ! -s 10.32.0.0/12 -d 10.32.0.0/12 -j MASQUERADE
-A WEAVE -s 10.32.0.0/12 ! -d 10.32.0.0/12 -j MASQUERADE
COMMIT
# Completed on Tue Mar 20 15:56:08 2018
# Generated by iptables-save v1.4.21 on Tue Mar 20 15:56:08 2018
*filter
:INPUT ACCEPT [0:0]
:FORWARD ACCEPT [0:0]
:OUTPUT ACCEPT [58684:105641345]
:DOCKER - [0:0]
:DOCKER-ISOLATION - [0:0]
:DOCKER-USER - [0:0]
:KUBE-FIREWALL - [0:0]
:KUBE-NODEPORT-NON-LOCAL - [0:0]
:MONSOON - [0:0]
:WEAVE-NPC - [0:0]
:WEAVE-NPC-DEFAULT - [0:0]
:WEAVE-NPC-INGRESS - [0:0]
-A INPUT -j KUBE-FIREWALL
-A INPUT -m comment --comment "Ensure that non-local NodePort traffic can flow" -j KUBE-NODEPORT-NON-LOCAL
-A INPUT -i lo -m comment --comment monsoon_base -j ACCEPT
-A INPUT -m comment --comment monsoon_base -j MONSOON
-A INPUT -p icmp -m icmp --icmp-type 8 -m comment --comment monsoon_base -j ACCEPT
-A INPUT -m state --state RELATED,ESTABLISHED -m comment --comment monsoon_base -j ACCEPT
-A INPUT -m comment --comment monsoon_base -j DROP
-A FORWARD -o weave -m comment --comment "NOTE: this must go before \'-j KUBE-FORWARD\'" -j WEAVE-NPC
-A FORWARD -o weave -m state --state NEW -j NFLOG --nflog-group 86
-A FORWARD -o weave -j DROP
-A FORWARD -i weave ! -o weave -j ACCEPT
-A FORWARD -o weave -m conntrack --ctstate RELATED,ESTABLISHED -j ACCEPT
-A FORWARD -j DOCKER-USER
-A FORWARD -j DOCKER-ISOLATION
-A FORWARD -o docker0 -m conntrack --ctstate RELATED,ESTABLISHED -j ACCEPT
-A FORWARD -o docker0 -j DOCKER
-A FORWARD -i docker0 ! -o docker0 -j ACCEPT
-A FORWARD -i docker0 -o docker0 -j ACCEPT
-A OUTPUT -j KUBE-FIREWALL
-A DOCKER-ISOLATION -j RETURN
-A DOCKER-USER -j RETURN
-A KUBE-FIREWALL -m comment --comment "kubernetes firewall for dropping marked packets" -m mark --mark 0x8000/0x8000 -j DROP
-A KUBE-NODEPORT-NON-LOCAL -p tcp -m comment --comment "weave/weave-scope-app:app" -m tcp --dport 43873 -m comment --comment "weave/weave-scope-app:app" -m state --state NEW -j ACCEPT
-A KUBE-NODEPORT-NON-LOCAL -p tcp -m comment --comment "default/nginx:http" -m tcp --dport 43925 -m comment --comment "default/nginx:http" -m state --state NEW -j ACCEPT
-A WEAVE-NPC -m state --state RELATED,ESTABLISHED -j ACCEPT
-A WEAVE-NPC -d 224.0.0.0/4 -j ACCEPT
-A WEAVE-NPC -m state --state NEW -j WEAVE-NPC-DEFAULT
-A WEAVE-NPC -m state --state NEW -j WEAVE-NPC-INGRESS
-A WEAVE-NPC -m set ! --match-set weave-local-pods dst -j ACCEPT
-A WEAVE-NPC-DEFAULT -m set --match-set weave-E.1.0W^NGSp]0_t5WwH/]gX@L dst -m comment --comment "DefaultAllow isolation for namespace: default" -j ACCEPT
-A WEAVE-NPC-DEFAULT -m set --match-set weave-0EHD/vdN#O4]V?o4Tx7kS;APH dst -m comment --comment "DefaultAllow isolation for namespace: kube-public" -j ACCEPT
-A WEAVE-NPC-DEFAULT -m set --match-set weave-?b%zl9GIe0AET1(QI^7NWe*fO dst -m comment --comment "DefaultAllow isolation for namespace: kube-system" -j ACCEPT
-A WEAVE-NPC-DEFAULT -m set --match-set weave-olT1Y7{WGrtZ{bB/c;F^E%a?0 dst -m comment --comment "DefaultAllow isolation for namespace: weave" -j ACCEPT
COMMIT
# Completed on Tue Mar 20 15:56:08 2018

```

**Comment by brb** [comment]
Thanks for the issue.

1. Does `ip route` run on any of pods which cannot reach internet has a default route?
2. If you run `tcpdump -i weave` from the worker node and try connecting to internet from the pod, do you see packets in tcpdump?
3. Could you run `iptables-save -c` from the worker node, save the output, then try to reach internet from the pod, and run `iptables-save -c` again?

**Comment by dostoevskoy** [comment]
1. `ip route` on master and worker respectively :
master - `10.32.0.0/12 dev weave  proto kernel  scope link  src 10.32.0.1`
worker - `10.32.0.0/12 dev weave  proto kernel  scope link  src 10.46.0.0`
2. I've tried to run a command `curl http://example.com` and got the next in tcpdump output:
```
18:17:04.372150 IP 10.46.0.86.52455 > 10.46.0.0.50623: UDP, length 29
18:17:04.372214 IP 10.46.0.86.52455 > 10.46.0.0.50623: UDP, length 29
18:17:04.372460 IP 10.46.0.0.43295 > 10.46.0.65.domain: 49713+ A? example.com. (29)
18:17:04.372517 IP 10.46.0.0.43295 > 10.46.0.65.domain: 22621+ AAAA? example.com. (29)
18:17:04.372656 IP 10.46.0.65.47668 > 172.18.4.9.domain: 30788+ A? example.com. (29)
18:17:04.372750 IP 10.46.0.65.47668 > 172.18.4.10.domain: 30788+ A? example.com. (29)
18:17:04.372855 IP 10.46.0.65.24586 > 172.18.4.9.domain: 15995+ AAAA? example.com. (29)
18:17:04.372907 IP 10.46.0.65.24586 > 172.18.4.10.domain: 15995+ AAAA? example.com. (29)
```
172.18.4.9 and 172.18.4.10 are dns servers inherited from the worker host but kubedns can't connect to them because the are in external network for him (kubedns runs as deployment and has pods in the same weave network)
3.  iptables before the check
```
# Generated by iptables-save v1.4.21 on Tue Mar 20 18:24:18 2018
*nat
:PREROUTING ACCEPT [64:7003]
:INPUT ACCEPT [23:2945]
:OUTPUT ACCEPT [46:4690]
:POSTROUTING ACCEPT [76:7596]
:DOCKER - [0:0]
:KUBE-MARK-DROP - [0:0]
:KUBE-MARK-MASQ - [0:0]
:KUBE-NODEPORT-CONTAINER - [0:0]
:KUBE-NODEPORT-HOST - [0:0]
:KUBE-PORTALS-CONTAINER - [0:0]
:KUBE-PORTALS-HOST - [0:0]
:KUBE-POSTROUTING - [0:0]
:WEAVE - [0:0]
[85621:9388245] -A PREROUTING -m comment --comment "handle ClusterIPs; NOTE: this must be before the NodePort rules" -j KUBE-PORTALS-CONTAINER
[29491:3933349] -A PREROUTING -m addrtype --dst-type LOCAL -m comment --comment "handle service NodePorts; NOTE: this must be the last rule in the chain" -j KUBE-NODEPORT-CONTAINER
[29490:3933289] -A PREROUTING -m addrtype --dst-type LOCAL -j DOCKER
[76803:8099986] -A OUTPUT -m comment --comment "handle ClusterIPs; NOTE: this must be before the NodePort rules" -j KUBE-PORTALS-HOST
[15915:954900] -A OUTPUT -m addrtype --dst-type LOCAL -m comment --comment "handle service NodePorts; NOTE: this must be the last rule in the chain" -j KUBE-NODEPORT-HOST
[1181:70860] -A OUTPUT ! -d 127.0.0.0/8 -m addrtype --dst-type LOCAL -j DOCKER
[130474:13309241] -A POSTROUTING -m comment --comment "kubernetes postrouting rules" -j KUBE-POSTROUTING
[130431:13306557] -A POSTROUTING -j WEAVE
[0:0] -A KUBE-MARK-DROP -j MARK --set-xmark 0x8000/0x8000
[0:0] -A KUBE-MARK-MASQ -j MARK --set-xmark 0x4000/0x4000
[0:0] -A KUBE-NODEPORT-CONTAINER -p tcp -m comment --comment "weave/weave-scope-app:app" -m tcp --dport 31686 -j REDIRECT --to-ports 43873
[0:0] -A KUBE-NODEPORT-CONTAINER -p tcp -m comment --comment "default/nginx:http" -m tcp --dport 30101 -j REDIRECT --to-ports 43925
[0:0] -A KUBE-NODEPORT-HOST -p tcp -m comment --comment "weave/weave-scope-app:app" -m tcp --dport 31686 -j DNAT --to-destination 172.18.70.94:43873
[0:0] -A KUBE-NODEPORT-HOST -p tcp -m comment --comment "default/nginx:http" -m tcp --dport 30101 -j DNAT --to-destination 172.18.70.94:43925
[0:0] -A KUBE-PORTALS-CONTAINER -d 10.98.235.44/32 -p tcp -m comment --comment "weave/weave-scope-app:app" -m tcp --dport 80 -j REDIRECT --to-ports 43873
[6:360] -A KUBE-PORTALS-CONTAINER -d 10.96.0.1/32 -p tcp -m comment --comment "default/kubernetes:https" -m tcp --dport 443 -j REDIRECT --to-ports 44093
[0:0] -A KUBE-PORTALS-CONTAINER -d 10.110.54.122/32 -p tcp -m comment --comment "default/nginx:http" -m tcp --dport 80 -j REDIRECT --to-ports 43925
[118:8294] -A KUBE-PORTALS-CONTAINER -d 10.96.0.10/32 -p udp -m comment --comment "kube-system/kube-dns:dns" -m udp --dport 53 -j REDIRECT --to-ports 50623
[0:0] -A KUBE-PORTALS-CONTAINER -d 10.96.0.10/32 -p tcp -m comment --comment "kube-system/kube-dns:dns-tcp" -m tcp --dport 53 -j REDIRECT --to-ports 37197
[0:0] -A KUBE-PORTALS-CONTAINER -d 10.97.102.205/32 -p tcp -m comment --comment "kube-system/kubernetes-dashboard:" -m tcp --dport 443 -j REDIRECT --to-ports 37806
[1119:67140] -A KUBE-PORTALS-HOST -d 10.98.235.44/32 -p tcp -m comment --comment "weave/weave-scope-app:app" -m tcp --dport 80 -j DNAT --to-destination 172.18.70.94:43873
[36:2160] -A KUBE-PORTALS-HOST -d 10.96.0.1/32 -p tcp -m comment --comment "default/kubernetes:https" -m tcp --dport 443 -j DNAT --to-destination 172.18.70.94:44093
[0:0] -A KUBE-PORTALS-HOST -d 10.110.54.122/32 -p tcp -m comment --comment "default/nginx:http" -m tcp --dport 80 -j DNAT --to-destination 172.18.70.94:43925
[13683:1351487] -A KUBE-PORTALS-HOST -d 10.96.0.10/32 -p udp -m comment --comment "kube-system/kube-dns:dns" -m udp --dport 53 -j DNAT --to-destination 172.18.70.94:50623
[0:0] -A KUBE-PORTALS-HOST -d 10.96.0.10/32 -p tcp -m comment --comment "kube-system/kube-dns:dns-tcp" -m tcp --dport 53 -j DNAT --to-destination 172.18.70.94:37197
[0:0] -A KUBE-PORTALS-HOST -d 10.97.102.205/32 -p tcp -m comment --comment "kube-system/kubernetes-dashboard:" -m tcp --dport 443 -j DNAT --to-destination 172.18.70.94:37806
[0:0] -A KUBE-POSTROUTING -m comment --comment "kubernetes service traffic requiring SNAT" -m mark --mark 0x4000/0x4000 -j MASQUERADE
[0:0] -A WEAVE -s 10.32.0.0/12 -d 224.0.0.0/4 -j RETURN
[0:0] -A WEAVE ! -s 10.32.0.0/12 -d 10.32.0.0/12 -j MASQUERADE
[29234:2855369] -A WEAVE -s 10.32.0.0/12 ! -d 10.32.0.0/12 -j MASQUERADE
COMMIT
# Completed on Tue Mar 20 18:24:18 2018
# Generated by iptables-save v1.4.21 on Tue Mar 20 18:24:18 2018
*filter
:INPUT ACCEPT [0:0]
:FORWARD ACCEPT [0:0]
:OUTPUT ACCEPT [685951:1210889155]
:DOCKER - [0:0]
:DOCKER-ISOLATION - [0:0]
:DOCKER-USER - [0:0]
:KUBE-FIREWALL - [0:0]
:KUBE-NODEPORT-NON-LOCAL - [0:0]
:MONSOON - [0:0]
:WEAVE-NPC - [0:0]
:WEAVE-NPC-DEFAULT - [0:0]
:WEAVE-NPC-INGRESS - [0:0]
[1010856:1420408841] -A INPUT -j KUBE-FIREWALL
[1011128:1420492423] -A INPUT -m comment --comment "Ensure that non-local NodePort traffic can flow" -j KUBE-NODEPORT-NON-LOCAL
[386828:985363543] -A INPUT -i lo -m comment --comment monsoon_base -j ACCEPT
[623325:435074742] -A INPUT -m comment --comment monsoon_base -j MONSOON
[621:52240] -A INPUT -p icmp -m icmp --icmp-type 8 -m comment --comment monsoon_base -j ACCEPT
[22:1408] -A INPUT -m state --state RELATED,ESTABLISHED -m comment --comment monsoon_base -j ACCEPT
[0:0] -A INPUT -m comment --comment monsoon_base -j DROP
[142883:280439228] -A FORWARD -o weave -m comment --comment "NOTE: this must go before \'-j KUBE-FORWARD\'" -j WEAVE-NPC
[0:0] -A FORWARD -o weave -m state --state NEW -j NFLOG --nflog-group 86
[0:0] -A FORWARD -o weave -j DROP
[29748:2886329] -A FORWARD -i weave ! -o weave -j ACCEPT
[0:0] -A FORWARD -o weave -m conntrack --ctstate RELATED,ESTABLISHED -j ACCEPT
[0:0] -A FORWARD -j DOCKER-USER
[0:0] -A FORWARD -j DOCKER-ISOLATION
[0:0] -A FORWARD -o docker0 -m conntrack --ctstate RELATED,ESTABLISHED -j ACCEPT
[0:0] -A FORWARD -o docker0 -j DOCKER
[0:0] -A FORWARD -i docker0 ! -o docker0 -j ACCEPT
[0:0] -A FORWARD -i docker0 -o docker0 -j ACCEPT
[807482:1408016087] -A OUTPUT -j KUBE-FIREWALL
[0:0] -A DOCKER-ISOLATION -j RETURN
[0:0] -A DOCKER-USER -j RETURN
[0:0] -A KUBE-FIREWALL -m comment --comment "kubernetes firewall for dropping marked packets" -m mark --mark 0x8000/0x8000 -j DROP
[1119:67140] -A KUBE-NODEPORT-NON-LOCAL -p tcp -m comment --comment "weave/weave-scope-app:app" -m tcp --dport 43873 -m comment --comment "weave/weave-scope-app:app" -m state --state NEW -j ACCEPT
[0:0] -A KUBE-NODEPORT-NON-LOCAL -p tcp -m comment --comment "default/nginx:http" -m tcp --dport 43925 -m comment --comment "default/nginx:http" -m state --state NEW -j ACCEPT
[299998:307417249] -A MONSOON -p udp -m udp -m comment --comment sg-4f8dbaef -j ACCEPT
[322684:127603845] -A MONSOON -p tcp -m tcp -m comment --comment sg-4f8dbaef -j ACCEPT
[101183:239261038] -A WEAVE-NPC -m state --state RELATED,ESTABLISHED -j ACCEPT
[0:0] -A WEAVE-NPC -d 224.0.0.0/4 -j ACCEPT
[21179:2038984] -A WEAVE-NPC -m state --state NEW -j WEAVE-NPC-DEFAULT
[0:0] -A WEAVE-NPC -m state --state NEW -j WEAVE-NPC-INGRESS
[0:0] -A WEAVE-NPC -m set ! --match-set weave-local-pods dst -j ACCEPT
[0:0] -A WEAVE-NPC-DEFAULT -m set --match-set weave-E.1.0W^NGSp]0_t5WwH/]gX@L dst -m comment --comment "DefaultAllow isolation for namespace: default" -j ACCEPT
[0:0] -A WEAVE-NPC-DEFAULT -m set --match-set weave-0EHD/vdN#O4]V?o4Tx7kS;APH dst -m comment --comment "DefaultAllow isolation for namespace: kube-public" -j ACCEPT
[19716:1951204] -A WEAVE-NPC-DEFAULT -m set --match-set weave-?b%zl9GIe0AET1(QI^7NWe*fO dst -m comment --comment "DefaultAllow isolation for namespace: kube-system" -j ACCEPT
[1463:87780] -A WEAVE-NPC-DEFAULT -m set --match-set weave-olT1Y7{WGrtZ{bB/c;F^E%a?0 dst -m comment --comment "DefaultAllow isolation for namespace: weave" -j ACCEPT
COMMIT
# Completed on Tue Mar 20 18:24:18 2018
```


and iptables during the check:
```
# Generated by iptables-save v1.4.21 on Tue Mar 20 18:24:36 2018
*nat
:PREROUTING ACCEPT [85:9536]
:INPUT ACCEPT [35:4633]
:OUTPUT ACCEPT [58:6863]
:POSTROUTING ACCEPT [97:10623]
:DOCKER - [0:0]
:KUBE-MARK-DROP - [0:0]
:KUBE-MARK-MASQ - [0:0]
:KUBE-NODEPORT-CONTAINER - [0:0]
:KUBE-NODEPORT-HOST - [0:0]
:KUBE-PORTALS-CONTAINER - [0:0]
:KUBE-PORTALS-HOST - [0:0]
:KUBE-POSTROUTING - [0:0]
:WEAVE - [0:0]
[85763:9403905] -A PREROUTING -m comment --comment "handle ClusterIPs; NOTE: this must be before the NodePort rules" -j KUBE-PORTALS-CONTAINER
[29538:3939761] -A PREROUTING -m addrtype --dst-type LOCAL -m comment --comment "handle service NodePorts; NOTE: this must be the last rule in the chain" -j KUBE-NODEPORT-CONTAINER
[29537:3939701] -A PREROUTING -m addrtype --dst-type LOCAL -j DOCKER
[76932:8113941] -A OUTPUT -m comment --comment "handle ClusterIPs; NOTE: this must be before the NodePort rules" -j KUBE-PORTALS-HOST
[15938:956280] -A OUTPUT -m addrtype --dst-type LOCAL -m comment --comment "handle service NodePorts; NOTE: this must be the last rule in the chain" -j KUBE-NODEPORT-HOST
[1184:71040] -A OUTPUT ! -d 127.0.0.0/8 -m addrtype --dst-type LOCAL -j DOCKER
[130692:13331852] -A POSTROUTING -m comment --comment "kubernetes postrouting rules" -j KUBE-POSTROUTING
[130649:13329168] -A POSTROUTING -j WEAVE
[0:0] -A KUBE-MARK-DROP -j MARK --set-xmark 0x8000/0x8000
[0:0] -A KUBE-MARK-MASQ -j MARK --set-xmark 0x4000/0x4000
[0:0] -A KUBE-NODEPORT-CONTAINER -p tcp -m comment --comment "weave/weave-scope-app:app" -m tcp --dport 31686 -j REDIRECT --to-ports 43873
[0:0] -A KUBE-NODEPORT-CONTAINER -p tcp -m comment --comment "default/nginx:http" -m tcp --dport 30101 -j REDIRECT --to-ports 43925
[0:0] -A KUBE-NODEPORT-HOST -p tcp -m comment --comment "weave/weave-scope-app:app" -m tcp --dport 31686 -j DNAT --to-destination 172.18.70.94:43873
[0:0] -A KUBE-NODEPORT-HOST -p tcp -m comment --comment "default/nginx:http" -m tcp --dport 30101 -j DNAT --to-destination 172.18.70.94:43925
[0:0] -A KUBE-PORTALS-CONTAINER -d 10.98.235.44/32 -p tcp -m comment --comment "weave/weave-scope-app:app" -m tcp --dport 80 -j REDIRECT --to-ports 43873
[6:360] -A KUBE-PORTALS-CONTAINER -d 10.96.0.1/32 -p tcp -m comment --comment "default/kubernetes:https" -m tcp --dport 443 -j REDIRECT --to-ports 44093
[0:0] -A KUBE-PORTALS-CONTAINER -d 10.110.54.122/32 -p tcp -m comment --comment "default/nginx:http" -m tcp --dport 80 -j REDIRECT --to-ports 43925
[122:8595] -A KUBE-PORTALS-CONTAINER -d 10.96.0.10/32 -p udp -m comment --comment "kube-system/kube-dns:dns" -m udp --dport 53 -j REDIRECT --to-ports 50623
[0:0] -A KUBE-PORTALS-CONTAINER -d 10.96.0.10/32 -p tcp -m comment --comment "kube-system/kube-dns:dns-tcp" -m tcp --dport 53 -j REDIRECT --to-ports 37197
[0:0] -A KUBE-PORTALS-CONTAINER -d 10.97.102.205/32 -p tcp -m comment --comment "kube-system/kubernetes-dashboard:" -m tcp --dport 443 -j REDIRECT --to-ports 37806
[1121:67260] -A KUBE-PORTALS-HOST -d 10.98.235.44/32 -p tcp -m comment --comment "weave/weave-scope-app:app" -m tcp --dport 80 -j DNAT --to-destination 172.18.70.94:43873
[36:2160] -A KUBE-PORTALS-HOST -d 10.96.0.1/32 -p tcp -m comment --comment "default/kubernetes:https" -m tcp --dport 443 -j DNAT --to-destination 172.18.70.94:44093
[0:0] -A KUBE-PORTALS-HOST -d 10.110.54.122/32 -p tcp -m comment --comment "default/nginx:http" -m tcp --dport 80 -j DNAT --to-destination 172.18.70.94:43925
[13707:1353871] -A KUBE-PORTALS-HOST -d 10.96.0.10/32 -p udp -m comment --comment "kube-system/kube-dns:dns" -m udp --dport 53 -j DNAT --to-destination 172.18.70.94:50623
[0:0] -A KUBE-PORTALS-HOST -d 10.96.0.10/32 -p tcp -m comment --comment "kube-system/kube-dns:dns-tcp" -m tcp --dport 53 -j DNAT --to-destination 172.18.70.94:37197
[0:0] -A KUBE-PORTALS-HOST -d 10.97.102.205/32 -p tcp -m comment --comment "kube-system/kubernetes-dashboard:" -m tcp --dport 443 -j DNAT --to-destination 172.18.70.94:37806
[0:0] -A KUBE-POSTROUTING -m comment --comment "kubernetes service traffic requiring SNAT" -m mark --mark 0x4000/0x4000 -j MASQUERADE
[0:0] -A WEAVE -s 10.32.0.0/12 -d 224.0.0.0/4 -j RETURN
[0:0] -A WEAVE ! -s 10.32.0.0/12 -d 10.32.0.0/12 -j MASQUERADE
[29282:2860065] -A WEAVE -s 10.32.0.0/12 ! -d 10.32.0.0/12 -j MASQUERADE
COMMIT
# Completed on Tue Mar 20 18:24:36 2018
# Generated by iptables-save v1.4.21 on Tue Mar 20 18:24:36 2018
*filter
:INPUT ACCEPT [0:0]
:FORWARD ACCEPT [0:0]
:OUTPUT ACCEPT [687220:1213126276]
:DOCKER - [0:0]
:DOCKER-ISOLATION - [0:0]
:DOCKER-USER - [0:0]
:KUBE-FIREWALL - [0:0]
:KUBE-NODEPORT-NON-LOCAL - [0:0]
:MONSOON - [0:0]
:WEAVE-NPC - [0:0]
:WEAVE-NPC-DEFAULT - [0:0]
:WEAVE-NPC-INGRESS - [0:0]
[1012488:1422686158] -A INPUT -j KUBE-FIREWALL
[1012760:1422769740] -A INPUT -m comment --comment "Ensure that non-local NodePort traffic can flow" -j KUBE-NODEPORT-NON-LOCAL
[387423:986923990] -A INPUT -i lo -m comment --comment monsoon_base -j ACCEPT
[624360:435791492] -A INPUT -m comment --comment monsoon_base -j MONSOON
[621:52240] -A INPUT -p icmp -m icmp --icmp-type 8 -m comment --comment monsoon_base -j ACCEPT
[22:1408] -A INPUT -m state --state RELATED,ESTABLISHED -m comment --comment monsoon_base -j ACCEPT
[0:0] -A INPUT -m comment --comment monsoon_base -j DROP
[143101:280917191] -A FORWARD -o weave -m comment --comment "NOTE: this must go before \'-j KUBE-FORWARD\'" -j WEAVE-NPC
[0:0] -A FORWARD -o weave -m state --state NEW -j NFLOG --nflog-group 86
[0:0] -A FORWARD -o weave -j DROP
[29797:2891085] -A FORWARD -i weave ! -o weave -j ACCEPT
[0:0] -A FORWARD -o weave -m conntrack --ctstate RELATED,ESTABLISHED -j ACCEPT
[0:0] -A FORWARD -j DOCKER-USER
[0:0] -A FORWARD -j DOCKER-ISOLATION
[0:0] -A FORWARD -o docker0 -m conntrack --ctstate RELATED,ESTABLISHED -j ACCEPT
[0:0] -A FORWARD -o docker0 -j DOCKER
[0:0] -A FORWARD -i docker0 ! -o docker0 -j ACCEPT
[0:0] -A FORWARD -i docker0 -o docker0 -j ACCEPT
[808751:1410253208] -A OUTPUT -j KUBE-FIREWALL
[0:0] -A DOCKER-ISOLATION -j RETURN
[0:0] -A DOCKER-USER -j RETURN
[0:0] -A KUBE-FIREWALL -m comment --comment "kubernetes firewall for dropping marked packets" -m mark --mark 0x8000/0x8000 -j DROP
[1121:67260] -A KUBE-NODEPORT-NON-LOCAL -p tcp -m comment --comment "weave/weave-scope-app:app" -m tcp --dport 43873 -m comment --comment "weave/weave-scope-app:app" -m state --state NEW -j ACCEPT
[0:0] -A KUBE-NODEPORT-NON-LOCAL -p tcp -m comment --comment "default/nginx:http" -m tcp --dport 43925 -m comment --comment "default/nginx:http" -m state --state NEW -j ACCEPT
[101360:239735041] -A WEAVE-NPC -m state --state RELATED,ESTABLISHED -j ACCEPT
[0:0] -A WEAVE-NPC -d 224.0.0.0/4 -j ACCEPT
[21220:2042944] -A WEAVE-NPC -m state --state NEW -j WEAVE-NPC-DEFAULT
[0:0] -A WEAVE-NPC -m state --state NEW -j WEAVE-NPC-INGRESS
[0:0] -A WEAVE-NPC -m set ! --match-set weave-local-pods dst -j ACCEPT
[0:0] -A WEAVE-NPC-DEFAULT -m set --match-set weave-E.1.0W^NGSp]0_t5WwH/]gX@L dst -m comment --comment "DefaultAllow isolation for namespace: default" -j ACCEPT
[0:0] -A WEAVE-NPC-DEFAULT -m set --match-set weave-0EHD/vdN#O4]V?o4Tx7kS;APH dst -m comment --comment "DefaultAllow isolation for namespace: kube-public" -j ACCEPT
[19754:1954984] -A WEAVE-NPC-DEFAULT -m set --match-set weave-?b%zl9GIe0AET1(QI^7NWe*fO dst -m comment --comment "DefaultAllow isolation for namespace: kube-system" -j ACCEPT
[1466:87960] -A WEAVE-NPC-DEFAULT -m set --match-set weave-olT1Y7{WGrtZ{bB/c;F^E%a?0 dst -m comment --comment "DefaultAllow isolation for namespace: weave" -j ACCEPT
COMMIT
# Completed on Tue Mar 20 18:24:36 2018
```

**Comment by brb** [comment]
> ip route on master and worker respectively :

Thanks, but can you please attach to the pod and run `ip route` from there?

**Comment by dostoevskoy** [comment]
ip route from the pod:
```
# ip route
default via 10.46.0.0 dev eth0
10.32.0.0/12 dev eth0  proto kernel  scope link  src 10.46.0.86
```

**Comment by brb** [comment]
Seems to be alright. Can you reach example.com from the worker or the master node (not from the pod)? If yes, what happens when you `ping 8.8.8.8` from the pod?

**Comment by dostoevskoy** [comment]
@brb , yes, I can reach example.com and other else url from worker or master host.
But I can't reach anything from pod. 
- try to ping 8.8.8.8 from the pod:
```
ping -c 10 8.8.8.8
PING 8.8.8.8 (8.8.8.8) 56(84) bytes of data.

--- 8.8.8.8 ping statistics ---
10 packets transmitted, 0 received, 100% packet loss, time 9064ms
```
- try to reach master host ip:
```
ing 172.18.69.12
PING 172.18.69.12 (172.18.69.12) 56(84) bytes of data.
^C
--- 172.18.69.12 ping statistics ---
6 packets transmitted, 0 received, 100% packet loss, time 5040ms
``` 

I can reach only host ip (where pod is placed):
```
ping 172.18.70.94
PING 172.18.70.94 (172.18.70.94) 56(84) bytes of data.
64 bytes from 172.18.70.94: icmp_seq=1 ttl=64 time=0.107 ms
64 bytes from 172.18.70.94: icmp_seq=2 ttl=64 time=0.055 ms
^C
--- 172.18.70.94 ping statistics ---
2 packets transmitted, 2 received, 0% packet loss, time 999ms
rtt min/avg/max/mdev = 0.055/0.081/0.107/0.026 ms
```

**Comment by brb** [comment]
@dostoevskoy Is this comment https://github.com/weaveworks/weave/issues/3239#issuecomment-367728619 related to your current setup / observations?

**Comment by dostoevskoy** [comment]
@brb already not. I've upgraded OS and with a new kernel services and deployments are working fine. Kubedns also running, but just can't connect to upstream dns servers.

**Comment by brb** [comment]
OK. Could you run tcpdump on the worker node again, but this time `tcpdump -i weave -w weave.pcap` and `tcpdump -i eth0 -w eth0.pcap` at the same time and provide the PCAPs?

**Comment by dostoevskoy** [comment]
From console:
```
#killall tcpdump
667 packets captured
673 packets received by filter
0 packets dropped by kernel
2046 packets captured
2105 packets received by filter
0 packets dropped by kernel

[1]-  Done                    tcpdump -i weave -w weave.pcap
[2]+  Done                    tcpdump -i eth0 -w eth0.pcap
```
weave.pcap and eth0.pcap in the tcpdump.zip archive:
[tcpdump.zip](https://github.com/weaveworks/weave/files/1834063/tcpdump.zip)

**Comment by dostoevskoy** [comment]
@brb it seems I've resolved the issue. I went trough all configs and found, that ip_forwarding for interface eth0 has been set to 0. So, after applying  `net.ipv4.conf.eth0.forwarding = 1` the issue has been resolved. 
Now external services and all internet services are available from pods in a weave network.

**Comment by brb** [comment]
Thanks for the update @dostoevskoy
