### ISSUE TITLE
Bad lenght UDP when doing multicast between containers running on different node

### ISSUE THREAD

**Issue by erandu** [weaveworks/weave#2493]
I did some test with multicast and iperf, and I have found an issue  when execute multicast between containers running on different node.

I have two nodes, one container on the first node and  it's the sender of multicast. 
I run `iperf -c 224.0.55.55 -u -T 32 -t 3 -i 1 ` within the container.
An other container on this node and it receives packets.
I run ` iperf -s -u -B 224.0.55.55 -i 1` within this one.

On the second node, I have two containers which receive packet. 
On both I run ` iperf -s -u -B 224.0.55.55 -i 1`.

Then I run `tcpdump -i any host 224.0.55.55` on node 1 and node 2.

On node 1, everything seems to be ok : 
```
10:21:00.129731 IP 10.32.0.2.53661 > 224.0.55.55.commplex-link: UDP, length 1470
10:21:00.129742 IP 10.32.0.2.53661 > 224.0.55.55.commplex-link: UDP, length 1470
10:21:00.129762 IP 10.32.0.2.53661 > 224.0.55.55.commplex-link: UDP, length 1470
10:21:00.129766 IP 10.32.0.2.53661 > 224.0.55.55.commplex-link: UDP, length 1470
10:21:00.129784 IP 10.32.0.2.53661 > 224.0.55.55.commplex-link: UDP, length 1470
10:21:00.129792 IP 10.32.0.2.53661 > 224.0.55.55.commplex-link: UDP, length 1470
10:21:00.129824 IP 10.32.0.2.53661 > 224.0.55.55.commplex-link: UDP, length 1470
10:21:00.140847 IP 10.32.0.2.53661 > 224.0.55.55.commplex-link: UDP, length 1470
10:21:00.140863 IP 10.32.0.2.53661 > 224.0.55.55.commplex-link: UDP, length 1470
10:21:00.140868 IP 10.32.0.2.53661 > 224.0.55.55.commplex-link: UDP, length 1470
10:21:00.140871 IP 10.32.0.2.53661 > 224.0.55.55.commplex-link: UDP, length 1470
10:21:00.140889 IP 10.32.0.2.53661 > 224.0.55.55.commplex-link: UDP, length 1470
10:21:00.140897 IP 10.32.0.2.53661 > 224.0.55.55.commplex-link: UDP, length 1470
10:21:00.140930 IP 10.32.0.2.53661 > 224.0.55.55.commplex-link: UDP, length 1470
10:21:00.152032 IP 10.32.0.2.53661 > 224.0.55.55.commplex-link: UDP, length 1470
10:21:00.152051 IP 10.32.0.2.53661 > 224.0.55.55.commplex-link: UDP, length 1470
10:21:00.152055 IP 10.32.0.2.53661 > 224.0.55.55.commplex-link: UDP, length 1470
10:21:00.152058 IP 10.32.0.2.53661 > 224.0.55.55.commplex-link: UDP, length 1470
10:21:00.152078 IP 10.32.0.2.53661 > 224.0.55.55.commplex-link: UDP, length 1470
10:21:00.152087 IP 10.32.0.2.53661 > 224.0.55.55.commplex-link: UDP, length 1470
10:21:00.152121 IP 10.32.0.2.53661 > 224.0.55.55.commplex-link: UDP, length 1470
10:21:00.163228 IP 10.32.0.2.53661 > 224.0.55.55.commplex-link: UDP, length 1470
10:21:00.163262 IP 10.32.0.2.53661 > 224.0.55.55.commplex-link: UDP, length 1470
10:21:00.163267 IP 10.32.0.2.53661 > 224.0.55.55.commplex-link: UDP, length 1470
10:21:00.163270 IP 10.32.0.2.53661 > 224.0.55.55.commplex-link: UDP, length 1470
10:21:00.163289 IP 10.32.0.2.53661 > 224.0.55.55.commplex-link: UDP, length 1470
10:21:00.163296 IP 10.32.0.2.53661 > 224.0.55.55.commplex-link: UDP, length 1470
10:21:00.163322 IP 10.32.0.2.53661 > 224.0.55.55.commplex-link: UDP, length 1470
```

But on node 2
```
10:21:00.061442 IP 10.32.0.2 > 224.0.55.55: udp
10:21:00.061421 IP 10.32.0.2.53661 > 224.0.55.55.commplex-link: UDP, bad length 1470 > 1376
10:21:00.061441 IP 10.32.0.2.53661 > 224.0.55.55.commplex-link: UDP, bad length 1470 > 1376
10:21:00.061441 IP 10.32.0.2 > 224.0.55.55: udp
10:21:00.073454 IP 10.32.0.2.53661 > 224.0.55.55.commplex-link: UDP, bad length 1470 > 1376
10:21:00.073468 IP 10.32.0.2.53661 > 224.0.55.55.commplex-link: UDP, bad length 1470 > 1376
10:21:00.073470 IP 10.32.0.2 > 224.0.55.55: udp
10:21:00.073471 IP 10.32.0.2 > 224.0.55.55: udp
10:21:00.073454 IP 10.32.0.2.53661 > 224.0.55.55.commplex-link: UDP, bad length 1470 > 1376
10:21:00.073470 IP 10.32.0.2.53661 > 224.0.55.55.commplex-link: UDP, bad length 1470 > 1376
10:21:00.073470 IP 10.32.0.2 > 224.0.55.55: udp
10:21:00.084395 IP 10.32.0.2.53661 > 224.0.55.55.commplex-link: UDP, bad length 1470 > 1376
10:21:00.084408 IP 10.32.0.2.53661 > 224.0.55.55.commplex-link: UDP, bad length 1470 > 1376
10:21:00.084411 IP 10.32.0.2 > 224.0.55.55: udp
10:21:00.084411 IP 10.32.0.2 > 224.0.55.55: udp
10:21:00.084395 IP 10.32.0.2.53661 > 224.0.55.55.commplex-link: UDP, bad length 1470 > 1376
10:21:00.084410 IP 10.32.0.2.53661 > 224.0.55.55.commplex-link: UDP, bad length 1470 > 1376
10:21:00.084411 IP 10.32.0.2 > 224.0.55.55: udp
10:21:00.095553 IP 10.32.0.2.53661 > 224.0.55.55.commplex-link: UDP, bad length 1470 > 1376
10:21:00.095569 IP 10.32.0.2.53661 > 224.0.55.55.commplex-link: UDP, bad length 1470 > 1376
10:21:00.095571 IP 10.32.0.2 > 224.0.55.55: udp
10:21:00.095572 IP 10.32.0.2 > 224.0.55.55: udp
10:21:00.095553 IP 10.32.0.2.53661 > 224.0.55.55.commplex-link: UDP, bad length 1470 > 1376
10:21:00.095571 IP 10.32.0.2.53661 > 224.0.55.55.commplex-link: UDP, bad length 1470 > 1376
10:21:00.095571 IP 10.32.0.2 > 224.0.55.55: udp
10:21:00.106780 IP 10.32.0.2.53661 > 224.0.55.55.commplex-link: UDP, bad length 1470 > 1376
10:21:00.106792 IP 10.32.0.2.53661 > 224.0.55.55.commplex-link: UDP, bad length 1470 > 1376
10:21:00.106795 IP 10.32.0.2 > 224.0.55.55: udp
10:21:00.106795 IP 10.32.0.2 > 224.0.55.55: udp
10:21:00.106780 IP 10.32.0.2.53661 > 224.0.55.55.commplex-link: UDP, bad length 1470 > 1376
10:21:00.106794 IP 10.32.0.2.53661 > 224.0.55.55.commplex-link: UDP, bad length 1470 > 1376
10:21:00.106795 IP 10.32.0.2 > 224.0.55.55: udp
10:21:00.118100 IP 10.32.0.2.53661 > 224.0.55.55.commplex-link: UDP, bad length 1470 > 1376
10:21:00.118122 IP 10.32.0.2.53661 > 224.0.55.55.commplex-link: UDP, bad length 1470 > 1376
10:21:00.118125 IP 10.32.0.2 > 224.0.55.55: udp
10:21:00.118126 IP 10.32.0.2 > 224.0.55.55: udp
10:21:00.118100 IP 10.32.0.2.53661 > 224.0.55.55.commplex-link: UDP, bad length 1470 > 1376
10:21:00.118124 IP 10.32.0.2.53661 > 224.0.55.55.commplex-link: UDP, bad length 1470 > 1376
10:21:00.118125 IP 10.32.0.2 > 224.0.55.55: udp
10:21:00.129336 IP 10.32.0.2.53661 > 224.0.55.55.commplex-link: UDP, bad length 1470 > 1376
10:21:00.129350 IP 10.32.0.2.53661 > 224.0.55.55.commplex-link: UDP, bad length 1470 > 1376
10:21:00.129352 IP 10.32.0.2 > 224.0.55.55: udp
10:21:00.129353 IP 10.32.0.2 > 224.0.55.55: udp
10:21:00.129336 IP 10.32.0.2.53661 > 224.0.55.55.commplex-link: UDP, bad length 1470 > 1376
10:21:00.129351 IP 10.32.0.2.53661 > 224.0.55.55.commplex-link: UDP, bad length 1470 > 1376
10:21:00.129352 IP 10.32.0.2 > 224.0.55.55: udp
10:21:00.140913 IP 10.32.0.2.53661 > 224.0.55.55.commplex-link: UDP, bad length 1470 > 1376
10:21:00.140941 IP 10.32.0.2.53661 > 224.0.55.55.commplex-link: UDP, bad length 1470 > 1376
10:21:00.140943 IP 10.32.0.2 > 224.0.55.55: udp
10:21:00.140944 IP 10.32.0.2 > 224.0.55.55: udp
10:21:00.140913 IP 10.32.0.2.53661 > 224.0.55.55.commplex-link: UDP, bad length 1470 > 1376
10:21:00.140943 IP 10.32.0.2.53661 > 224.0.55.55.commplex-link: UDP, bad length 1470 > 1376
10:21:00.140943 IP 10.32.0.2 > 224.0.55.55: udp
10:21:00.151487 IP 10.32.0.2.53661 > 224.0.55.55.commplex-link: UDP, bad length 1470 > 1376
10:21:00.151509 IP 10.32.0.2.53661 > 224.0.55.55.commplex-link: UDP, bad length 1470 > 1376
10:21:00.151512 IP 10.32.0.2 > 224.0.55.55: udp
10:21:00.151513 IP 10.32.0.2 > 224.0.55.55: udp
10:21:00.151487 IP 10.32.0.2.53661 > 224.0.55.55.commplex-link: UDP, bad length 1470 > 1376
10:21:00.151511 IP 10.32.0.2.53661 > 224.0.55.55.commplex-link: UDP, bad length 1470 > 1376
10:21:00.151512 IP 10.32.0.2 > 224.0.55.55: udp
10:21:00.163804 IP 10.32.0.2.53661 > 224.0.55.55.commplex-link: UDP, bad length 1470 > 1376
10:21:00.163819 IP 10.32.0.2.53661 > 224.0.55.55.commplex-link: UDP, bad length 1470 > 1376
10:21:00.163842 IP 10.32.0.2 > 224.0.55.55: udp
10:21:00.163843 IP 10.32.0.2 > 224.0.55.55: udp
10:21:00.163804 IP 10.32.0.2.53661 > 224.0.55.55.commplex-link: UDP, bad length 1470 > 1376
10:21:00.163841 IP 10.32.0.2.53661 > 224.0.55.55.commplex-link: UDP, bad length 1470 > 1376
10:21:00.163842 IP 10.32.0.2 > 224.0.55.55: udp
```

Error message is `UDP, bad length 1470 > 1376`.
So it seems to have a limit with 1376 bytes.

Packets send with iperf are  datagrams of 1470 bytes, and MTU of interface inside container is 1410 (weave interface).

My nodes are running with coreOS and launch with Vagrant/virtualbox, and MTU of bridge interface is 1500.

**Comment by brb** [comment]
@erandu thanks for the report.

The tcpdump error message you get is due to IP fragmentation which happens because the multicast datagram length > MTU, as it can be seen https://github.com/the-tcpdump-group/tcpdump/blob/tcpdump-4.7.4/print-udp.c#L694

If your host is able to properly handle the fragmentation, then you should be able to see a successful arrival of the datagram on the node2 container. Otherwise, I'd recommend either increasing MTU (if possible) or changing the datagram size by using `-l` iperf flag.
