### ISSUE TITLE
Containers started directly started on k8s hosts cant reach outside docker0

### ISSUE THREAD

**Issue by neith00** [weaveworks/weave#3267]
## What you expected to happen?
Containers directly started on a k8s hosts should be able to communicate with the 'outside world'.
On the other side, containers started by k8s are working perfectly.

## What happened?
Currently containers started on k8s hosts are not able to reach internet.
Seems like network requests are going out but no responses are received.

## How to reproduce it?
Deployed k8s with kubespray using weave 2.0.5 in seed mode + encryption on CoreOS 1632.2.1 on top of OpenStack.
The k8s side is working as expected.
On the other site, directly from a k8s hosts, docker containers cannot communicate with Internet:
```
$ docker run --rm alpine:3.7 ping -c 6 8.8.8.8
PING 8.8.8.8 (8.8.8.8): 56 data bytes
--- 8.8.8.8 ping statistics ---
6 packets transmitted, 0 packets received, 100% packet loss
```

Pinging the gw of the docker0 bridge is ok thought:
```
$ docker run --rm alpine:3.7 ping -c 6 172.17.0.1
PING 172.17.0.1 (172.17.0.1): 56 data bytes
64 bytes from 172.17.0.1: seq=0 ttl=64 time=0.176 ms
64 bytes from 172.17.0.1: seq=1 ttl=64 time=0.112 ms
64 bytes from 172.17.0.1: seq=2 ttl=64 time=0.089 ms
64 bytes from 172.17.0.1: seq=3 ttl=64 time=0.153 ms
64 bytes from 172.17.0.1: seq=4 ttl=64 time=0.131 ms
64 bytes from 172.17.0.1: seq=5 ttl=64 time=0.138 ms

--- 172.17.0.1 ping statistics ---
6 packets transmitted, 6 packets received, 0% packet loss
round-trip min/avg/max = 0.089/0.133/0.176 ms
```
Pinging 8.8.8.8 from a container directly started from the k8s host
```
$ docker run --rm alpine:3.7 ping -c 6 8.8.8.8
PING 8.8.8.8 (8.8.8.8): 56 data bytes

--- 8.8.8.8 ping statistics ---
6 packets transmitted, 0 packets received, 100% packet loss
```
Tcpdump during the poing to 8.8.8.8
```
# tcpdump -n -i docker0 icmp
dropped privs to tcpdump
tcpdump: verbose output suppressed, use -v or -vv for full protocol decode
listening on docker0, link-type EN10MB (Ethernet), capture size 262144 bytes
08:48:00.813713 IP 172.17.0.3 > 8.8.8.8: ICMP echo request, id 256, seq 0, length 64
08:48:01.813968 IP 172.17.0.3 > 8.8.8.8: ICMP echo request, id 256, seq 1, length 64
08:48:02.814164 IP 172.17.0.3 > 8.8.8.8: ICMP echo request, id 256, seq 2, length 64
08:48:03.814409 IP 172.17.0.3 > 8.8.8.8: ICMP echo request, id 256, seq 3, length 64
08:48:04.814694 IP 172.17.0.3 > 8.8.8.8: ICMP echo request, id 256, seq 4, length 64
08:48:05.814914 IP 172.17.0.3 > 8.8.8.8: ICMP echo request, id 256, seq 5, length 64
^C
6 packets captured
6 packets received by filter
0 packets dropped by kernel
```
```
# tcpdump -n -i eth0 icmp
dropped privs to tcpdump
tcpdump: verbose output suppressed, use -v or -vv for full protocol decode
listening on eth0, link-type EN10MB (Ethernet), capture size 262144 bytes
08:48:00.813755 IP 172.17.0.3 > 8.8.8.8: ICMP echo request, id 256, seq 0, length 64
08:48:01.814015 IP 172.17.0.3 > 8.8.8.8: ICMP echo request, id 256, seq 1, length 64
08:48:02.814205 IP 172.17.0.3 > 8.8.8.8: ICMP echo request, id 256, seq 2, length 64
08:48:03.814522 IP 172.17.0.3 > 8.8.8.8: ICMP echo request, id 256, seq 3, length 64
08:48:04.814733 IP 172.17.0.3 > 8.8.8.8: ICMP echo request, id 256, seq 4, length 64
08:48:05.814978 IP 172.17.0.3 > 8.8.8.8: ICMP echo request, id 256, seq 5, length 64
^C
6 packets captured
24 packets received by filter
3 packets dropped by kernel
```

Weave Daemonset
```
Name:           weave-net
Selector:       name=weave-net
Node-Selector:  <none>
Labels:         name=weave-net
                version=2.0.5
Desired Number of Nodes Scheduled: 3
Current Number of Nodes Scheduled: 3
Number of Nodes Scheduled with Up-to-date Pods: 3
Number of Nodes Scheduled with Available Pods: 3
Number of Nodes Misscheduled: 0
Pods Status:  3 Running / 0 Waiting / 0 Succeeded / 0 Failed
Pod Template:
  Labels:           name=weave-net
  Service Account:  weave-net
  Containers:
   weave:
    Image:  weaveworks/weave-kube:2.0.5
    Port:   <none>
    Command:
      /bin/sh
      -c
      export EXTRA_ARGS=--name=$(cat /sys/class/net/eth0/address) && /home/weave/launch.sh
    Requests:
      cpu:     10m
    Liveness:  http-get http://127.0.0.1:6784/status delay=30s timeout=1s period=10s #success=1 #failure=3
    Environment:
      HOSTNAME:         (v1:spec.nodeName)
      IPALLOC_RANGE:   10.233.64.0/18
      KUBE_PEERS:      192.168.208.56 192.168.208.12 192.168.208.50
      IPALLOC_INIT:    seed=fa:16:3e:c0:01:e1,fa:16:3e:65:70:43,fa:16:3e:ea:8a:ae
      WEAVE_PASSWORD:  XXXXXXX 
    Mounts:
      /host/etc from cni-conf (rw)
      /host/home from cni-bin2 (rw)
      /host/opt from cni-bin (rw)
      /host/var/lib/dbus from dbus (rw)
      /lib/modules from lib-modules (rw)
      /run/xtables.lock from xtables-lock (rw)
      /weavedb from weavedb (rw)
   weave-npc:
    Image:  weaveworks/weave-npc:2.0.5
    Port:   <none>
    Limits:
      cpu:     30m
      memory:  400M
    Requests:
      cpu:        10m
      memory:     64M
    Environment:  <none>
    Mounts:       <none>
  Volumes:
   weavedb:
    Type:          HostPath (bare host directory volume)
    Path:          /var/lib/weave
    HostPathType:  
   cni-bin:
    Type:          HostPath (bare host directory volume)
    Path:          /opt
    HostPathType:  
   cni-bin2:
    Type:          HostPath (bare host directory volume)
    Path:          /home
    HostPathType:  
   cni-conf:
    Type:          HostPath (bare host directory volume)
    Path:          /etc
    HostPathType:  
   dbus:
    Type:          HostPath (bare host directory volume)
    Path:          /var/lib/dbus
    HostPathType:  
   lib-modules:
    Type:          HostPath (bare host directory volume)
    Path:          /lib/modules
    HostPathType:  
   xtables-lock:
    Type:          HostPath (bare host directory volume)
    Path:          /run/xtables.lock
    HostPathType:
```

## Versions:

```
$ weave version 2.0.5
$ docker version 
Client:
 Version:      17.09.1-ce
 API version:  1.32
 Go version:   go1.8.5
 Git commit:   19e2cf6
 Built:        Thu Dec  7 22:19:00 2017
 OS/Arch:      linux/amd64

Server:
 Version:      17.09.1-ce
 API version:  1.32 (minimum version 1.12)
 Go version:   go1.8.5
 Git commit:   19e2cf6
 Built:        Thu Dec  7 22:19:00 2017
 OS/Arch:      linux/amd64
 Experimental: false

$ uname -a
Linux node1-smite 4.14.16-coreos #1 SMP Thu Feb 1 20:38:35 UTC 2018 x86_64 Intel Core Processor (Broadwell) GenuineIntel GNU/Linux

$ kubectl version
Client Version: version.Info{Major:"", Minor:"", GitVersion:"v1.9.0+coreos.0", GitCommit:"1b69a2a6c01194421b0aa17747a8c1a81738a8dd", GitTreeState:"clean", BuildDate:"2017-12-19T02:52:15Z", GoVersion:"go1.9.2", Compiler:"gc", Platform:"linux/amd64"}
Server Version: version.Info{Major:"", Minor:"", GitVersion:"v1.9.0+coreos.0", GitCommit:"1b69a2a6c01194421b0aa17747a8c1a81738a8dd", GitTreeState:"clean", BuildDate:"2017-12-19T02:52:15Z", GoVersion:"go1.9.2", Compiler:"gc", Platform:"linux/amd64"}
```
```
$ ip route
default via 192.168.211.254 dev eth0 proto dhcp src 192.168.208.56 metric 1024
default via 192.168.211.254 dev eth0 proto dhcp metric 1024
10.233.64.0/18 dev weave proto kernel scope link src 10.233.112.0
169.254.169.254 via 192.168.208.3 dev eth0 proto dhcp metric 1024
169.254.169.254 via 192.168.208.2 dev eth0 proto dhcp metric 1024
172.17.0.0/16 dev docker0 proto kernel scope link src 172.17.0.1
192.168.208.0/22 dev eth0 proto kernel scope link src 192.168.208.56
192.168.211.254 dev eth0 proto dhcp scope link src 192.168.208.56 metric 1024
```
```
$ ip -4 -o addr
1: lo    inet 127.0.0.1/8 scope host lo\       valid_lft forever preferred_lft forever
2: eth0    inet 192.168.208.56/22 brd 192.168.211.255 scope global dynamic eth0\       valid_lft 52278sec preferred_lft 52278sec
3: docker0    inet 172.17.0.1/16 scope global docker0\       valid_lft forever preferred_lft forever
6: weave    inet 10.233.112.0/18 scope global weave\       valid_lft forever preferred_lft forever
```
```
$ sudo iptables-save
# Generated by iptables-save v1.4.21 on Thu Mar 29 09:17:17 2018
*mangle
:PREROUTING ACCEPT [123382067:30651076811]
:INPUT ACCEPT [123114034:30621188868]
:FORWARD ACCEPT [272195:30735791]
:OUTPUT ACCEPT [121288081:29855027255]
:POSTROUTING ACCEPT [121560276:29885763046]
:WEAVE-IPSEC-IN - [0:0]
:WEAVE-IPSEC-IN-MARK - [0:0]
:WEAVE-IPSEC-OUT - [0:0]
:WEAVE-IPSEC-OUT-MARK - [0:0]
-A INPUT -j WEAVE-IPSEC-IN
-A OUTPUT -j WEAVE-IPSEC-OUT
-A WEAVE-IPSEC-IN -s 192.168.208.50/32 -d 192.168.208.56/32 -p esp -m esp --espspi 1189216735 -j WEAVE-IPSEC-IN-MARK
-A WEAVE-IPSEC-IN -s 192.168.208.12/32 -d 192.168.208.56/32 -p esp -m esp --espspi 1198326225 -j WEAVE-IPSEC-IN-MARK
-A WEAVE-IPSEC-IN-MARK -j MARK --set-xmark 0x20000/0x20000
-A WEAVE-IPSEC-OUT -s 192.168.208.56/32 -d 192.168.208.50/32 -p udp -m udp --dport 6784 -j WEAVE-IPSEC-OUT-MARK
-A WEAVE-IPSEC-OUT -s 192.168.208.56/32 -d 192.168.208.12/32 -p udp -m udp --dport 6784 -j WEAVE-IPSEC-OUT-MARK
-A WEAVE-IPSEC-OUT-MARK -j MARK --set-xmark 0x20000/0x20000
COMMIT
# Completed on Thu Mar 29 09:17:17 2018
# Generated by iptables-save v1.4.21 on Thu Mar 29 09:17:17 2018
*nat
:PREROUTING ACCEPT [3:180]
:INPUT ACCEPT [3:180]
:OUTPUT ACCEPT [62:4040]
:POSTROUTING ACCEPT [62:4040]
:KUBE-MARK-DROP - [0:0]
:KUBE-MARK-MASQ - [0:0]
:KUBE-NODEPORTS - [0:0]
:KUBE-POSTROUTING - [0:0]
:KUBE-SEP-2VJC5F6PRK3FGPVG - [0:0]
:KUBE-SEP-4EHKXLE5VHDG42J5 - [0:0]
:KUBE-SEP-4JKNAA2B4UPXDW5G - [0:0]
:KUBE-SEP-73LP22JIDB7YY2WJ - [0:0]
:KUBE-SEP-7MHPPFA55LZRYQOW - [0:0]
:KUBE-SEP-ASXYRB67UC44QYEA - [0:0]
:KUBE-SEP-BQC3IR7N2BBET7T5 - [0:0]
:KUBE-SEP-CV6GQPBOPUIIFZ2I - [0:0]
:KUBE-SEP-CZXMNVU3IVX4KEEQ - [0:0]
:KUBE-SEP-DIG4MWJEZZWPTOJH - [0:0]
:KUBE-SEP-DPH2B5MHGQLUAOOD - [0:0]
:KUBE-SEP-FC5ZU77S3BUATEMM - [0:0]
:KUBE-SEP-FGGHAQ5WM5YEAYAJ - [0:0]
:KUBE-SEP-FPT75KHDYZUSQJP7 - [0:0]
:KUBE-SEP-GF25XEG6YTXELQT7 - [0:0]
:KUBE-SEP-GWY4IUD5SUBB2T4Z - [0:0]
:KUBE-SEP-GZHGDJUOJR25QI6N - [0:0]
:KUBE-SEP-HHWRRZBYQLZQJ225 - [0:0]
:KUBE-SEP-HWWDE2JGX5GVQO5J - [0:0]
:KUBE-SEP-IO6RBDYHQLN6DY4B - [0:0]
:KUBE-SEP-JGVHYOVPW5OESA7Z - [0:0]
:KUBE-SEP-JZ5MWR6UBCXYKHIX - [0:0]
:KUBE-SEP-KNJL7QRTFJBTG63C - [0:0]
:KUBE-SEP-N2FW6LR47HXKQDAU - [0:0]
:KUBE-SEP-NBOBBWQMYIZUB7ID - [0:0]
:KUBE-SEP-NWQ3MFDD3KUIBNNS - [0:0]
:KUBE-SEP-POOJN6MRS5DRA4XA - [0:0]
:KUBE-SEP-PUAJTDNYVY3V6MKH - [0:0]
:KUBE-SEP-QD27AIGGVHAVDZLA - [0:0]
:KUBE-SEP-SI6EG4KG5E6UUKMY - [0:0]
:KUBE-SEP-T6XDO7QEGVQO6LTB - [0:0]
:KUBE-SEP-TM7T7G4JD5ZXZN6W - [0:0]
:KUBE-SEP-TUACV3TDKJ2EI53D - [0:0]
:KUBE-SEP-UZULZIKFKX4ITZWG - [0:0]
:KUBE-SEP-XJRB2QTYRVEGTE22 - [0:0]
:KUBE-SEP-XOSVT7Z52XY2S36L - [0:0]
:KUBE-SEP-Y6VVM2YQXL2IHRSW - [0:0]
:KUBE-SEP-YNL524HU7SZJPHMQ - [0:0]
:KUBE-SERVICES - [0:0]
:KUBE-SVC-3EMW2GIOYJV6DV6P - [0:0]
:KUBE-SVC-4UIPAYQ4VFPGRMA3 - [0:0]
:KUBE-SVC-746F6ZRPYFRHSEHO - [0:0]
:KUBE-SVC-7BB4GED2QYDGC4GN - [0:0]
:KUBE-SVC-7JSRZHB3YWVS5NMG - [0:0]
:KUBE-SVC-7N7DOC47XX3SKBHU - [0:0]
:KUBE-SVC-CIGGPN5BGHD4S2O2 - [0:0]
:KUBE-SVC-CK3M5ECVAI6WWQM4 - [0:0]
:KUBE-SVC-CNCAHLOUVJ7PHAAI - [0:0]
:KUBE-SVC-CRWJJGCDBVMFIXVA - [0:0]
:KUBE-SVC-CSOELOHXXKRL37C3 - [0:0]
:KUBE-SVC-DYC3X2U4QOQRWYJ4 - [0:0]
:KUBE-SVC-EM6TYMHOE4ZSTRV3 - [0:0]
:KUBE-SVC-ERIFXISQEP7F7OF4 - [0:0]
:KUBE-SVC-F6MIP5BL4KIGTPW2 - [0:0]
:KUBE-SVC-FVN42T4763IQ2F77 - [0:0]
:KUBE-SVC-GHDWXBAB74NXTXFO - [0:0]
:KUBE-SVC-HCVC6TOABECLZ4W4 - [0:0]
:KUBE-SVC-IH2USE34JSVI4TF3 - [0:0]
:KUBE-SVC-IUGSYNO5UD5ENGHX - [0:0]
:KUBE-SVC-K6LFF7JLEKVUKBYO - [0:0]
:KUBE-SVC-LHC3WH7V526TOUDB - [0:0]
:KUBE-SVC-LZLNVMEVUXIQDPPT - [0:0]
:KUBE-SVC-NPX46M4PTMTKRN6Y - [0:0]
:KUBE-SVC-OKCWGTBEFYFSVC5R - [0:0]
:KUBE-SVC-PABR3NFC7GS2AXMO - [0:0]
:KUBE-SVC-PN5SYWD667INKCVX - [0:0]
:KUBE-SVC-PRL7IOKJSO52NZNU - [0:0]
:KUBE-SVC-PW42KJPIFV7MGDAT - [0:0]
:KUBE-SVC-QA35EJAD4VDJQPKE - [0:0]
:KUBE-SVC-RAMZCJSBPNWIXYA2 - [0:0]
:KUBE-SVC-TCOU7JCQXEZGVUNU - [0:0]
:KUBE-SVC-TIPNCGI435UE6SEJ - [0:0]
:KUBE-SVC-TL7S3KJ2EHWMKBKG - [0:0]
:KUBE-SVC-UC7ZWITLXDTOOKDD - [0:0]
:KUBE-SVC-UPZVC57LUOMTRMRK - [0:0]
:KUBE-SVC-VBJ4QIZYN3RXOSHM - [0:0]
:KUBE-SVC-XD2YAFJEQKLZXVUY - [0:0]
:KUBE-SVC-XGLOHA7QRQ3V22RZ - [0:0]
:WEAVE - [0:0]
-A PREROUTING -m comment --comment "kubernetes service portals" -j KUBE-SERVICES
-A OUTPUT -m comment --comment "kubernetes service portals" -j KUBE-SERVICES
-A POSTROUTING -m comment --comment "kubernetes postrouting rules" -j KUBE-POSTROUTING
-A POSTROUTING -j WEAVE
-A KUBE-MARK-DROP -j MARK --set-xmark 0x8000/0x8000
-A KUBE-MARK-MASQ -j MARK --set-xmark 0x4000/0x4000
-A KUBE-NODEPORTS -p tcp -m comment --comment "kube-system/traefik-ingress-service:web" -m tcp --dport 30886 -j KUBE-MARK-MASQ
-A KUBE-NODEPORTS -p tcp -m comment --comment "kube-system/traefik-ingress-service:web" -m tcp --dport 30886 -j KUBE-SVC-7JSRZHB3YWVS5NMG
-A KUBE-NODEPORTS -p tcp -m comment --comment "smite/gitlab:http" -m tcp --dport 31164 -j KUBE-MARK-MASQ
-A KUBE-NODEPORTS -p tcp -m comment --comment "smite/gitlab:http" -m tcp --dport 31164 -j KUBE-SVC-PABR3NFC7GS2AXMO
-A KUBE-NODEPORTS -p tcp -m comment --comment "default/tuleap:http" -m tcp --dport 31703 -j KUBE-MARK-MASQ
-A KUBE-NODEPORTS -p tcp -m comment --comment "default/tuleap:http" -m tcp --dport 31703 -j KUBE-SVC-HCVC6TOABECLZ4W4
-A KUBE-NODEPORTS -p tcp -m comment --comment "default/tuleapaio:http" -m tcp --dport 31581 -j KUBE-MARK-MASQ
-A KUBE-NODEPORTS -p tcp -m comment --comment "default/tuleapaio:http" -m tcp --dport 31581 -j KUBE-SVC-PRL7IOKJSO52NZNU
-A KUBE-NODEPORTS -p tcp -m comment --comment "smite/gitlab:ssh" -m tcp --dport 31847 -j KUBE-MARK-MASQ
-A KUBE-NODEPORTS -p tcp -m comment --comment "smite/gitlab:ssh" -m tcp --dport 31847 -j KUBE-SVC-LZLNVMEVUXIQDPPT
-A KUBE-NODEPORTS -p tcp -m comment --comment "smite/gitlab-ssh:" -m tcp --dport 31846 -j KUBE-MARK-MASQ
-A KUBE-NODEPORTS -p tcp -m comment --comment "smite/gitlab-ssh:" -m tcp --dport 31846 -j KUBE-SVC-QA35EJAD4VDJQPKE
-A KUBE-NODEPORTS -p tcp -m comment --comment "kube-system/traefik-ingress-service:https" -m tcp --dport 30647 -j KUBE-MARK-MASQ
-A KUBE-NODEPORTS -p tcp -m comment --comment "kube-system/traefik-ingress-service:https" -m tcp --dport 30647 -j KUBE-SVC-CNCAHLOUVJ7PHAAI
-A KUBE-NODEPORTS -p tcp -m comment --comment "kube-system/traefik-ingress-service:admin" -m tcp --dport 31148 -j KUBE-MARK-MASQ
-A KUBE-NODEPORTS -p tcp -m comment --comment "kube-system/traefik-ingress-service:admin" -m tcp --dport 31148 -j KUBE-SVC-CK3M5ECVAI6WWQM4
-A KUBE-POSTROUTING -m comment --comment "kubernetes service traffic requiring SNAT" -m mark --mark 0x4000/0x4000 -j MASQUERADE
-A KUBE-SEP-2VJC5F6PRK3FGPVG -s 10.233.88.11/32 -m comment --comment "kube-system/kube-dns:dns-tcp" -j KUBE-MARK-MASQ
-A KUBE-SEP-2VJC5F6PRK3FGPVG -p tcp -m comment --comment "kube-system/kube-dns:dns-tcp" -m tcp -j DNAT --to-destination 10.233.88.11:53
-A KUBE-SEP-4EHKXLE5VHDG42J5 -s 10.233.88.37/32 -m comment --comment "harbor/adminserver:" -j KUBE-MARK-MASQ
-A KUBE-SEP-4EHKXLE5VHDG42J5 -p tcp -m comment --comment "harbor/adminserver:" -m tcp -j DNAT --to-destination 10.233.88.37:80
-A KUBE-SEP-4JKNAA2B4UPXDW5G -s 192.168.208.56/32 -m comment --comment "kube-system/traefik-ingress-service:https" -j KUBE-MARK-MASQ
-A KUBE-SEP-4JKNAA2B4UPXDW5G -p tcp -m comment --comment "kube-system/traefik-ingress-service:https" -m tcp -j DNAT --to-destination 192.168.208.56:443
-A KUBE-SEP-73LP22JIDB7YY2WJ -s 192.168.208.50/32 -m comment --comment "default/kubernetes:https" -j KUBE-MARK-MASQ
-A KUBE-SEP-73LP22JIDB7YY2WJ -p tcp -m comment --comment "default/kubernetes:https" -m recent --set --name KUBE-SEP-73LP22JIDB7YY2WJ --mask 255.255.255.255 --rsource -m tcp -j DNAT --to-destination 192.168.208.50:6443
-A KUBE-SEP-7MHPPFA55LZRYQOW -s 10.233.88.54/32 -m comment --comment "smite/jenkins:http" -j KUBE-MARK-MASQ
-A KUBE-SEP-7MHPPFA55LZRYQOW -p tcp -m comment --comment "smite/jenkins:http" -m tcp -j DNAT --to-destination 10.233.88.54:8080
-A KUBE-SEP-ASXYRB67UC44QYEA -s 10.233.64.84/32 -m comment --comment "smite-dev/icons:" -j KUBE-MARK-MASQ
-A KUBE-SEP-ASXYRB67UC44QYEA -p tcp -m comment --comment "smite-dev/icons:" -m tcp -j DNAT --to-destination 10.233.64.84:80
-A KUBE-SEP-BQC3IR7N2BBET7T5 -s 10.233.88.38/32 -m comment --comment "smite-system/nfs-server:rpcbind-udp" -j KUBE-MARK-MASQ
-A KUBE-SEP-BQC3IR7N2BBET7T5 -p udp -m comment --comment "smite-system/nfs-server:rpcbind-udp" -m udp -j DNAT --to-destination 10.233.88.38:111
-A KUBE-SEP-CV6GQPBOPUIIFZ2I -s 10.233.88.11/32 -m comment --comment "kube-system/kube-dns:dns" -j KUBE-MARK-MASQ
-A KUBE-SEP-CV6GQPBOPUIIFZ2I -p udp -m comment --comment "kube-system/kube-dns:dns" -m udp -j DNAT --to-destination 10.233.88.11:53
-A KUBE-SEP-CZXMNVU3IVX4KEEQ -s 10.233.88.38/32 -m comment --comment "smite-system/nfs-server:nfs" -j KUBE-MARK-MASQ
-A KUBE-SEP-CZXMNVU3IVX4KEEQ -p tcp -m comment --comment "smite-system/nfs-server:nfs" -m tcp -j DNAT --to-destination 10.233.88.38:2049
-A KUBE-SEP-DIG4MWJEZZWPTOJH -s 192.168.208.56/32 -m comment --comment "kube-system/traefik-ingress-service:web" -j KUBE-MARK-MASQ
-A KUBE-SEP-DIG4MWJEZZWPTOJH -p tcp -m comment --comment "kube-system/traefik-ingress-service:web" -m tcp -j DNAT --to-destination 192.168.208.56:80
-A KUBE-SEP-DPH2B5MHGQLUAOOD -s 10.233.64.81/32 -m comment --comment "smite-dev/smite-catalogmanager-kub:http" -j KUBE-MARK-MASQ
-A KUBE-SEP-DPH2B5MHGQLUAOOD -p tcp -m comment --comment "smite-dev/smite-catalogmanager-kub:http" -m tcp -j DNAT --to-destination 10.233.64.81:8080
-A KUBE-SEP-FC5ZU77S3BUATEMM -s 10.233.88.50/32 -m comment --comment "kube-system/kibana-logging:" -j KUBE-MARK-MASQ
-A KUBE-SEP-FC5ZU77S3BUATEMM -p tcp -m comment --comment "kube-system/kibana-logging:" -m tcp -j DNAT --to-destination 10.233.88.50:5601
-A KUBE-SEP-FGGHAQ5WM5YEAYAJ -s 10.233.88.33/32 -m comment --comment "harbor/jobservice:" -j KUBE-MARK-MASQ
-A KUBE-SEP-FGGHAQ5WM5YEAYAJ -p tcp -m comment --comment "harbor/jobservice:" -m tcp -j DNAT --to-destination 10.233.88.33:80
-A KUBE-SEP-FPT75KHDYZUSQJP7 -s 10.233.88.24/32 -m comment --comment "harbor/mysql:" -j KUBE-MARK-MASQ
-A KUBE-SEP-FPT75KHDYZUSQJP7 -p tcp -m comment --comment "harbor/mysql:" -m tcp -j DNAT --to-destination 10.233.88.24:3306
-A KUBE-SEP-GF25XEG6YTXELQT7 -s 10.233.88.38/32 -m comment --comment "smite-system/nfs-server:rpcbind" -j KUBE-MARK-MASQ
-A KUBE-SEP-GF25XEG6YTXELQT7 -p tcp -m comment --comment "smite-system/nfs-server:rpcbind" -m tcp -j DNAT --to-destination 10.233.88.38:111
-A KUBE-SEP-GWY4IUD5SUBB2T4Z -s 10.233.88.31/32 -m comment --comment "harbor/registry:debug" -j KUBE-MARK-MASQ
-A KUBE-SEP-GWY4IUD5SUBB2T4Z -p tcp -m comment --comment "harbor/registry:debug" -m tcp -j DNAT --to-destination 10.233.88.31:5001
-A KUBE-SEP-GZHGDJUOJR25QI6N -s 10.233.112.70/32 -m comment --comment "kube-system/kube-dns:dns" -j KUBE-MARK-MASQ
-A KUBE-SEP-GZHGDJUOJR25QI6N -p udp -m comment --comment "kube-system/kube-dns:dns" -m udp -j DNAT --to-destination 10.233.112.70:53
-A KUBE-SEP-HHWRRZBYQLZQJ225 -s 10.233.88.53/32 -m comment --comment "smite-system/postgres:postgres-port" -j KUBE-MARK-MASQ
-A KUBE-SEP-HHWRRZBYQLZQJ225 -p tcp -m comment --comment "smite-system/postgres:postgres-port" -m tcp -j DNAT --to-destination 10.233.88.53:5432
-A KUBE-SEP-HWWDE2JGX5GVQO5J -s 10.233.88.31/32 -m comment --comment "harbor/registry:repo" -j KUBE-MARK-MASQ
-A KUBE-SEP-HWWDE2JGX5GVQO5J -p tcp -m comment --comment "harbor/registry:repo" -m tcp -j DNAT --to-destination 10.233.88.31:5000
-A KUBE-SEP-IO6RBDYHQLN6DY4B -s 10.233.88.20/32 -m comment --comment "default/cryptpad:web-main" -j KUBE-MARK-MASQ
-A KUBE-SEP-IO6RBDYHQLN6DY4B -p tcp -m comment --comment "default/cryptpad:web-main" -m tcp -j DNAT --to-destination 10.233.88.20:3000
-A KUBE-SEP-JGVHYOVPW5OESA7Z -s 10.233.112.70/32 -m comment --comment "kube-system/kube-dns:dns-tcp" -j KUBE-MARK-MASQ
-A KUBE-SEP-JGVHYOVPW5OESA7Z -p tcp -m comment --comment "kube-system/kube-dns:dns-tcp" -m tcp -j DNAT --to-destination 10.233.112.70:53
-A KUBE-SEP-JZ5MWR6UBCXYKHIX -s 10.233.88.52/32 -m comment --comment "kube-system/kubernetes-dashboard:" -j KUBE-MARK-MASQ
-A KUBE-SEP-JZ5MWR6UBCXYKHIX -p tcp -m comment --comment "kube-system/kubernetes-dashboard:" -m tcp -j DNAT --to-destination 10.233.88.52:8443
-A KUBE-SEP-KNJL7QRTFJBTG63C -s 10.233.88.54/32 -m comment --comment "smite/jenkins-discovery:slaves" -j KUBE-MARK-MASQ
-A KUBE-SEP-KNJL7QRTFJBTG63C -p tcp -m comment --comment "smite/jenkins-discovery:slaves" -m tcp -j DNAT --to-destination 10.233.88.54:50000
-A KUBE-SEP-N2FW6LR47HXKQDAU -s 192.168.208.12/32 -m comment --comment "default/kubernetes:https" -j KUBE-MARK-MASQ
-A KUBE-SEP-N2FW6LR47HXKQDAU -p tcp -m comment --comment "default/kubernetes:https" -m recent --set --name KUBE-SEP-N2FW6LR47HXKQDAU --mask 255.255.255.255 --rsource -m tcp -j DNAT --to-destination 192.168.208.12:6443
-A KUBE-SEP-NBOBBWQMYIZUB7ID -s 10.233.112.76/32 -m comment --comment "harbor/ui:" -j KUBE-MARK-MASQ
-A KUBE-SEP-NBOBBWQMYIZUB7ID -p tcp -m comment --comment "harbor/ui:" -m tcp -j DNAT --to-destination 10.233.112.76:80
-A KUBE-SEP-NWQ3MFDD3KUIBNNS -s 10.233.88.32/32 -m comment --comment "smite-system/keycloak:keycloak-port" -j KUBE-MARK-MASQ
-A KUBE-SEP-NWQ3MFDD3KUIBNNS -p tcp -m comment --comment "smite-system/keycloak:keycloak-port" -m tcp -j DNAT --to-destination 10.233.88.32:8080
-A KUBE-SEP-POOJN6MRS5DRA4XA -s 10.233.64.58/32 -m comment --comment "smite/gitlab:ssh" -j KUBE-MARK-MASQ
-A KUBE-SEP-POOJN6MRS5DRA4XA -p tcp -m comment --comment "smite/gitlab:ssh" -m tcp -j DNAT --to-destination 10.233.64.58:22
-A KUBE-SEP-PUAJTDNYVY3V6MKH -s 10.233.88.45/32 -m comment --comment "kube-system/dnsmasq:dns-tcp" -j KUBE-MARK-MASQ
-A KUBE-SEP-PUAJTDNYVY3V6MKH -p tcp -m comment --comment "kube-system/dnsmasq:dns-tcp" -m tcp -j DNAT --to-destination 10.233.88.45:53
-A KUBE-SEP-QD27AIGGVHAVDZLA -s 10.233.88.45/32 -m comment --comment "kube-system/dnsmasq:dns" -j KUBE-MARK-MASQ
-A KUBE-SEP-QD27AIGGVHAVDZLA -p udp -m comment --comment "kube-system/dnsmasq:dns" -m udp -j DNAT --to-destination 10.233.88.45:53
-A KUBE-SEP-SI6EG4KG5E6UUKMY -s 10.233.88.38/32 -m comment --comment "smite-system/nfs-server:mountd" -j KUBE-MARK-MASQ
-A KUBE-SEP-SI6EG4KG5E6UUKMY -p udp -m comment --comment "smite-system/nfs-server:mountd" -m udp -j DNAT --to-destination 10.233.88.38:20048
-A KUBE-SEP-T6XDO7QEGVQO6LTB -s 10.233.64.58/32 -m comment --comment "smite/gitlab:http" -j KUBE-MARK-MASQ
-A KUBE-SEP-T6XDO7QEGVQO6LTB -p tcp -m comment --comment "smite/gitlab:http" -m tcp -j DNAT --to-destination 10.233.64.58:80
-A KUBE-SEP-TM7T7G4JD5ZXZN6W -s 10.233.112.81/32 -m comment --comment "default/mysql:mysql" -j KUBE-MARK-MASQ
-A KUBE-SEP-TM7T7G4JD5ZXZN6W -p tcp -m comment --comment "default/mysql:mysql" -m tcp -j DNAT --to-destination 10.233.112.81:3306
-A KUBE-SEP-TUACV3TDKJ2EI53D -s 10.233.112.40/32 -m comment --comment "smite/nexus:http" -j KUBE-MARK-MASQ
-A KUBE-SEP-TUACV3TDKJ2EI53D -p tcp -m comment --comment "smite/nexus:http" -m tcp -j DNAT --to-destination 10.233.112.40:8081
-A KUBE-SEP-UZULZIKFKX4ITZWG -s 10.233.64.58/32 -m comment --comment "smite/gitlab-ssh:" -j KUBE-MARK-MASQ
-A KUBE-SEP-UZULZIKFKX4ITZWG -p tcp -m comment --comment "smite/gitlab-ssh:" -m tcp -j DNAT --to-destination 10.233.64.58:22
-A KUBE-SEP-XJRB2QTYRVEGTE22 -s 10.233.64.76/32 -m comment --comment "smite-dev/smite-dashboard:" -j KUBE-MARK-MASQ
-A KUBE-SEP-XJRB2QTYRVEGTE22 -p tcp -m comment --comment "smite-dev/smite-dashboard:" -m tcp -j DNAT --to-destination 10.233.64.76:8080
-A KUBE-SEP-XOSVT7Z52XY2S36L -s 192.168.208.56/32 -m comment --comment "kube-system/traefik-ingress-service:admin" -j KUBE-MARK-MASQ
-A KUBE-SEP-XOSVT7Z52XY2S36L -p tcp -m comment --comment "kube-system/traefik-ingress-service:admin" -m tcp -j DNAT --to-destination 192.168.208.56:8080
-A KUBE-SEP-Y6VVM2YQXL2IHRSW -s 10.233.64.66/32 -m comment --comment "smite-dev/smite-platform-manager:http" -j KUBE-MARK-MASQ
-A KUBE-SEP-Y6VVM2YQXL2IHRSW -p tcp -m comment --comment "smite-dev/smite-platform-manager:http" -m tcp -j DNAT --to-destination 10.233.64.66:8080
-A KUBE-SEP-YNL524HU7SZJPHMQ -s 192.168.208.56/32 -m comment --comment "default/kubernetes:https" -j KUBE-MARK-MASQ
-A KUBE-SEP-YNL524HU7SZJPHMQ -p tcp -m comment --comment "default/kubernetes:https" -m recent --set --name KUBE-SEP-YNL524HU7SZJPHMQ --mask 255.255.255.255 --rsource -m tcp -j DNAT --to-destination 192.168.208.56:6443
-A KUBE-SERVICES ! -s 10.233.64.0/18 -d 10.233.0.3/32 -p tcp -m comment --comment "kube-system/kube-dns:dns-tcp cluster IP" -m tcp --dport 53 -j KUBE-MARK-MASQ
-A KUBE-SERVICES -d 10.233.0.3/32 -p tcp -m comment --comment "kube-system/kube-dns:dns-tcp cluster IP" -m tcp --dport 53 -j KUBE-SVC-ERIFXISQEP7F7OF4
-A KUBE-SERVICES ! -s 10.233.64.0/18 -d 10.233.21.12/32 -p tcp -m comment --comment "harbor/mysql: cluster IP" -m tcp --dport 3306 -j KUBE-MARK-MASQ
-A KUBE-SERVICES -d 10.233.21.12/32 -p tcp -m comment --comment "harbor/mysql: cluster IP" -m tcp --dport 3306 -j KUBE-SVC-K6LFF7JLEKVUKBYO
-A KUBE-SERVICES ! -s 10.233.64.0/18 -d 10.233.63.50/32 -p tcp -m comment --comment "smite-dev/smite-dashboard: cluster IP" -m tcp --dport 80 -j KUBE-MARK-MASQ
-A KUBE-SERVICES -d 10.233.63.50/32 -p tcp -m comment --comment "smite-dev/smite-dashboard: cluster IP" -m tcp --dport 80 -j KUBE-SVC-CRWJJGCDBVMFIXVA
-A KUBE-SERVICES ! -s 10.233.64.0/18 -d 10.233.42.236/32 -p tcp -m comment --comment "kube-system/traefik-ingress-service:web cluster IP" -m tcp --dport 80 -j KUBE-MARK-MASQ
-A KUBE-SERVICES -d 10.233.42.236/32 -p tcp -m comment --comment "kube-system/traefik-ingress-service:web cluster IP" -m tcp --dport 80 -j KUBE-SVC-7JSRZHB3YWVS5NMG
-A KUBE-SERVICES ! -s 10.233.64.0/18 -d 10.233.0.3/32 -p udp -m comment --comment "kube-system/kube-dns:dns cluster IP" -m udp --dport 53 -j KUBE-MARK-MASQ
-A KUBE-SERVICES -d 10.233.0.3/32 -p udp -m comment --comment "kube-system/kube-dns:dns cluster IP" -m udp --dport 53 -j KUBE-SVC-TCOU7JCQXEZGVUNU
-A KUBE-SERVICES ! -s 10.233.64.0/18 -d 10.233.32.80/32 -p tcp -m comment --comment "smite/jenkins:http cluster IP" -m tcp --dport 8080 -j KUBE-MARK-MASQ
-A KUBE-SERVICES -d 10.233.32.80/32 -p tcp -m comment --comment "smite/jenkins:http cluster IP" -m tcp --dport 8080 -j KUBE-SVC-3EMW2GIOYJV6DV6P
-A KUBE-SERVICES ! -s 10.233.64.0/18 -d 10.233.54.44/32 -p tcp -m comment --comment "kube-system/kubernetes-dashboard: cluster IP" -m tcp --dport 443 -j KUBE-MARK-MASQ
-A KUBE-SERVICES -d 10.233.54.44/32 -p tcp -m comment --comment "kube-system/kubernetes-dashboard: cluster IP" -m tcp --dport 443 -j KUBE-SVC-XGLOHA7QRQ3V22RZ
-A KUBE-SERVICES ! -s 10.233.64.0/18 -d 10.233.42.165/32 -p tcp -m comment --comment "kube-system/kibana-logging: cluster IP" -m tcp --dport 5601 -j KUBE-MARK-MASQ
-A KUBE-SERVICES -d 10.233.42.165/32 -p tcp -m comment --comment "kube-system/kibana-logging: cluster IP" -m tcp --dport 5601 -j KUBE-SVC-IUGSYNO5UD5ENGHX
-A KUBE-SERVICES ! -s 10.233.64.0/18 -d 10.233.25.169/32 -p tcp -m comment --comment "harbor/registry:repo cluster IP" -m tcp --dport 5000 -j KUBE-MARK-MASQ
-A KUBE-SERVICES -d 10.233.25.169/32 -p tcp -m comment --comment "harbor/registry:repo cluster IP" -m tcp --dport 5000 -j KUBE-SVC-RAMZCJSBPNWIXYA2
-A KUBE-SERVICES ! -s 10.233.64.0/18 -d 10.233.25.169/32 -p tcp -m comment --comment "harbor/registry:debug cluster IP" -m tcp --dport 5001 -j KUBE-MARK-MASQ
-A KUBE-SERVICES -d 10.233.25.169/32 -p tcp -m comment --comment "harbor/registry:debug cluster IP" -m tcp --dport 5001 -j KUBE-SVC-OKCWGTBEFYFSVC5R
-A KUBE-SERVICES ! -s 10.233.64.0/18 -d 10.233.61.83/32 -p tcp -m comment --comment "smite/gitlab:http cluster IP" -m tcp --dport 80 -j KUBE-MARK-MASQ
-A KUBE-SERVICES -d 10.233.61.83/32 -p tcp -m comment --comment "smite/gitlab:http cluster IP" -m tcp --dport 80 -j KUBE-SVC-PABR3NFC7GS2AXMO
-A KUBE-SERVICES ! -s 10.233.64.0/18 -d 10.233.0.1/32 -p tcp -m comment --comment "default/kubernetes:https cluster IP" -m tcp --dport 443 -j KUBE-MARK-MASQ
-A KUBE-SERVICES -d 10.233.0.1/32 -p tcp -m comment --comment "default/kubernetes:https cluster IP" -m tcp --dport 443 -j KUBE-SVC-NPX46M4PTMTKRN6Y
-A KUBE-SERVICES ! -s 10.233.64.0/18 -d 10.233.38.87/32 -p tcp -m comment --comment "smite-dev/icons: cluster IP" -m tcp --dport 80 -j KUBE-MARK-MASQ
-A KUBE-SERVICES -d 10.233.38.87/32 -p tcp -m comment --comment "smite-dev/icons: cluster IP" -m tcp --dport 80 -j KUBE-SVC-UPZVC57LUOMTRMRK
-A KUBE-SERVICES ! -s 10.233.64.0/18 -d 10.233.14.97/32 -p tcp -m comment --comment "smite/jenkins-discovery:slaves cluster IP" -m tcp --dport 50000 -j KUBE-MARK-MASQ
-A KUBE-SERVICES -d 10.233.14.97/32 -p tcp -m comment --comment "smite/jenkins-discovery:slaves cluster IP" -m tcp --dport 50000 -j KUBE-SVC-IH2USE34JSVI4TF3
-A KUBE-SERVICES ! -s 10.233.64.0/18 -d 10.233.16.65/32 -p tcp -m comment --comment "default/tuleap:http cluster IP" -m tcp --dport 443 -j KUBE-MARK-MASQ
-A KUBE-SERVICES -d 10.233.16.65/32 -p tcp -m comment --comment "default/tuleap:http cluster IP" -m tcp --dport 443 -j KUBE-SVC-HCVC6TOABECLZ4W4
-A KUBE-SERVICES ! -s 10.233.64.0/18 -d 10.233.27.27/32 -p tcp -m comment --comment "smite-system/nfs-server:rpcbind cluster IP" -m tcp --dport 111 -j KUBE-MARK-MASQ
-A KUBE-SERVICES -d 10.233.27.27/32 -p tcp -m comment --comment "smite-system/nfs-server:rpcbind cluster IP" -m tcp --dport 111 -j KUBE-SVC-GHDWXBAB74NXTXFO
-A KUBE-SERVICES ! -s 10.233.64.0/18 -d 10.233.3.88/32 -p tcp -m comment --comment "harbor/adminserver: cluster IP" -m tcp --dport 80 -j KUBE-MARK-MASQ
-A KUBE-SERVICES -d 10.233.3.88/32 -p tcp -m comment --comment "harbor/adminserver: cluster IP" -m tcp --dport 80 -j KUBE-SVC-746F6ZRPYFRHSEHO
-A KUBE-SERVICES ! -s 10.233.64.0/18 -d 10.233.57.234/32 -p tcp -m comment --comment "default/tuleapaio:http cluster IP" -m tcp --dport 443 -j KUBE-MARK-MASQ
-A KUBE-SERVICES -d 10.233.57.234/32 -p tcp -m comment --comment "default/tuleapaio:http cluster IP" -m tcp --dport 443 -j KUBE-SVC-PRL7IOKJSO52NZNU
-A KUBE-SERVICES ! -s 10.233.64.0/18 -d 10.233.27.27/32 -p udp -m comment --comment "smite-system/nfs-server:rpcbind-udp cluster IP" -m udp --dport 111 -j KUBE-MARK-MASQ
-A KUBE-SERVICES -d 10.233.27.27/32 -p udp -m comment --comment "smite-system/nfs-server:rpcbind-udp cluster IP" -m udp --dport 111 -j KUBE-SVC-PN5SYWD667INKCVX
-A KUBE-SERVICES ! -s 10.233.64.0/18 -d 10.233.26.210/32 -p tcp -m comment --comment "kube-system/elasticsearch-logging: cluster IP" -m tcp --dport 9200 -j KUBE-MARK-MASQ
-A KUBE-SERVICES -d 10.233.26.210/32 -p tcp -m comment --comment "kube-system/elasticsearch-logging: cluster IP" -m tcp --dport 9200 -j KUBE-SVC-7BB4GED2QYDGC4GN
-A KUBE-SERVICES ! -s 10.233.64.0/18 -d 10.233.46.197/32 -p tcp -m comment --comment "smite/nexus:http cluster IP" -m tcp --dport 8081 -j KUBE-MARK-MASQ
-A KUBE-SERVICES -d 10.233.46.197/32 -p tcp -m comment --comment "smite/nexus:http cluster IP" -m tcp --dport 8081 -j KUBE-SVC-LHC3WH7V526TOUDB
-A KUBE-SERVICES ! -s 10.233.64.0/18 -d 10.233.27.27/32 -p udp -m comment --comment "smite-system/nfs-server:mountd cluster IP" -m udp --dport 20048 -j KUBE-MARK-MASQ
-A KUBE-SERVICES -d 10.233.27.27/32 -p udp -m comment --comment "smite-system/nfs-server:mountd cluster IP" -m udp --dport 20048 -j KUBE-SVC-TL7S3KJ2EHWMKBKG
-A KUBE-SERVICES ! -s 10.233.64.0/18 -d 10.233.47.129/32 -p tcp -m comment --comment "smite/smite-userdoc: cluster IP" -m tcp --dport 80 -j KUBE-MARK-MASQ
-A KUBE-SERVICES -d 10.233.47.129/32 -p tcp -m comment --comment "smite/smite-userdoc: cluster IP" -m tcp --dport 80 -j KUBE-SVC-4UIPAYQ4VFPGRMA3
-A KUBE-SERVICES ! -s 10.233.64.0/18 -d 10.233.51.73/32 -p tcp -m comment --comment "harbor/ui: cluster IP" -m tcp --dport 80 -j KUBE-MARK-MASQ
-A KUBE-SERVICES -d 10.233.51.73/32 -p tcp -m comment --comment "harbor/ui: cluster IP" -m tcp --dport 80 -j KUBE-SVC-DYC3X2U4QOQRWYJ4
-A KUBE-SERVICES ! -s 10.233.64.0/18 -d 10.233.61.83/32 -p tcp -m comment --comment "smite/gitlab:ssh cluster IP" -m tcp --dport 22 -j KUBE-MARK-MASQ
-A KUBE-SERVICES -d 10.233.61.83/32 -p tcp -m comment --comment "smite/gitlab:ssh cluster IP" -m tcp --dport 22 -j KUBE-SVC-LZLNVMEVUXIQDPPT
-A KUBE-SERVICES ! -s 10.233.64.0/18 -d 10.233.0.2/32 -p tcp -m comment --comment "kube-system/dnsmasq:dns-tcp cluster IP" -m tcp --dport 53 -j KUBE-MARK-MASQ
-A KUBE-SERVICES -d 10.233.0.2/32 -p tcp -m comment --comment "kube-system/dnsmasq:dns-tcp cluster IP" -m tcp --dport 53 -j KUBE-SVC-CIGGPN5BGHD4S2O2
-A KUBE-SERVICES ! -s 10.233.64.0/18 -d 10.233.27.27/32 -p tcp -m comment --comment "smite-system/nfs-server:nfs cluster IP" -m tcp --dport 2049 -j KUBE-MARK-MASQ
-A KUBE-SERVICES -d 10.233.27.27/32 -p tcp -m comment --comment "smite-system/nfs-server:nfs cluster IP" -m tcp --dport 2049 -j KUBE-SVC-7N7DOC47XX3SKBHU
-A KUBE-SERVICES ! -s 10.233.64.0/18 -d 10.233.52.74/32 -p tcp -m comment --comment "default/mysql:mysql cluster IP" -m tcp --dport 3306 -j KUBE-MARK-MASQ
-A KUBE-SERVICES -d 10.233.52.74/32 -p tcp -m comment --comment "default/mysql:mysql cluster IP" -m tcp --dport 3306 -j KUBE-SVC-EM6TYMHOE4ZSTRV3
-A KUBE-SERVICES ! -s 10.233.64.0/18 -d 10.233.0.188/32 -p tcp -m comment --comment "harbor/jobservice: cluster IP" -m tcp --dport 80 -j KUBE-MARK-MASQ
-A KUBE-SERVICES -d 10.233.0.188/32 -p tcp -m comment --comment "harbor/jobservice: cluster IP" -m tcp --dport 80 -j KUBE-SVC-XD2YAFJEQKLZXVUY
-A KUBE-SERVICES ! -s 10.233.64.0/18 -d 10.233.0.2/32 -p udp -m comment --comment "kube-system/dnsmasq:dns cluster IP" -m udp --dport 53 -j KUBE-MARK-MASQ
-A KUBE-SERVICES -d 10.233.0.2/32 -p udp -m comment --comment "kube-system/dnsmasq:dns cluster IP" -m udp --dport 53 -j KUBE-SVC-UC7ZWITLXDTOOKDD
-A KUBE-SERVICES ! -s 10.233.64.0/18 -d 10.233.19.150/32 -p tcp -m comment --comment "smite-dev/smite-catalogmanager-kub:http cluster IP" -m tcp --dport 80 -j KUBE-MARK-MASQ
-A KUBE-SERVICES -d 10.233.19.150/32 -p tcp -m comment --comment "smite-dev/smite-catalogmanager-kub:http cluster IP" -m tcp --dport 80 -j KUBE-SVC-PW42KJPIFV7MGDAT
-A KUBE-SERVICES ! -s 10.233.64.0/18 -d 10.233.39.129/32 -p tcp -m comment --comment "default/cryptpad:web-main cluster IP" -m tcp --dport 80 -j KUBE-MARK-MASQ
-A KUBE-SERVICES -d 10.233.39.129/32 -p tcp -m comment --comment "default/cryptpad:web-main cluster IP" -m tcp --dport 80 -j KUBE-SVC-CSOELOHXXKRL37C3
-A KUBE-SERVICES ! -s 10.233.64.0/18 -d 10.233.27.89/32 -p tcp -m comment --comment "smite/gitlab-ssh: cluster IP" -m tcp --dport 22 -j KUBE-MARK-MASQ
-A KUBE-SERVICES -d 10.233.27.89/32 -p tcp -m comment --comment "smite/gitlab-ssh: cluster IP" -m tcp --dport 22 -j KUBE-SVC-QA35EJAD4VDJQPKE
-A KUBE-SERVICES ! -s 10.233.64.0/18 -d 10.233.43.97/32 -p tcp -m comment --comment "smite/adminserver: cluster IP" -m tcp --dport 80 -j KUBE-MARK-MASQ
-A KUBE-SERVICES -d 10.233.43.97/32 -p tcp -m comment --comment "smite/adminserver: cluster IP" -m tcp --dport 80 -j KUBE-SVC-TIPNCGI435UE6SEJ
-A KUBE-SERVICES ! -s 10.233.64.0/18 -d 10.233.18.89/32 -p tcp -m comment --comment "smite-system/keycloak:keycloak-port cluster IP" -m tcp --dport 8080 -j KUBE-MARK-MASQ
-A KUBE-SERVICES -d 10.233.18.89/32 -p tcp -m comment --comment "smite-system/keycloak:keycloak-port cluster IP" -m tcp --dport 8080 -j KUBE-SVC-VBJ4QIZYN3RXOSHM
-A KUBE-SERVICES ! -s 10.233.64.0/18 -d 10.233.6.58/32 -p tcp -m comment --comment "smite-dev/smite-platform-manager:http cluster IP" -m tcp --dport 80 -j KUBE-MARK-MASQ
-A KUBE-SERVICES -d 10.233.6.58/32 -p tcp -m comment --comment "smite-dev/smite-platform-manager:http cluster IP" -m tcp --dport 80 -j KUBE-SVC-F6MIP5BL4KIGTPW2
-A KUBE-SERVICES ! -s 10.233.64.0/18 -d 10.233.14.151/32 -p tcp -m comment --comment "smite-system/postgres:postgres-port cluster IP" -m tcp --dport 5432 -j KUBE-MARK-MASQ
-A KUBE-SERVICES -d 10.233.14.151/32 -p tcp -m comment --comment "smite-system/postgres:postgres-port cluster IP" -m tcp --dport 5432 -j KUBE-SVC-FVN42T4763IQ2F77
-A KUBE-SERVICES ! -s 10.233.64.0/18 -d 10.233.42.236/32 -p tcp -m comment --comment "kube-system/traefik-ingress-service:https cluster IP" -m tcp --dport 443 -j KUBE-MARK-MASQ
-A KUBE-SERVICES -d 10.233.42.236/32 -p tcp -m comment --comment "kube-system/traefik-ingress-service:https cluster IP" -m tcp --dport 443 -j KUBE-SVC-CNCAHLOUVJ7PHAAI
-A KUBE-SERVICES ! -s 10.233.64.0/18 -d 10.233.42.236/32 -p tcp -m comment --comment "kube-system/traefik-ingress-service:admin cluster IP" -m tcp --dport 8080 -j KUBE-MARK-MASQ
-A KUBE-SERVICES -d 10.233.42.236/32 -p tcp -m comment --comment "kube-system/traefik-ingress-service:admin cluster IP" -m tcp --dport 8080 -j KUBE-SVC-CK3M5ECVAI6WWQM4
-A KUBE-SERVICES -m comment --comment "kubernetes service nodeports; NOTE: this must be the last rule in this chain" -m addrtype --dst-type LOCAL -j KUBE-NODEPORTS
-A KUBE-SVC-3EMW2GIOYJV6DV6P -m comment --comment "smite/jenkins:http" -j KUBE-SEP-7MHPPFA55LZRYQOW
-A KUBE-SVC-746F6ZRPYFRHSEHO -m comment --comment "harbor/adminserver:" -j KUBE-SEP-4EHKXLE5VHDG42J5
-A KUBE-SVC-7JSRZHB3YWVS5NMG -m comment --comment "kube-system/traefik-ingress-service:web" -j KUBE-SEP-DIG4MWJEZZWPTOJH
-A KUBE-SVC-7N7DOC47XX3SKBHU -m comment --comment "smite-system/nfs-server:nfs" -j KUBE-SEP-CZXMNVU3IVX4KEEQ
-A KUBE-SVC-CIGGPN5BGHD4S2O2 -m comment --comment "kube-system/dnsmasq:dns-tcp" -j KUBE-SEP-PUAJTDNYVY3V6MKH
-A KUBE-SVC-CK3M5ECVAI6WWQM4 -m comment --comment "kube-system/traefik-ingress-service:admin" -j KUBE-SEP-XOSVT7Z52XY2S36L
-A KUBE-SVC-CNCAHLOUVJ7PHAAI -m comment --comment "kube-system/traefik-ingress-service:https" -j KUBE-SEP-4JKNAA2B4UPXDW5G
-A KUBE-SVC-CRWJJGCDBVMFIXVA -m comment --comment "smite-dev/smite-dashboard:" -j KUBE-SEP-XJRB2QTYRVEGTE22
-A KUBE-SVC-CSOELOHXXKRL37C3 -m comment --comment "default/cryptpad:web-main" -j KUBE-SEP-IO6RBDYHQLN6DY4B
-A KUBE-SVC-DYC3X2U4QOQRWYJ4 -m comment --comment "harbor/ui:" -j KUBE-SEP-NBOBBWQMYIZUB7ID
-A KUBE-SVC-EM6TYMHOE4ZSTRV3 -m comment --comment "default/mysql:mysql" -j KUBE-SEP-TM7T7G4JD5ZXZN6W
-A KUBE-SVC-ERIFXISQEP7F7OF4 -m comment --comment "kube-system/kube-dns:dns-tcp" -m statistic --mode random --probability 0.50000000000 -j KUBE-SEP-JGVHYOVPW5OESA7Z
-A KUBE-SVC-ERIFXISQEP7F7OF4 -m comment --comment "kube-system/kube-dns:dns-tcp" -j KUBE-SEP-2VJC5F6PRK3FGPVG
-A KUBE-SVC-F6MIP5BL4KIGTPW2 -m comment --comment "smite-dev/smite-platform-manager:http" -j KUBE-SEP-Y6VVM2YQXL2IHRSW
-A KUBE-SVC-FVN42T4763IQ2F77 -m comment --comment "smite-system/postgres:postgres-port" -j KUBE-SEP-HHWRRZBYQLZQJ225
-A KUBE-SVC-GHDWXBAB74NXTXFO -m comment --comment "smite-system/nfs-server:rpcbind" -j KUBE-SEP-GF25XEG6YTXELQT7
-A KUBE-SVC-IH2USE34JSVI4TF3 -m comment --comment "smite/jenkins-discovery:slaves" -j KUBE-SEP-KNJL7QRTFJBTG63C
-A KUBE-SVC-IUGSYNO5UD5ENGHX -m comment --comment "kube-system/kibana-logging:" -j KUBE-SEP-FC5ZU77S3BUATEMM
-A KUBE-SVC-K6LFF7JLEKVUKBYO -m comment --comment "harbor/mysql:" -j KUBE-SEP-FPT75KHDYZUSQJP7
-A KUBE-SVC-LHC3WH7V526TOUDB -m comment --comment "smite/nexus:http" -j KUBE-SEP-TUACV3TDKJ2EI53D
-A KUBE-SVC-LZLNVMEVUXIQDPPT -m comment --comment "smite/gitlab:ssh" -j KUBE-SEP-POOJN6MRS5DRA4XA
-A KUBE-SVC-NPX46M4PTMTKRN6Y -m comment --comment "default/kubernetes:https" -m recent --rcheck --seconds 10800 --reap --name KUBE-SEP-N2FW6LR47HXKQDAU --mask 255.255.255.255 --rsource -j KUBE-SEP-N2FW6LR47HXKQDAU
-A KUBE-SVC-NPX46M4PTMTKRN6Y -m comment --comment "default/kubernetes:https" -m recent --rcheck --seconds 10800 --reap --name KUBE-SEP-73LP22JIDB7YY2WJ --mask 255.255.255.255 --rsource -j KUBE-SEP-73LP22JIDB7YY2WJ
-A KUBE-SVC-NPX46M4PTMTKRN6Y -m comment --comment "default/kubernetes:https" -m recent --rcheck --seconds 10800 --reap --name KUBE-SEP-YNL524HU7SZJPHMQ --mask 255.255.255.255 --rsource -j KUBE-SEP-YNL524HU7SZJPHMQ
-A KUBE-SVC-NPX46M4PTMTKRN6Y -m comment --comment "default/kubernetes:https" -m statistic --mode random --probability 0.33332999982 -j KUBE-SEP-N2FW6LR47HXKQDAU
-A KUBE-SVC-NPX46M4PTMTKRN6Y -m comment --comment "default/kubernetes:https" -m statistic --mode random --probability 0.50000000000 -j KUBE-SEP-73LP22JIDB7YY2WJ
-A KUBE-SVC-NPX46M4PTMTKRN6Y -m comment --comment "default/kubernetes:https" -j KUBE-SEP-YNL524HU7SZJPHMQ
-A KUBE-SVC-OKCWGTBEFYFSVC5R -m comment --comment "harbor/registry:debug" -j KUBE-SEP-GWY4IUD5SUBB2T4Z
-A KUBE-SVC-PABR3NFC7GS2AXMO -m comment --comment "smite/gitlab:http" -j KUBE-SEP-T6XDO7QEGVQO6LTB
-A KUBE-SVC-PN5SYWD667INKCVX -m comment --comment "smite-system/nfs-server:rpcbind-udp" -j KUBE-SEP-BQC3IR7N2BBET7T5
-A KUBE-SVC-PW42KJPIFV7MGDAT -m comment --comment "smite-dev/smite-catalogmanager-kub:http" -j KUBE-SEP-DPH2B5MHGQLUAOOD
-A KUBE-SVC-QA35EJAD4VDJQPKE -m comment --comment "smite/gitlab-ssh:" -j KUBE-SEP-UZULZIKFKX4ITZWG
-A KUBE-SVC-RAMZCJSBPNWIXYA2 -m comment --comment "harbor/registry:repo" -j KUBE-SEP-HWWDE2JGX5GVQO5J
-A KUBE-SVC-TCOU7JCQXEZGVUNU -m comment --comment "kube-system/kube-dns:dns" -m statistic --mode random --probability 0.50000000000 -j KUBE-SEP-GZHGDJUOJR25QI6N
-A KUBE-SVC-TCOU7JCQXEZGVUNU -m comment --comment "kube-system/kube-dns:dns" -j KUBE-SEP-CV6GQPBOPUIIFZ2I
-A KUBE-SVC-TL7S3KJ2EHWMKBKG -m comment --comment "smite-system/nfs-server:mountd" -j KUBE-SEP-SI6EG4KG5E6UUKMY
-A KUBE-SVC-UC7ZWITLXDTOOKDD -m comment --comment "kube-system/dnsmasq:dns" -j KUBE-SEP-QD27AIGGVHAVDZLA
-A KUBE-SVC-UPZVC57LUOMTRMRK -m comment --comment "smite-dev/icons:" -j KUBE-SEP-ASXYRB67UC44QYEA
-A KUBE-SVC-VBJ4QIZYN3RXOSHM -m comment --comment "smite-system/keycloak:keycloak-port" -j KUBE-SEP-NWQ3MFDD3KUIBNNS
-A KUBE-SVC-XD2YAFJEQKLZXVUY -m comment --comment "harbor/jobservice:" -j KUBE-SEP-FGGHAQ5WM5YEAYAJ
-A KUBE-SVC-XGLOHA7QRQ3V22RZ -m comment --comment "kube-system/kubernetes-dashboard:" -j KUBE-SEP-JZ5MWR6UBCXYKHIX
-A WEAVE -s 10.233.64.0/18 -d 224.0.0.0/4 -j RETURN
-A WEAVE ! -s 10.233.64.0/18 -d 10.233.64.0/18 -j MASQUERADE
-A WEAVE -s 10.233.64.0/18 ! -d 10.233.64.0/18 -j MASQUERADE
COMMIT
# Completed on Thu Mar 29 09:17:17 2018
# Generated by iptables-save v1.4.21 on Thu Mar 29 09:17:17 2018
*filter
:INPUT ACCEPT [3909:1083630]
:FORWARD ACCEPT [0:0]
:OUTPUT ACCEPT [3813:1027989]
:DOCKER-USER - [0:0]
:KUBE-FIREWALL - [0:0]
:KUBE-FORWARD - [0:0]
:KUBE-SERVICES - [0:0]
:WEAVE-IPSEC-IN - [0:0]
:WEAVE-NPC - [0:0]
:WEAVE-NPC-DEFAULT - [0:0]
:WEAVE-NPC-INGRESS - [0:0]
-A INPUT -m comment --comment "kubernetes service portals" -j KUBE-SERVICES
-A INPUT -j KUBE-FIREWALL
-A INPUT -j WEAVE-IPSEC-IN
-A FORWARD -m comment --comment "kubernetes forward rules" -j KUBE-FORWARD
-A FORWARD -j DOCKER-USER
-A FORWARD -o weave -j WEAVE-NPC
-A FORWARD -o weave -m state --state NEW -j NFLOG --nflog-group 86
-A FORWARD -o weave -j DROP
-A FORWARD -i weave ! -o weave -j ACCEPT
-A FORWARD -o weave -m conntrack --ctstate RELATED,ESTABLISHED -j ACCEPT
-A OUTPUT -m comment --comment "kubernetes service portals" -j KUBE-SERVICES
-A OUTPUT -j KUBE-FIREWALL
-A OUTPUT ! -p esp -m policy --dir out --pol none -m mark --mark 0x20000/0x20000 -j DROP
-A DOCKER-USER -j RETURN
-A KUBE-FIREWALL -m comment --comment "kubernetes firewall for dropping marked packets" -m mark --mark 0x8000/0x8000 -j DROP
-A KUBE-FORWARD -m comment --comment "kubernetes forwarding rules" -m mark --mark 0x4000/0x4000 -j ACCEPT
-A KUBE-FORWARD -s 10.233.64.0/18 -m comment --comment "kubernetes forwarding conntrack pod source rule" -m conntrack --ctstate RELATED,ESTABLISHED -j ACCEPT
-A KUBE-FORWARD -d 10.233.64.0/18 -m comment --comment "kubernetes forwarding conntrack pod destination rule" -m conntrack --ctstate RELATED,ESTABLISHED -j ACCEPT
-A KUBE-SERVICES -p tcp -m comment --comment "default/tuleap:http has no endpoints" -m addrtype --dst-type LOCAL -m tcp --dport 31703 -j REJECT --reject-with icmp-port-unreachable
-A KUBE-SERVICES -d 10.233.16.65/32 -p tcp -m comment --comment "default/tuleap:http has no endpoints" -m tcp --dport 443 -j REJECT --reject-with icmp-port-unreachable
-A KUBE-SERVICES -p tcp -m comment --comment "default/tuleapaio:http has no endpoints" -m addrtype --dst-type LOCAL -m tcp --dport 31581 -j REJECT --reject-with icmp-port-unreachable
-A KUBE-SERVICES -d 10.233.57.234/32 -p tcp -m comment --comment "default/tuleapaio:http has no endpoints" -m tcp --dport 443 -j REJECT --reject-with icmp-port-unreachable
-A KUBE-SERVICES -d 10.233.26.210/32 -p tcp -m comment --comment "kube-system/elasticsearch-logging: has no endpoints" -m tcp --dport 9200 -j REJECT --reject-with icmp-port-unreachable
-A KUBE-SERVICES -d 10.233.47.129/32 -p tcp -m comment --comment "smite/smite-userdoc: has no endpoints" -m tcp --dport 80 -j REJECT --reject-with icmp-port-unreachable
-A KUBE-SERVICES -d 10.233.43.97/32 -p tcp -m comment --comment "smite/adminserver: has no endpoints" -m tcp --dport 80 -j REJECT --reject-with icmp-port-unreachable
-A WEAVE-IPSEC-IN -s 192.168.208.50/32 -d 192.168.208.56/32 -p udp -m udp --dport 6784 -m mark ! --mark 0x20000/0x20000 -j DROP
-A WEAVE-IPSEC-IN -s 192.168.208.12/32 -d 192.168.208.56/32 -p udp -m udp --dport 6784 -m mark ! --mark 0x20000/0x20000 -j DROP
-A WEAVE-NPC -m state --state RELATED,ESTABLISHED -j ACCEPT
-A WEAVE-NPC -d 224.0.0.0/4 -j ACCEPT
-A WEAVE-NPC -m state --state NEW -j WEAVE-NPC-DEFAULT
-A WEAVE-NPC -m state --state NEW -j WEAVE-NPC-INGRESS
-A WEAVE-NPC -m set ! --match-set weave-local-pods dst -j ACCEPT
-A WEAVE-NPC-DEFAULT -m set --match-set weave-WzG?.a)!_aLyzRqn%zBvT)fQ_ dst -m comment --comment "DefaultAllow isolation for namespace: build-system" -j ACCEPT
-A WEAVE-NPC-DEFAULT -m set --match-set weave-4vtqMI+kx/2]jD%_c0S%thO%V dst -m comment --comment "DefaultAllow isolation for namespace: kube-public" -j ACCEPT
-A WEAVE-NPC-DEFAULT -m set --match-set weave-8npL$iRec;^W12!Pb:B5*QruE dst -m comment --comment "DefaultAllow isolation for namespace: smite-system" -j ACCEPT
-A WEAVE-NPC-DEFAULT -m set --match-set weave-OKycOK4Gzkl*vg|+dh2J%XVUm dst -m comment --comment "DefaultAllow isolation for namespace: smite" -j ACCEPT
-A WEAVE-NPC-DEFAULT -m set --match-set weave-k?Z;25^M}|1s7P3|H9i;*;MhG dst -m comment --comment "DefaultAllow isolation for namespace: default" -j ACCEPT
-A WEAVE-NPC-DEFAULT -m set --match-set weave-gG+[sJ66YAb3ml3)b}!)JX47o dst -m comment --comment "DefaultAllow isolation for namespace: harbor" -j ACCEPT
-A WEAVE-NPC-DEFAULT -m set --match-set weave-iuZcey(5DeXbzgRFs8Szo]+@p dst -m comment --comment "DefaultAllow isolation for namespace: kube-system" -j ACCEPT
-A WEAVE-NPC-DEFAULT -m set --match-set weave-~]f;yGw*0|4otcT}UlS#5S+8j dst -m comment --comment "DefaultAllow isolation for namespace: dev" -j ACCEPT
-A WEAVE-NPC-DEFAULT -m set --match-set weave-h+6$h$S;p]X5[7Cn@Nn@l:V]Q dst -m comment --comment "DefaultAllow isolation for namespace: smite-dev" -j ACCEPT
-A WEAVE-NPC-DEFAULT -m set --match-set weave-MQaD6$6qG*JURh!;}4A{XPz?F dst -m comment --comment "DefaultAllow isolation for namespace: buildslaves" -j ACCEPT
COMMIT
# Completed on Thu Mar 29 09:17:17 2018

```

I'm not sure but maybe iptable is preventing the communication?

**Comment by bboreham** [comment]
This says the packet reached your external interface:

```
# tcpdump -n -i eth0 icmp
dropped privs to tcpdump
tcpdump: verbose output suppressed, use -v or -vv for full protocol decode
listening on eth0, link-type EN10MB (Ethernet), capture size 262144 bytes
08:48:00.813755 IP 172.17.0.3 > 8.8.8.8: ICMP echo request, id 256, seq 0, length 64
08:48:01.814015 IP 172.17.0.3 > 8.8.8.8: ICMP echo request, id 256, seq 1, length 64
```

However it has the Docker IP address, so most likely your network doesn't know how to route the reply.  It's traditional to "masquerade" that IP address to the host address via NAT.

In Docker this is controlled by the `--ip-masq` setting, however Kubernetes installations sometimes use other components such as `ip-masq-agent`.  I don't know much of the background to why this is done in different ways.

So: check your `--ip-masq` setting; if it's `false` then that's why you see the symptoms described.

**Comment by neith00** [comment]
--ip-masq is set to true (its the default but I also added it explicitly)

**Comment by bboreham** [comment]
ah, how about `--iptabels` ?

**Comment by neith00** [comment]
bingo --iptables was set to false!
