### ISSUE TITLE
Nodes frequently loose the ability to connect to other pods

### ISSUE THREAD

**Issue by raffis** [weaveworks/weave#3856]
## What happened?
We have randomly pods not being reachable by other nodes on the same kubernetes cluster. Also the node which has the fault weave-net pod also isn't able to reach pods on other nodes
but can reach pods placed on itself by itself. The only solution so far is to manually kill the faulty weave-net pods.

Symptoms:
* faulty node can't access any pods placed on other nodes
* faulty node can access pods on itself, which also means probes are successful, pods don't get removed from service routing and so on...
* other nodes can't access pods placed on the fault node
* weave-net /status health check is okay
* A removal of the faulty weave-net pod resolves the problem
* Sometimes the liveness probe for /status ends in a timeout therefore the pod gets removed automatically and the problem get solved. However this is the less often occurring case.
* The node itself is reachable by other nodes (but not the pods), the weave networking device is affected

This problem occurred on our staging cluster lately quite often and at some point on multiple nodes at the same time!
 Also we had this issue less often on our production cluster.

We upgraded to k8s v1.16.10 / kops v1.16.3 a couple of weeks ago however the problem starting to occur quite often only last week.

We had weave 2.6.0 running and upgraded because of this problem to v2.6.5 and afterwards (still with the same problem) to v2.7.0.
Even after the v2.7.0 upgrade we have this problem.

Also on another cluster where we had this issue once was weave-net v2.5.2 deployed however we can't say for 100% that this was exactly the same problem but it had the same symptoms as listed above.

## How to reproduce it?
Since the problem is randomly it's going to be difficult to reproduce.

## Anything else we need to know?
**Cloud provider**: AWS
**KOPS**: 1.16.3
**DaemonSet YAML**: https://gist.github.com/raffis/73dee969c600c834ae29407a928ba52f

The cluster where we are experience this problem quite often now is much more dynamic (node auto scaling) and we have much more nodes being added and removed compared to the
cluster which is more stable in number of nodes (but where we had this problem at least once also, see description above).

Also according to our metrics the problem is not in relation with any resource limits (memory/cpu).

Another symptom we have seen is that connections are established as sleeve `./weave --local status connections` on a faulty one even though they should be `fastdp`?
See https://gist.github.com/raffis/bf5d2e9db1e151fcf3f7c7f2326b0cd4

## Versions:

$ weave version
v2.7.0 (As mentioned above same problem with v2.6.5, v2.6.0 and probably v2.5.2)

$ docker version

```
$Client:
 Version:           18.09.9
 API version:       1.39
 Go version:        go1.11.13
 Git commit:        039a7df9ba
 Built:             Wed Sep  4 16:52:00 2019
 OS/Arch:           linux/amd64
 Experimental:      false

Server: Docker Engine - Community
 Engine:
  Version:          18.09.9
  API version:      1.39 (minimum version 1.12)
  Go version:       go1.11.13
  Git commit:       039a7df
  Built:            Wed Sep  4 16:19:38 2019
  OS/Arch:          linux/amd64
  Experimental:     false
```

$ uname -a
`Linux ip-172-20-121-105 4.9.0-11-amd64 #1 SMP Debian 4.9.189-3+deb9u1 (2019-09-20) x86_64 GNU/Linux`

$ kubectl version
```
Server Version: version.Info{Major:"1", Minor:"16", GitVersion:"v1.16.10", GitCommit:"f3add640dbcd4f3c33a7749f38baaac0b3fe810d", GitTreeState:"clean", BuildDate:"2020-05-20T13:51:56Z", GoVersion:"go1.13.9", Compiler:"gc", Platform:"linux/amd64"}
```

## Logs:
weave:
https://gist.github.com/raffis/13f910d8eb1d2f903158b14daa543ad7

## Network:
$ ip route

```
default via 172.20.96.1 dev eth0 
100.96.0.0/11 dev weave proto kernel scope link src 100.116.192.0 
172.17.0.0/16 dev docker0 proto kernel scope link src 172.17.0.1 linkdown 
172.20.96.0/19 dev eth0 proto kernel scope link src 172.20.121.105
```

$ ip -4 -o addr

```
1: lo    inet 127.0.0.1/8 scope host lo\       valid_lft forever preferred_lft forever
2: eth0    inet 172.20.121.105/19 brd 172.20.127.255 scope global eth0\       valid_lft forever preferred_lft forever
3: docker0    inet 172.17.0.1/16 brd 172.17.255.255 scope global docker0\       valid_lft forever preferred_lft forever
6: weave    inet 100.116.192.0/11 brd 100.127.255.255 scope global weave\       valid_lft forever preferred_lft forever
```

## More context

ARP table on a faulty node:
```
$ arp
Address                  HWtype  HWaddress           Flags Mask            Iface
ip-172-20-106-80.eu-cen  ether   0a:97:ff:e6:34:c2   C                     eth0
ip-172-20-102-79.eu-cen  ether   0a:b1:bb:18:91:74   C                     eth0
ip-172-20-127-19.eu-cen  ether   0a:e9:07:13:68:f0   C                     eth0
100.112.192.8                    (incomplete)                              weave
ip-172-20-117-193.eu-ce  ether   0a:85:6e:78:86:8e   C                     eth0
ip-172-20-114-145.eu-ce  ether   0a:db:ca:a1:9a:42   C                     eth0
ip-172-20-124-102.eu-ce  ether   0a:c8:c0:90:bc:8e   C                     eth0
100.102.160.5                    (incomplete)                              weave
ip-172-20-121-79.eu-cen  ether   0a:bb:23:1b:11:90   C                     eth0
ip-172-20-101-94.eu-cen  ether   0a:a8:df:67:ea:3a   C                     eth0
100.125.224.9                    (incomplete)                              weave
100.104.160.3            ether   4e:1d:a9:d1:8d:b5   C                     weave
100.104.160.1            ether   1a:25:67:ae:78:39   C                     weave
100.97.64.2                      (incomplete)                              weave
100.119.32.14                    (incomplete)                              weave
100.116.192.19           ether   0a:f9:2c:70:b7:7b   C                     weave
ip-172-20-103-82.eu-cen  ether   0a:42:ec:45:0d:f4   C                     eth0
100.116.192.15           ether   fa:78:8b:79:a2:a2   C                     weave
100.116.192.13           ether   46:25:dc:9c:7e:96   C                     weave
100.116.192.7            ether   56:36:9b:76:ef:57   C                     weave
100.116.192.5            ether   be:29:1a:61:a1:29   C                     weave
ip-172-20-112-136.eu-ce  ether   0a:57:6d:8d:a4:ac   C                     eth0
ip-172-20-96-1.eu-centr  ether   0a:bd:0d:0a:af:ee   C                     eth0
ip-172-20-119-131.eu-ce  ether   0a:cf:0f:b8:13:d6   C                     eth0
100.127.224.5                    (incomplete)                              weave
ip-172-20-107-41.eu-cen  ether   0a:b5:b4:5d:40:2e   C                     eth0
ip-172-20-99-142.eu-cen  ether   0a:0e:34:b8:be:4c   C                     eth0
ip-172-20-115-227.eu-ce  ether   0a:87:b0:e0:d5:c2   C                     eth0
100.104.160.2            ether   c2:d0:df:2c:c4:fe   C                     weave
100.104.160.0            ether   02:0c:67:ae:46:a5   C                     weave
100.104.160.4            ether   2a:68:37:c5:a8:6e   C                     weave
ip-172-20-116-206.eu-ce  ether   0a:69:d5:65:b0:da   C                     eth0
100.116.192.32           ether   be:80:3a:3b:ee:81   C                     weave
ip-172-20-97-46.eu-cent  ether   0a:62:b0:97:fb:f4   C                     eth0
100.116.192.26           ether   72:80:3c:52:0c:17   C                     weave
ip-172-20-122-100.eu-ce  ether   0a:d5:03:a1:c7:f0   C                     eth0
ip-172-20-117-130.eu-ce  ether   0a:21:a2:3e:fd:ec   C                     eth0
ip-172-20-124-59.eu-cen  ether   0a:2d:8c:76:9a:de   C                     eth0
100.102.96.33                    (incomplete)                              weave
100.116.192.18           ether   5e:86:e5:5f:b1:46   C                     weave
100.116.192.22           ether   4e:41:4e:af:9a:fd   C                     weave
100.116.192.14           ether   7e:c5:01:5c:51:5f   C                     weave
100.116.192.6            ether   36:e0:53:8a:82:9c   C                     weave
```

bridges:
```
$ brctl show
bridge name	bridge id		STP enabled	interfaces
docker0		8000.02422abac3d2	no		
weave		8000.9a550a3bd1fd	no		vethwe-bridge
							vethwepl0801e0b
							vethwepl10c50d2
							vethwepl1a485bd
							vethwepl2073557
							vethwepl4286b33
							vethwepl4459136
							vethwepl54c5b87
							vethwepl5da8a3b
							vethwepl644a5e9
							vethwepl6ba9f90
							vethwepl7863f51
							vethwepl8b80835
							vethwepl9867f61
							vethweplc66f235
							vethweplc992014
							vethwepld58e6c1
							vethwepldeaaa8d
							vethweple01d428
							vethweple2486aa
							vethweple716d19
```

If I ping one pod on this faulty node from another working node the ARP entry doesn't get created even though the faulty node with that pod has the entry, see above:
``` arp | grep 100.104.160.1
100.104.160.1                    (incomplete)                              weave
```

tcpdump on the faulty node: 
```
tcpdump -i any arp | grep 100.104.160.1
tcpdump: verbose output suppressed, use -v or -vv for full protocol decode
listening on any, link-type LINUX_SLL (Linux cooked), capture size 262144 bytes


10:06:29.607211 ARP, Request who-has 100.104.160.1 tell 100.101.0.0, length 28
10:06:29.607234 ARP, Request who-has 100.104.160.1 tell 100.101.0.0, length 28
10:06:29.607236 ARP, Request who-has 100.104.160.1 tell 100.101.0.0, length 28
10:06:29.607247 ARP, Request who-has 100.104.160.1 tell 100.101.0.0, length 28
10:06:29.607250 ARP, Request who-has 100.104.160.1 tell 100.101.0.0, length 28
10:06:29.607254 ARP, Request who-has 100.104.160.1 tell 100.101.0.0, length 28
10:06:29.607257 ARP, Request who-has 100.104.160.1 tell 100.101.0.0, length 28
10:06:29.607260 ARP, Request who-has 100.104.160.1 tell 100.101.0.0, length 28
10:06:29.607263 ARP, Request who-has 100.104.160.1 tell 100.101.0.0, length 28
10:06:29.607267 ARP, Request who-has 100.104.160.1 tell 100.101.0.0, length 28
10:06:29.607269 ARP, Request who-has 100.104.160.1 tell 100.101.0.0, length 28
10:06:29.607273 ARP, Request who-has 100.104.160.1 tell 100.101.0.0, length 28
10:06:29.607276 ARP, Request who-has 100.104.160.1 tell 100.101.0.0, length 28
10:06:29.607279 ARP, Request who-has 100.104.160.1 tell 100.101.0.0, length 28
10:06:29.607283 ARP, Request who-has 100.104.160.1 tell 100.101.0.0, length 28
10:06:29.607298 ARP, Request who-has 100.104.160.1 tell 100.101.0.0, length 28
10:06:29.607301 ARP, Request who-has 100.104.160.1 tell 100.101.0.0, length 28
10:06:29.607304 ARP, Request who-has 100.104.160.1 tell 100.101.0.0, length 28
10:06:29.607307 ARP, Request who-has 100.104.160.1 tell 100.101.0.0, length 28
10:06:29.607309 ARP, Request who-has 100.104.160.1 tell 100.101.0.0, length 28
10:06:29.607312 ARP, Request who-has 100.104.160.1 tell 100.101.0.0, length 28
10:06:29.607315 ARP, Request who-has 100.104.160.1 tell 100.101.0.0, length 28
10:06:29.607317 ARP, Request who-has 100.104.160.1 tell 100.101.0.0, length 28
10:06:29.607236 ARP, Request who-has 100.104.160.1 tell 100.101.0.0, length 28
10:06:29.607334 ARP, Reply 100.104.160.1 is-at 1a:25:67:ae:78:39 (oui Unknown), length 28
10:06:29.607379 ARP, Reply 100.104.160.1 is-at 1a:25:67:ae:78:39 (oui Unknown), length 28
10:06:29.607380 ARP, Reply 100.104.160.1 is-at 1a:25:67:ae:78:39 (oui Unknown), length 28
10:06:30.635376 ARP, Request who-has 100.104.160.1 tell 100.101.0.0, length 28
10:06:30.635397 ARP, Request who-has 100.104.160.1 tell 100.101.0.0, length 28
10:06:30.635398 ARP, Request who-has 100.104.160.1 tell 100.101.0.0, length 28
10:06:30.635407 ARP, Request who-has 100.104.160.1 tell 100.101.0.0, length 28
10:06:30.635410 ARP, Request who-has 100.104.160.1 tell 100.101.0.0, length 28
10:06:30.635413 ARP, Request who-has 100.104.160.1 tell 100.101.0.0, length 28
10:06:30.635416 ARP, Request who-has 100.104.160.1 tell 100.101.0.0, length 28
10:06:30.635418 ARP, Request who-has 100.104.160.1 tell 100.101.0.0, length 28
10:06:30.635421 ARP, Request who-has 100.104.160.1 tell 100.101.0.0, length 28
10:06:30.635424 ARP, Request who-has 100.104.160.1 tell 100.101.0.0, length 28
10:06:30.635427 ARP, Request who-has 100.104.160.1 tell 100.101.0.0, length 28
10:06:30.635429 ARP, Request who-has 100.104.160.1 tell 100.101.0.0, length 28
10:06:30.635432 ARP, Request who-has 100.104.160.1 tell 100.101.0.0, length 28
10:06:30.635435 ARP, Request who-has 100.104.160.1 tell 100.101.0.0, length 28
10:06:30.635438 ARP, Request who-has 100.104.160.1 tell 100.101.0.0, length 28
10:06:30.635441 ARP, Request who-has 100.104.160.1 tell 100.101.0.0, length 28
10:06:30.635443 ARP, Request who-has 100.104.160.1 tell 100.101.0.0, length 28
10:06:30.635445 ARP, Request who-has 100.104.160.1 tell 100.101.0.0, length 28
10:06:30.635449 ARP, Request who-has 100.104.160.1 tell 100.101.0.0, length 28
10:06:30.635451 ARP, Request who-has 100.104.160.1 tell 100.101.0.0, length 28
10:06:30.635454 ARP, Request who-has 100.104.160.1 tell 100.101.0.0, length 28
10:06:30.635457 ARP, Request who-has 100.104.160.1 tell 100.101.0.0, length 28
10:06:30.635460 ARP, Request who-has 100.104.160.1 tell 100.101.0.0, length 28
10:06:30.635398 ARP, Request who-has 100.104.160.1 tell 100.101.0.0, length 28
10:06:30.635494 ARP, Reply 100.104.160.1 is-at 1a:25:67:ae:78:39 (oui Unknown), length 28
10:06:30.635542 ARP, Reply 100.104.160.1 is-at 1a:25:67:ae:78:39 (oui Unknown), length 28
10:06:30.635544 ARP, Reply 100.104.160.1 is-at 1a:25:67:ae:78:39 (oui Unknown), length 28
10:06:31.651894 ARP, Request who-has 100.104.160.1 tell 100.101.0.0, length 28
10:06:31.651917 ARP, Request who-has 100.104.160.1 tell 100.101.0.0, length 28
10:06:31.651919 ARP, Request who-has 100.104.160.1 tell 100.101.0.0, length 28
10:06:31.651927 ARP, Request who-has 100.104.160.1 tell 100.101.0.0, length 28
10:06:31.651930 ARP, Request who-has 100.104.160.1 tell 100.101.0.0, length 28
10:06:31.651933 ARP, Request who-has 100.104.160.1 tell 100.101.0.0, length 28
10:06:31.651936 ARP, Request who-has 100.104.160.1 tell 100.101.0.0, length 28
```

  However it's not really ARP related. If we create a manual ARP entry we obviously see the incoming ICMP packets on the faulty node but still don't see a reply:
```
tcpdump -i any icmp | grep 100.104.160.1

10:09:12.163799 IP 100.101.0.0 > 100.104.160.1: ICMP echo request, id 972, seq 28, length 64
10:09:12.163802 IP 100.101.0.0 > 100.104.160.1: ICMP echo request, id 972, seq 28, length 64
10:09:12.163819 IP 100.101.0.0 > 100.104.160.1: ICMP echo request, id 972, seq 28, length 64
10:09:13.187766 IP 100.101.0.0 > 100.104.160.1: ICMP echo request, id 972, seq 29, length 64
10:09:13.187780 IP 100.101.0.0 > 100.104.160.1: ICMP echo request, id 972, seq 29, length 64
10:09:13.187782 IP 100.101.0.0 > 100.104.160.1: ICMP echo request, id 972, seq 29, length 64
10:09:13.187797 IP 100.101.0.0 > 100.104.160.1: ICMP echo request, id 972, seq 29, length 64
10:09:14.214557 IP 100.101.0.0 > 100.104.160.1: ICMP echo request, id 972, seq 30, length 64
10:09:14.214567 IP 100.101.0.0 > 100.104.160.1: ICMP echo request, id 972, seq 30, length 64
10:09:14.214569 IP 100.101.0.0 > 100.104.160.1: ICMP echo request, id 972, seq 30, length 64
10:09:14.214583 IP 100.101.0.0 > 100.104.160.1: ICMP echo request, id 972, seq 30, length 64
10:09:15.235608 IP 100.101.0.0 > 100.104.160.1: ICMP echo request, id 972, seq 31, length 64
10:09:15.235618 IP 100.101.0.0 > 100.104.160.1: ICMP echo request, id 972, seq 31, length 64
10:09:15.235619 IP 100.101.0.0 > 100.104.160.1: ICMP echo request, id 972, seq 31, length 64
10:09:15.235632 IP 100.101.0.0 > 100.104.160.1: ICMP echo request, id 972, seq 31, length 64
10:09:16.259429 IP 100.101.0.0 > 100.104.160.1: ICMP echo request, id 972, seq 32, length 64
10:09:16.259433 IP 100.101.0.0 > 100.104.160.1: ICMP echo request, id 972, seq 32, length 64
10:09:16.259446 IP 100.101.0.0 > 100.104.160.1: ICMP echo request, id 972, seq 32, length 64
10:09:16.259473 IP 100.101.0.0 > 100.104.160.1: ICMP echo request, id 972, seq 32, length 64
```

As soon as we delete the pod, everything works again (on the affected node).
But as said this is occurring quite often now and our network within that cluster is quite unstable.

It appears we're not the only ones having such problems. For example #3641 sounds quite similar.

**Comment by raffis** [comment]
We most likely solved this issue by a full reset of weave, here is what we did:

1. Remove ds with weave 2.7.0
2. Remove all weave db's from each node part of the cluster
3. Add ds with weave 2.5.2

The version rollback was only done because our current kops version is bound to 2.5.2 and not latest weave but this likely did not solve the problem, the removal of all weave db's while not having any weave running most likely solved our issue.

**Comment by raffis** [comment]
Another update, we had an older image with an older kernel version `kope.io/k8s-1.15-debian-stretch-amd64-hvm-ebs-2019-09-26` running, since we upgraded to a 5.x kernel (ubuntu 20.04) this problem is completely gone.
